"STUDY_ID","REVIEWERS","INCLUDE","REVIEWERS","INCLUDE","STUDY_ID","AUTHORS","YEAR","TITLE","JOURNAL","VOLUME","LPAGES","UPAGES","DOI","ABSTRACT"
147,"Darren","not vetted",NA,"not vetted",147,"COOKE S;BERGMAN J;NYBOER A;GALLAGHER A;HAMMERSCHLAG N;VAN ;DE R K;VERMAIRE J",2020,"OVERCOMING THE CONCRETE CONQUEST OF AQUATIC ECOSYSTEMS","BIOLOGICAL CONSERVATION","247",NA,NA,"10.1016/j.biocon.2020.108589","IN REFLECTING ON THE HUMAN DOMINATION OF OUR PLANET IN THE ANTHROPOCENE, SOME HAVE ARGUED THAT CONCRETE IS AMONG THE MOST DESTRUCTIVE MATERIALS CREATED BY HUMANS. HERE WE EXPLORE THIS IDEA, SPECIFICALLY IN THE CONTEXT OF WHAT WE CONSIDER ``THE CONCRETE CONQUEST OF AQUATIC ECOSYSTEMS.'' THE UBIQUITOUS USE OF CONCRETE IN TRANSPORTATION AND BUILDING INFRASTRUCTURE HAS CONTRIBUTED TO ALTERATIONS IN FRESHWATER AND COASTAL MARINE SYSTEMS. YET, IN SOME CASES, THERE ARE NO APPROPRIATE ALTERNATIVE BUILDING MATERIALS SUCH THAT CONCRETE ITSELF IS CONFOUNDED BY ITS APPLICATION. FOR EXAMPLE, AS THE FOUNDATION FOR MOST DAMS, CONCRETE FRAGMENTS RIVERS AND CHANNELIZES STREAMS, OFTEN CREATING UNNATURAL SYSTEMS, YET DAMS ARE NECESSARY FOR HYDROPOWER GENERATION AND FLOOD CONTROL WITH FEW ALTERNATIVE MATERIALS FOR CONSTRUCTION. IN RIPARIAN AND COASTAL ENVIRONMENTS, CONCRETE HARBOURS AND INLAND CANAL SYSTEMS ARE OFTEN USED TO ADDRESS EROSION OR RECLAIM AREAS FOR HUMAN DEVELOPMENT. EVEN WHEN REMOVED (E.G., DAM REMOVAL, NATURALIZATION OF SHORELINES), CONCRETE DUST IS A MAJOR AQUATIC POLLUTANT. INSTANCES DO EXIST, HOWEVER, WHERE CONCRETE HAS BEEN USED TO BENEFIT AQUATIC ECOSYSTEMS - SUCH AS THE INSTALLATION OF FISH PASSAGE FACILITIES AT BARRIERS OR THE DEVELOPMENT OF FISH-FRIENDLY CULVERTS - THOUGH EVEN THEN, THERE IS A MOVEMENT TOWARDS NATURE-LIKE FISHWAYS THAT AVOID THE USE OF HARMFUL MATERIALS LIKE CONCRETE. THERE ARE ALSO OPPORTUNITIES TO ACHIEVE CONSERVATION GAINS IN THE DEVELOPMENT OF SEAWALLS THAT INCLUDE MORE NATURAL AND COMPLEX FEATURES TO BENEFIT BIOTA AND ALLOW FOR ESSENTIAL BIOGEOCHEMICAL PROCESSES TO OCCUR IN AQUATIC ENVIRONMENTS. THERE HAVE BEEN SEVERAL INNOVATIONS IN RECENT YEARS THAT INCREASE THE PERMEABILITY OF CONCRETE, HOWEVER THESE HAVE LIMITED APPLICATION IN AN AQUATIC CONTEXT (E.G., NOT RELEVANT TO DAM CONSTRUCTION OR EROSION CONTROL BUT MAY BE RELEVANT IN STORMWATER MANAGEMENT SYSTEMS). WE PROVIDE A BRIEF OVERVIEW OF THE HISTORY OF CONCRETE, DISCUSS SOME OF THE DIRECT AND INDIRECT EFFECTS OF CONCRETE ON AQUATIC ECOSYSTEMS, AND ENCOURAGE PLANNERS, ENGINEERS, DEVELOPERS, AND REGULATORS TO WORK COLLABORATIVELY TO EXPLORE ALTERNATIVES TO CONCRETE WHICH BENEFIT AQUATIC ECOSYSTEMS AND THE SERVICES THEY OFFER. THE STATUS QUO OF CONCRETE BEING THE DEFAULT CONSTRUCTION MATERIAL IS FAILING AQUATIC ECOSYSTEMS, SO WE RECOMMEND THAT EFFORTS ARE MADE TO EXPLORE ALTERNATIVE MATERIALS AND IF CONCRETE MUST BE USED, TO INCREASE STRUCTURAL COMPLEXITY TO BENEFIT BIODIVERSITY."
148,"Darren","not vetted",NA,"not vetted",148,"KRAHNER A;SCHMIDT J;MAIXNER M;PORTEN M;SCHMITT T",2021,"EVALUATION OF FOUR DIFFERENT METHODS FOR ASSESSING BEE DIVERSITY AS ECOLOGICAL INDICATORS OF AGROECOSYSTEMS","ECOLOGICAL INDICATORS","125",NA,NA,"10.1016/j.ecolind.2021.107573","MONITORING OF WILD BEES IS BECOMING MORE AND MORE POPULAR IN NATURE CONSERVATION BECAUSE OF THE HIGH INDICATOR VALUE OF THIS INSECT GROUP. HOWEVER, UNCERTAINTIES ABOUT THE SAMPLING PERFORMANCE OF DIFFERENT METHODS STILL EXIST, ESPECIALLY IN AREAS OF LIMITED ACCESSIBILITY. WE THEREFORE COMPARED FOUR COMMONLY APPLIED SAMPLING METHODS ACROSS VINEYARD FALLOWS IN A SPECIES DIVERSE STUDY AREA OVER TWO SUCCESSIVE YEARS: HAND NETTING ALONG VARIABLE TRANSECTS (HN), PAN TRAPS (PT), TRAP NESTS (TN) AND MALAISE TRAPS (MT). THE CHOSEN METHOD SIGNIFICANTLY AFFECTS THE NUMBER OF SAMPLED BEE SPECIES AND INDIVIDUALS, WITH PT SAMPLING BY FAR THE LARGEST NUMBER OF SPECIES AND INDIVIDUALS, AND HN SAMPLING THE MOST DIVERSE BEE FAUNA. HN SAMPLES CONTAINED A SIGNIFICANTLY HIGHER PROPORTION OF MALES, RED-LISTED, LARGE AND SOCIAL BOMBUS SPECIES THAN PT, BUT HN AND PT SAMPLES CONTAINED A SIGNIFICANTLY LOWER PROPORTION OF MALE INDIVIDUALS COMPARED TO MT AND TN. PT COLOUR HAD A SIGNIFICANT EFFECT ON THE NUMBER OF SAMPLED INDIVIDUALS AND SPECIES, WITH YELLOW PT SAMPLING THE LARGEST NUMBERS, WHILE BLUE PT SAMPLED THE LARGEST NUMBER OF INDIVIDUALS OF SOCIAL BOMBUS SPECIES. THE HN SAMPLING RESULTS OF AN EXPERIENCED AND A LESS-EXPERIENCED OBSERVER DIFFERED REMARKABLY, WITH THE TURNOVER COMPONENT OF THE JACCARD DISTANCE BEING SIGNIFICANTLY HIGHER COMPARED TO THE NESTEDNESS COMPONENT. OUR FINDINGS INDICATE THAT PT WAS THE MOST EFFICIENT METHOD FOR SAMPLING BEES IN OUR STUDY SYSTEM. DUE TO SPECIES-SPECIFIC DIFFERENCES IN ATTRACTIVITY, SETS OF DIFFERENT PT COLOURS SHOULD BE USED. HOWEVER, IF THE STUDY FOCUS IS ON RED-LISTED SPECIES OR MALE INDIVIDUALS, HN REPRESENTS A MORE EFFICIENT METHOD. WHEN HN IS APPLIED, OBSERVER BIAS SHOULD BE CONSIDERED AS MUCH AS POSSIBLE, ESPECIALLY WITH REGARD TO DIFFERENCES IN SAMPLING EXPERIENCE. DUE TO DIFFERENT SHORTCOMINGS, MT AND TN CANNOT BE SEEN AS APPROPRIATE METHODS FOR STANDARD MONITORING OF BEES."
149,"Darren","not vetted",NA,"not vetted",149,"SANARE J;VALLI D;LEWERI C;GLATZER G;FISHLOCK V;TREYDTE A",2022,"A SOCIOECOLOGICAL APPROACH TO UNDERSTANDING HOW LAND USE CHALLENGES HUMANELEPHANT COEXISTENCE IN NORTHERN TANZANIA","DIVERSITY-BASEL","14",NA,NA,"10.3390/d14070513","A GLOBALLY RAPID LAND USE/LAND COVER CHANGE (LULC) IN HUMAN-TRANSFORMED LANDSCAPES ALTERS THE INTERFACE OF HUMAN-WILDLIFE INTERACTIONS DUE TO SHIFTING SOCIO-ECOLOGICAL AND ENVIRONMENTAL PRESSURES. UNDERSTANDING THESE SHIFTS IS CRUCIAL FOR MITIGATING REPEATED NEGATIVE INTERACTIONS THAT ESCALATE CONFLICT STATES BETWEEN PEOPLE AND WILDLIFE. THIS STUDY AIMED TO UNDERSTAND LULC CHANGES OVER 30 YEARS (1989-2019), WITH MORE RECENT SPATIO-TEMPORAL PATTERNS OF HIGH PRESSURE AT THE HUMAN-ELEPHANT INTERFACE, AND POTENTIALLY UNDERLYING ENVIRONMENTAL AND HUMAN-DRIVEN FACTORS THAT AFFECT ELEPHANT MOVEMENT PATTERNS. WE ANALYZED A DATASET OF 923 HUMAN-ELEPHANT CONFLICT OCCURRENCES, MAINLY CROP FORAGING INCIDENTS, IN THE ENDUIMET WILDLIFE MANAGEMENT AREA (EWMA) BETWEEN THE YEARS 2016 AND 2020 AND COMBINED THESE DATA WITH LULC FOR YEAR 2019 TO UNDERSTAND POTENTIAL DRIVERS OF CONFLICT AND ASSESS HOW AGRICULTURAL LAND AND SETTLEMENT HAVE INCREASED OVER TIME. WE FURTHER USED GPS DATASETS OF ELEPHANTS COLLARED BETWEEN 2019 TO 2020 TO UNDERSTAND ELEPHANT MOVEMENT PATTERNS IN CHANGING LAND USE TYPES. LANDSAT IMAGE ANALYSIS REVEALED THAT 41\% OF THE AREA HAD BEEN CONVERTED INTO FARMLANDS AND SETTLEMENTS WITHIN THE LAST THREE DECADES, WHICH CREATES ELEPHANT-INTOLERANT HABITATS AND THE POTENTIAL TO INCREASE PRESSURE AT THE HUMAN-ELEPHANT INTERFACE. COLLARED ELEPHANTS USING EWMA MOVED THROUGH ALL LAND USE TYPES AND DID NOT AVOID SETTLEMENTS, ALTHOUGH THEY MOVED THROUGH THESE AT HIGHER SPEEDS, REFLECTING PERCEPTION OF RISK. ELEPHANTS TRAVELLED SLIGHTLY MORE SLOWLY IN FARMLAND, LIKELY REFLECTING THE AVAILABILITY OF FORAGING OPPORTUNITIES. OUR ANALYSIS SHOWS THAT HUMAN-INDUCED LULC CHANGES AND THE ENCROACHMENT INTO ELEPHANT HABITATS HAVE RESULTED IN SPATIALLY AND TEMPORALLY PREDICTABLE INCREASES IN HEC IN EWMA, DRIVEN BY THE PROXIMITY OF FARMLANDS AND PROTECTED AREAS (PAS), SO THAT INCOMPATIBLE LAND USES ARE THE PRINCIPAL DRIVERS OF DAMAGE TO HUMAN LIVELIHOODS AND INCREASED RISKS TO TANZANIAN (AND KENYAN) NATURAL CAPITAL. COMMUNITIES IN ENDUIMET URGENTLY NEED SUPPORT TO INCREASE THE EFFECTIVE DISTANCE BETWEEN THEIR FARMING ACTIVITIES AND THE PAS. VILLAGE-LEVEL CROP PROTECTION AND SMALL-SCALE LAND-USE PLANNING AROUND PAS ARE IMPORTANT FIRST STEPS TO HALT AN ESCALATING CONFLICT SITUATION BUT NEED TO BE SUPPORTED WITH LONGER-RANGE STRATEGIES THAT SEPARATE INCOMPATIBLE LAND-USE TYPES AND ENCOURAGE THE CULTIVATION OF ALTERNATIVE CROPS AND LIVELIHOOD DIVERSIFICATION."
153,"Darren","not vetted",NA,"not vetted",153,"MOLDOVAN O;IEPURE S;BRAD T;KENESZ M;MIREA I;NASTASE-BUCUR R",2020,"DATABASE OF ROMANIAN CAVE INVERTEBRATES WITH A RED LIST OF CAVE SPECIES AND A LIST OF HOTSPOTCOLDSPOT CAVES","BIODIVERSITY DATA JOURNAL","8",NA,NA,"10.3897/BDJ.8.e53571","BACKGROUND THE INCREASING HUMAN IMPACT IN ROMANIAN CAVES RAISES THE URGENCY OF PUBLISHING A CORRECT DATABASE OF THE STRICTLY-ADAPTED CAVE FAUNA. PREVIOUS ATTEMPTS AT INDEXING CAVE FAUNA AND CLASSIFYING CAVES BY USING THEIR FAUNA OPENED MANY QUESTIONS REGARDING THE USE OF AN INCOMPLETE LIST OF CAVE SPECIES AND MIXED LISTS OF TROGLOBIONTS/STYGOBIONTS WITH TROGLOPHILES/STYGOPHILES FOR RANKING CAVES WITH PRIORITY FOR PROTECTION. IT HAS ALSO BECOME OBVIOUS THAT THERE IS A NEED TO PUBLISH A LIST OF ROMANIAN CAVE SPECIES THAT ARE UNDER THREAT. CAVE SPECIES IN ROMANIA (AND ELSEWHERE) ARE ENDEMIC ON SMALL RANGES, ARE UNIQUE AND MUST BE CONSIDERED AS IMPORTANT UNITS FOR CONSERVATION. A CAVE MUST BE EQUALLY PROTECTED IF IT HAS ONE OR MORE RARE AND STRICTLY ENDEMIC CAVE SPECIES. ALTHOUGH NOT EXHAUSTIVE, WE HERE PROVIDE THE FIRST CHECKLIST OF ROMANIAN TROGLOBIONTS/STYGOBIONTS DEVELOPED IN THE FRAMEWORK OF THE DARKFOOD AND GROUNDWATERISK PROJECTS, COORDINATED BY THE ``EMIL RACOVITA'' INSTITUTE OF SPELEOLOGY, CLUJ-NAPOCA, ROMANIA. THE GIS APPLICATION WAS USED TO COMPLEMENT THE CHECKLIST OF CAVE SPECIES WITH DATA ON CAVES AND SURFACE ENVIRONMENTS ABOVE THE CAVES. UNTIL COMPLETE DATA ON SPECIES DIVERSITY AND POPULATION SIZES ARE MADE AVAILABLE FOR EACH CAVE, MEASURES OF CONSERVATION CAN BE IMPLEMENTED, BASED ON THE PRESENCE/ABSENCE OF CAVE SPECIES, WHILE CLASSIFICATIONS OF CAVES FOR PROTECTION, BASED ON THE NUMBER OF SPECIES, MUST BE AVOIDED. WE ALSO PROPOSE A LIST OF ROMANIAN CAVES WITH FAUNA THAT ARE UNDER THREAT AND A TENTATIVE RED LIST OF ROMANIAN TROGLOBIONT/STYGOBIONTS. NEW INFORMATION THIS IS THE FIRST DATABASE WITH IDENTIFIED TROGLOBIONT AND STYGOBIONT SPECIES OF ROMANIA, WITH A CRITICAL ANALYSIS OF THEIR DISTRIBUTION INSIDE THE COUNTRY. A LIST OF CAVES THAT NEED PROTECTION FOR THEIR RARE AND UNIQUE SPECIES AND A TENTATIVE RED LIST OF ROMANIAN CAVE FAUNA ARE ALSO ADDED. A TOTAL OF 173 SPECIES WERE IDENTIFIED, OF WHICH 77 TROGLOBIONTS AND 96 STYGOBIONTS ARE CURRENTLY REGISTERED IN 366 CAVES. THE DATABASE IS DIVIDED INTO TWO PARTS, ONE PART WITH A LIST OF TROGLOBIONTS, THEIR REVISED SYSTEMATIC POSITION, CAVE NAME, CAVE CODE AND GEOGRAPHIC REGION; AND THE SECOND PART WITH THE SAME INFORMATION ON STYGOBIONTS. THE DATABASE REPRESENTS THE CONTRIBUTION OF MANY ACTIVE RESEARCHERS, WHO ARE THE AUTHORS OF THIS PAPER AND OF REVIEW PUBLICATIONS OF MANY OTHER AUTHORS OF THE ``EMIL RACOVITA'' INSTITUTE OF SPELEOLOGY."
156,"Darren","not vetted",NA,"not vetted",156,"ROGERS N;URBINALT M;REARDON D;WILSONL R",2016,"A NEW ANALYSIS OF HYPOXIA TOLERANCE IN FISHES USING A DATABASE OF CRITICAL OXYGEN LEVEL PCRIT","CONSERVATION PHYSIOLOGY","4",NA,NA,"10.1093/conphys/cow012","HYPOXIA IS A COMMON OCCURRENCE IN AQUATIC HABITATS, AND IT IS BECOMING AN INCREASINGLY FREQUENT AND WIDESPREAD ENVIRONMENTAL PERTURBATION, PRIMARILY AS THE RESULT OF ANTHROPOGENIC NUTRIENT ENRICHMENT AND CLIMATE CHANGE. AN IN-DEPTH UNDERSTANDING OF THE HYPOXIA TOLERANCE OF FISHES, AND HOW THIS VARIES AMONG INDIVIDUALS AND SPECIES, IS REQUIRED TO MAKE ACCURATE PREDICTIONS OF FUTURE ECOLOGICAL IMPACTS AND TO PROVIDE BETTER INFORMATION FOR CONSERVATION AND FISHERIES MANAGEMENT. THE CRITICAL OXYGEN LEVEL (P-CRIT)M HAS BEEN WIDELY USED AS A QUANTIFIABLE TRAIT OF HYPOXIA TOLERANCE. IT IS DEFINED AS THE OXYGEN LEVEL BELOW WHICH THE ANIMAL CAN NO LONGER MAINTAIN A STABLE RATE OF OXYGEN UPTAKE (OXYREGULATE) AND UPTAKE BECOMES DEPENDENT ON AMBIENT OXYGEN AVAILABILITY (THE ANIMAL TRANSITIONS TO OXYCONFORMING). A COMPREHENSIVE DATABASE OF P-CRIT VALUES, COMPRISING 331 MEASUREMENTS FROM 96 PUBLISHED STUDIES, COVERING 151 FISH SPECIES FROM 58 FAMILIES, PROVIDES THE MOST EXTENSIVE AND UP-TO-DATE ANALYSIS OF HYPOXIA TOLERANCE IN TELEOSTS. METHODOLOGIES FOR DETERMINING PCRIT ARE CRITICALLY EXAMINED TO EVALUATE ITS USEFULNESS AS AN INDICATOR OF HYPOXIA TOLERANCE IN FISHES. VARIOUS ABIOTIC AND BIOTIC FACTORS THAT INTERACT WITH HYPOXIA ARE ANALYSED FOR THEIR EFFECT ON P, INCLUDING TEMPERATURE, CO,, ACIDIFICATION, TOXIC METALS AND FEEDING. SALINITY, TEMPERATURE, BODY MASS AND ROUTINE METABOLIC RATE WERE STRONGLY CORRELATED WITH P-CRIT; 20\% OF VARIATION IN THE P-CRIT, DATA SET WAS EXPLAINED BY THESE FOUR VARIABLES. AN IMPORTANT METHODOLOGICAL ISSUE NOT PREVIOUSLY CONSIDERED IS THE INCONSISTENT INCREASE IN PARTIAL PRESSURE OF CO, WITHIN A CLOSED RESPIROMETER DURING THE MEASUREMENT OF P-CRIT. MODELLING SUGGESTS THAT THE FINAL PARTIAL PRESSURE OF CO, REACHED CAN VARY FROM 650 TO 3500 MU ATM DEPENDING ON THE AMBIENT PH AND SALINITY, WITH POTENTIALLY MAJOR EFFECTS ON BLOOD ACID-BASE BALANCE AND P IT ITSELF. THIS DATABASE WILL FORM PART OF A WIDELY ACCESSIBLE REPOSITORY OF PHYSIOLOGICAL TRAIT DATA THAT WILL SERVE AS A RESOURCE TO FACILITATE FUTURE STUDIES OF FISH ECOLOGY, CONSERVATION AND MANAGEMENT."
158,"Darren","not vetted",NA,"not vetted",158,"HARTWAY C;MILLS L",2012,"A METAANALYSIS OF THE EFFECTS OF COMMON MANAGEMENT ACTIONS ON THE NEST SUCCESS OF NORTH AMERICAN BIRDS","CONSERVATION BIOLOGY","26","657-666","657-666","10.1111/j.1523-1739.2012.01883.x","MANAGEMENT STRATEGIES FOR THE RECOVERY OF DECLINING BIRD POPULATIONS OFTEN MUST BE MADE WITHOUT SUFFICIENT DATA TO PREDICT THE OUTCOME OF PROPOSED ACTIONS OR SUFFICIENT TIME AND RESOURCES NECESSARY TO COLLECT THESE DATA. WE QUANTITATIVELY REVIEWED STUDIES OF BIRD MANAGEMENT IN CANADA AND THE UNITED STATES TO EVALUATE THE RELATIVE EFFICACY OF 4 COMMON MANAGEMENT INTERVENTIONS AND TO DETERMINE VARIABLES ASSOCIATED WITH THEIR SUCCESS. WE COMPARED HOW LIVESTOCK EXCLUSION, PRESCRIBED BURNING, REMOVAL OF PREDATORS, AND REMOVAL OF COWBIRDS (MOLOTHRUS ATER) AFFECT BIRD NEST SUCCESS AND USED META-REGRESSION TO EVALUATE THE INFLUENCE OF SPECIES AND STUDY-SPECIFIC COVARIATES ON MANAGEMENT OUTCOMES. ON AVERAGE, ALL 4 MANAGEMENT INTERVENTIONS INCREASED NEST SUCCESS. WHEN COMMON SPECIES AND THREATENED, ENDANGERED, OR DECLINING SPECIES (AS DEFINED BY LONG-TERM TREND DATA FROM THE NORTH AMERICAN BREEDING BIRD SURVEY) WERE ANALYZED TOGETHER, PREDATOR REMOVAL WAS THE MOST EFFECTIVE MANAGEMENT OPTION. THE DIFFERENCE IN MEAN NEST SUCCESS BETWEEN TREATMENT AND CONTROL PLOTS IN PREDATOR-REMOVAL EXPERIMENTS WAS MORE THAN TWICE THAT OF EITHER LIVESTOCK EXCLUSION OR PRESCRIBED BURNING. HOWEVER, WHEN WE CONSIDERED MANAGEMENT OUTCOMES FROM ONLY THREATENED, ENDANGERED, OR DECLINING SPECIES, LIVESTOCK EXCLUSIONS RESULTED IN THE GREATEST MEAN INCREASE IN NEST SUCCESS, MORE THAN TWICE THAT OF THE 3 OTHER TREATMENTS. OUR META-REGRESSION RESULTS INDICATED THAT BETWEEN-SPECIES VARIATION ACCOUNTED FOR APPROXIMATELY 86\%, 40\%, 35\%, AND 7\% OF THE OVERALL VARIATION IN THE RESULTS OF LIVESTOCK-EXCLUSION, PRESCRIBED-BURN, PREDATOR-REMOVAL, AND COWBIRD-REMOVAL STUDIES, RESPECTIVELY. HOWEVER, THE COVARIATES WE TESTED EXPLAINED SIGNIFICANT VARIATION ONLY IN OUTCOMES AMONG PRESCRIBED-BURN STUDIES. THE DIFFERENCE IN NEST SUCCESS BETWEEN BURNED AND UNBURNED PLOTS DISPLAYED A SIGNIFICANT, POSITIVE TREND IN ASSOCIATION WITH TIME SINCE FIRE AND WAS SIGNIFICANTLY LARGER IN GRASSLANDS THAN IN WOODLANDS. OUR RESULTS HIGHLIGHT THE IMPORTANCE OF COMPARATIVE STUDIES ON MANAGEMENT EFFECTS IN DEVELOPING EFFICIENT AND EFFECTIVE CONSERVATION STRATEGIES."
160,"Darren","not vetted",NA,"not vetted",160,"RODRIGUES M;BOS A;SCHEMBRI P;DE ;LIMA R;LYMBERAKIS P;PARPAL L;CENTO M;RUETTE S;OZKURT S;SANTOS-REIS M;MERILA J;FERNANDES C",2017,"ORIGIN AND INTRODUCTION HISTORY OF THE LEAST WEASEL MUSTELA NIVALIS ON MEDITERRANEAN AND ATLANTIC ISLANDS INFERRED FROM GENETIC DATA","BIOLOGICAL INVASIONS","19","399-421","399-421","10.1007/s10530-016-1287-y","INTRODUCED MAMMALIAN PREDATORS HAVE NEGATIVELY AFFECTED NATIVE BIOTA AND ECOLOGICAL PROCESSES IN ECOSYSTEMS ACROSS THE GLOBE. THE LEAST WEASEL (MUSTELA NIVALIS) IS A HOLARCTIC MUSTELID CARNIVORE THAT HAS BEEN CONSIDERED ONE OF THE WORLD'S WORST INVASIVE ALIEN SPECIES. IT HAS BEEN INTRODUCED TO SEVERAL ISLANDS IN THE MEDITERRANEAN SEA AND ATLANTIC OCEAN, AND HERE WE PRESENT A GENETIC ANALYSIS OF THESE INSULAR POPULATIONS, BASED ON MITOCHONDRIAL DNA AND MICROSATELLITES AND BUILDING UPON A PREVIOUS WESTERN PALEARCTIC PHYLOGEOGRAPHIC STUDY, WITH THE AIM OF INFERRING THEIR ORIGIN AND INTRODUCTION HISTORY. THIS IS ESSENTIAL INFORMATION FOR ECOLOGICAL AND EVOLUTIONARY STUDIES OF THOSE POPULATIONS AND OUR UNDERSTANDING OF THEIR IMPACTS ON THE ISLANDS' BIODIVERSITY. AMONG THE MEDITERRANEAN INSULAR POPULATIONS, A SUBSTANTIAL MITOCHONDRIAL SUBDIVISION BETWEEN WEASELS IN SICILY-CORSICA AND MALTA-SARDINIA-BALEARICS IS BEST EXPLAINED BY A DUAL COLONIZATION ORIGINATING FROM THE EASTERN MEDITERRANEAN. GIVEN THE CORRESPONDENCE BETWEEN THE OBSERVED GENETIC PARTITION AND THE DIFFERENTIAL GEOGRAPHIC DISTRIBUTION OF GREEK AND PHOENICIAN SETTLEMENTS AND INFLUENCE DURING THE LAST MILLENNIUM BC IN THOSE ISLANDS, WE PROPOSE THAT WEASELS MAY HAVE BEEN INTRODUCED INTO THE FIRST GROUP OF ISLANDS BY THE GREEKS AND INTO THE SECOND GROUP BY THE PHOENICIANS. THERE IS STRONG SUPPORT THAT THE COMMERCIAL AND DEMOGRAPHIC EXPANSIONS OF PHOENICIANS AND GREEKS ALLOWED THE COLONIZATION OF THE WESTERN MEDITERRANEAN ISLANDS BY THE HOUSE MOUSE, AND TEXTS FROM CLASSICAL ANTIQUITY SHOW EVIDENCE THAT WEASELS WERE USED FOR RODENT CONTROL. THUS, WEASELS MAY HAVE BEEN INTENTIONALLY INTRODUCED TO THE ISLANDS, WITH THE AIM OF CONTROLLING COMMENSAL RODENTS. BESIDES INDICATING EASTERN MEDITERRANEAN ORIGINS FOR WEASELS IN MEDITERRANEAN ISLANDS, THE MITOCHONDRIAL DATA ALSO REVEALED AN UNANTICIPATED CLOSE GENEALOGICAL CONNECTION BETWEEN SOME OF THESE POPULATIONS AND THOSE FROM THE AZORES AND SO TOM,. THE LATTER ISLAND POPULATIONS SHOWED NO AFFINITIES WITH WEASELS FROM MAINLAND PORTUGAL, CONTRARY TO WHAT MIGHT HAVE BEEN EXPECTED GIVEN THAT THESE ATLANTIC ISLANDS WERE SETTLED BY THE PORTUGUESE. THE MICROSATELLITE DATA ALSO SUPPORTED THE RELATIONSHIP BETWEEN WEASELS IN ATLANTIC AND IN MEDITERRANEAN ISLANDS. CONSIDERING GEOGRAPHIC PROXIMITY AND HISTORICAL INFORMATION, THE MOST PARSIMONIOUS EXPLANATION FOR THE ORIGIN OF THE ATLANTIC WEASELS APPEARS TO BE INTRODUCTION FROM THE BALEARIC ISLANDS TO THE AZORES AND FROM THERE TO SAO TOME."
161,"Darren","not vetted",NA,"not vetted",161,"RALLS K;SUNNUCKS P;LACY R;FRANKHAM R",2020,"GENETIC RESCUE A CRITIQUE OF THE EVIDENCE SUPPORTS MAXIMIZING GENETIC DIVERSITY RATHER THAN MINIMIZING THE INTRODUCTION OF PUTATIVELY HARMFUL GENETIC VARIATION","BIOLOGICAL CONSERVATION","251",NA,NA,"10.1016/j.biocon.2020.108784","GENETIC RESCUE - AMELIORATING INBREEDING DEPRESSION AND RESTORING GENETIC DIVERSITY OF INBRED POPULATIONS THROUGH GENE FLOW - IS VALUABLE IN WILDLIFE CONSERVATION. EMPIRICALLY VALIDATED RECOMMENDATIONS FOR GENETIC RESCUE SUPPORTED BY EVOLUTIONARY GENETICS THEORY ADVISE MAXIMIZING GENETIC DIVERSITY IN TARGET POPULATIONS. INSTEAD, RECENT PAPERS BASED ON GENOMIC STUDIES OF ISLAND FOXES, ISLE ROYAL WOLVES, AND SIMULATION MODELING CLAIM IT WOULD BE PREFERABLE TO MINIMIZE INTRODUCTION OF HARMFUL VARIATION BY AVOIDING GENETIC RESCUE ALTOGETHER OR BY SELECTING PARTIALLY-INBRED SOURCES PRESUMED TO HAVE FEWER HARMFUL ALLELES. WE EXAMINED THE ASSERTIONS AND EVIDENCE UNDERLYING THESE NEW RECOMMENDATIONS. THE CLAIM THAT LONG-TERM PERSISTENCE OF A FEW SMALL INBRED POPULATIONS INVALIDATES THE SMALL POPULATION PARADIGM COMMITS THE SURVIVORSHIP FALLACY BY IGNORING POPULATION EXTINCTIONS THROUGH INBREEDING. THE CLAIM THAT ISLAND FOXES SHOW NO INBREEDING DEPRESSION CONFLICTS WITH ELEVATED LEVELS OF PUTATIVELY HARMFUL ALLELES, LOW FECUNDITY, AND ISLAND-SPECIFIC DISEASE SUSCEPTIBILITIES. THE CLAIM THAT THE HISTORY OF ISLE ROYALE WOLVES REPRESENTS LIKELY OUTCOMES OF GENETIC RESCUES USING IMMIGRANTS FROM LARGER SOURCE POPULATIONS IS INVALID: THE UNPLANNED ADDITION OF A SINGLE MALE TO AN INBRED POPULATION CAPPED AT SIMILAR TO 25 INDIVIDUALS DOES NOT REPRESENT SOUND GENETIC RESCUE. THE SIMULATIONS IN ROBINSON ET AL. (2018, 2019) AND KYRIAZIS ET AL. (2019 PRE-PRINT) APPLY SEVERAL UNREALISTIC ASSUMPTIONS AND PARAMETER DISTRIBUTIONS THAT DISFAVOR LARGE, OUTBRED SOURCES FOR GENETIC RESCUE. ACCORDINGLY, THE SIMULATIONS' CONCLUSIONS CONFLICT PROFOUNDLY WITH THOSE OF > 120 META-ANALYSED REAL DATASETS, AND DO NOT OVERTURN CURRENT EMPIRICALLY VALIDATED RECOMMENDATIONS TO MAXIMIZE GENETIC DIVERSITY IN THE TARGET POPULATION."
164,"Darren","not vetted",NA,"not vetted",164,"MENSCH E;KRONENBERGER J;BRODER E;FITZPATRICK S;FUNK W;ANGELONI L",2019,"A POTENTIAL ROLE FOR IMMIGRANT REPRODUCTIVE BEHAVIOR IN THE OUTCOME OF POPULATION AUGMENTATIONS","ANIMAL CONSERVATION","22","463-471","463-471","10.1111/acv.12486","AUGMENTING WILD POPULATIONS WITH TRANSLOCATED INDIVIDUALS IS A POWERFUL CONSERVATION TOOL TO ACHIEVE GENETIC RESCUE, BUT LITTLE IS KNOWN ABOUT THE ROLE MATING BEHAVIOR PLAYS IN THE SUCCESS OF AUGMENTATION EFFORTS. WE STUDIED THE BEHAVIOR OF MALE TRINIDADIAN GUPPIES POECILIA RETICULATA INTRODUCED INTO EXPERIMENTAL MESOCOSM POPULATIONS AND ASSESSED WHETHER MATING BEHAVIOR INFLUENCED REPRODUCTIVE SUCCESS. A PREVIOUSLY PUBLISHED ANALYSIS OF THE SAME EXPERIMENT FOUND THAT POPULATIONS FROM THE QUARE RIVER HAD HIGHER IMMIGRANT REPRODUCTIVE SUCCESS THAN POPULATIONS FROM THE MARIANNE RIVER, CONTRIBUTING TO HIGHER POPULATION FITNESS FOLLOWING AUGMENTATION. HOWEVER, THE REASON FOR HIGH IMMIGRANT REPRODUCTIVE SUCCESS REMAINED UNCLEAR. OUR BEHAVIORAL OBSERVATIONS OF A SUBSET OF THOSE POPULATIONS REVEALED THAT IMMIGRANT MALES FROM QUARE (BUT NOT MARIANNE) PERFORMED MORE SEXUAL DISPLAYS AND FORCED COPULATIONS AND HAD MARGINALLY HIGHER REPRODUCTIVE SUCCESS THAN RESIDENT MALES. THESE RESULTS, COMBINED WITH SIGNIFICANT DIFFERENCES IN REPRODUCTIVE SUCCESS AND POPULATION FITNESS REPORTED IN THE PREVIOUS STUDY, SUGGEST THAT MATING BEHAVIOR MAY HAVE IMPROVED THE OUTCOME OF AUGMENTATION BY INCREASING GENETIC ADMIXTURE. WE URGE WILDLIFE MANAGERS AND RESEARCHERS TO CONSIDER MATING BEHAVIOR AS A FACTOR INFLUENCING AUGMENTATION SUCCESS."
165,"Darren","not vetted",NA,"not vetted",165,"KING T;LUBINSKI B;BURNHAM-CURTIS M;STOTT W;MORGAN R",2012,"TOOLS FOR THE MANAGEMENT AND CONSERVATION OF GENETIC DIVERSITY IN BROOK TROUT SALVELINUS FONTINALIS TRI AND TETRANUCLEOTIDE MICROSATELLITE MARKERS FOR THE ASSESSMENT OF GENETIC DIVERSITY PHYLOGEOGRAPHY AND HISTORICAL DEMOGRAPHICS","CONSERVATION GENETICS RESOURCES","4","539-543","539-543","10.1007/s12686-012-9603-z","WE DOCUMENT ISOLATION AND CHARACTERIZATION OF 13 TRI- AND TETRANUCLEOTIDE MICROSATELLITE DNA MARKERS IN BROOK TROUT (SALVELINUS FONTINALIS). THESE MARKERS DISPLAYED MODERATE TO HIGH LEVELS OF ALLELIC DIVERSITY (AVERAGING 20.5 ALLELES/LOCUS) AND HETEROZYGOSITY (AVERAGING 53.5\%) IN A RANGE-WIDE SURVEY OF MORE THAN 13,000 FISH. A COMPARISON OF TWO GEOGRAPHICALLY PROXIMAL POPULATIONS LOCATED ON OPPOSITE SIDES OF THE EASTERN CONTINENTAL DIVIDE IN MARYLAND, USA, FOUND NO DEVIATIONS FROM HARDY-WEINBERG EQUILIBRIUM AND MINIMAL LINKAGE DISEQUILIBRIUM. MICROSATELLITE MARKERS DEVELOPED FOR S. FONTINALIS YIELDED SUFFICIENT GENETIC DIVERSITY TO: (1) PRODUCE UNIQUE MULTILOCUS GENOTYPES; (2) ELUCIDATE PHYLOGEOGRAPHIC STRUCTURE; AND (3) PROVIDE UNIQUE DEMOGRAPHIC PERSPECTIVES OF POPULATION SIZES AND HISTORICAL DEMOGRAPHICS. THIS SUITE OF MARKERS ALSO PROVIDED CONSIDERABLE CROSS-SPECIES AMPLIFICATION UTILITY AMONG RELATED SALMONIDS."
166,"Darren","not vetted",NA,"not vetted",166,"RESSURREICAO A;GIBBONS J;KAISER T;ZARZYCKI T;BENTLEY M;BURDON D;ATKINS J;SANTOS R;EDWARDS-JONES G",2012,"DIFFERENT CULTURES DIFFERENT VALUES THE ROLE OF CULTURAL VARIATION IN PUBLICS WTP FOR MARINE SPECIES CONSERVATION","BIOLOGICAL CONSERVATION","145","148-159","148-159","10.1016/j.biocon.2011.10.026","UNDERSTANDING THE CULTURAL VARIATION IN PUBLIC PREFERENCE FOR MARINE SPECIES IS A NECESSARY PRE-REQUISITE IF CONSERVATION OBJECTIVES ARE TO INCLUDE SOCIETAL PREFERENCES IN ADDITION TO SCIENTIFIC CONSIDERATIONS. WE REPORT THE RESULTS OF A CONTINGENT STUDY UNDERTAKEN AT THREE CASE-STUDY SITES: AZORES ISLANDS (PORTUGAL), GULF OF GDANSK (POLAND) AND ISLES OF SCILLY (UK). THE STUDY CONSIDERED SPECIES RICHNESS OF FIVE SPECIFIC MARINE TAXA (MAMMALS, BIRDS, FISH, INVERTEBRATES AND ALGAE) AS PROXIES OF MARINE BIODIVERSITY AND THE AIM OF ANALYSIS WAS TO ESTIMATE FROM A MULTI-SITE PERSPECTIVE PUBLIC'S WILLINGNESS TO PAY (YAM TO AVOID INCREASED LEVELS OF SPECIES LOSS (REDUCTION OF SPECIES RICHNESS) FOR DIFFERENT MARINE TAXA. RESULTS, BASED ON 1502 FACE-TO-FACE INTERVIEWS, SHOWED THAT INCOME, EDUCATION AND ENVIRONMENTAL AWARENESS OF THE RESPONDENTS WERE SIGNIFICANT PREDICTORS OF WTP FOR MARINE SPECIES CONSERVATION. RESULTS ALSO INDICATED THAT RESPONDENTS IN EACH OF THE EUROPEAN LOCATIONS HAD DIFFERENT PREFERENCES FOR MARINE TAXA. IN THE AZORES, ALTHOUGH MAMMALS AND FISH WERE VALUED HIGHLY, SMALL DIFFERENCES OCCURRED IN THE WTP AMONG DIFFERENT TAXA. RESPONDENTS IN THE ISLES OF SCILLY PUT A RELATIVELY LOW VALUE ON FISH WHILE ALGAE AND MARINE MAMMALS WERE HIGHLY VALUED. IN GDANSK, RESPONDENTS DEFINED A CLEAR ORDER OF PREFERENCE FOR MARINE MAMMALS > FISH > BIRDS > INVERTEBRATES AND ALGAE. THESE FINDINGS SUGGESTED THAT CULTURAL DIFFERENCES MAY BE IMPORTANT DRIVERS OF VALUATION AND UNDERMINES THE COMMONLY HELD PREMISE THAT CHARISMATIC/LIKEABLE TAXA CONSISTENTLY HAVE A DISPROPORTIONATELY STRONG INFLUENCE ON WTP FOR BIODIVERSITY CONSERVATION. WE CONCLUDE THAT CONSERVATION POLICY MUST TAKE ACCOUNT OF CULTURAL DIVERSITY ALONGSIDE BIOLOGICAL DIVERSITY. (C) 2011 ELSEVIER LTD. ALL RIGHTS RESERVED."
