"STUDY_ID","REVIEWERS","INCLUDE","REVIEWERS","INCLUDE","STUDY_ID","AUTHORS","YEAR","TITLE","JOURNAL","VOLUME","LPAGES","UPAGES","DOI","ABSTRACT"
106,"noone","not vetted",NA,"not vetted",106,"LIMA-SANTOS J;COSTA H;MOLINA F",2020,"THE CURSE OF BEING SERPENTIFORM PERCEPTIONS OF SNAKELIKE ANIMALS IN SAO PAULO BRAZIL","ETHNOBIOLOGY AND CONSERVATION","9",NA,NA,"10.15451/ec2020-06-9.26-1-14","SERPENTIFORM BODY IS A MORPHOLOGICAL ADAPTATION PRESENT IN SEVERAL GROUPS OF ANIMALS. THIS BODY SHAPE IS OFTEN ASSOCIATED WITH SNAKES, WHICH CAN RESULT IN THE INDISCRIMINATE KILLING OF ANIMALS. DESPITE THEIR GREAT SOCIOECONOMIC AND ECOLOGICAL IMPORTANCE, SNAKES ARE COMMONLY ASSOCIATED WITH FEELINGS OF AVERSION, FEAR, AND DISGUST, THAT MAY LEAD TO THE INHIBITION OF CONSERVATION MEASURES. THE PRESENT WORK WAS CONDUCTED IN THE VICINITY OF THE M'BOI MIRIM PARK. IN SAO PAULO (BRAZIL) TO RECORD POPULAR KNOWLEDGE AND TO DISCUSS PUBLIC FEELINGS AND ATTITUDES TOWARDS SNAKES AND OTHER ELONGATED LEGLESS ANIMALS. WE CONDUCTED SEMISTRUCTURED INTERVIEWS WITH 70 PARTICIPANTS. THE LARGEST PERCENTAGE OF THE PARTICIPANTS IDENTIFIED SNAKES BY THE FORKED TONGUE AND CYLINDRICAL BODY SHAPE. OBVIOUS CHARACTERISTICS TO HUMAN EYES. IN AN ENCOUNTER WITH A SERPENTIFORM ANIMAL THAT MAY BE A VENOMOUS SNAKE. THIS BEHAVIOR IS ADVANTAGEOUS AS IT IS BETTER TO DEAL WITH A FALSE POSITIVE THAN WITH A FALSE NEGATIVE. HOWEVER. THIS RESULT DEMONSTRATED A LACK OF ADEQUATE KNOWLEDGE ABOUT THE MORPHOLOGICAL TRAITS EXCLUSIVE TO SNAKES. MANY PARTICIPANTS ARE AFRAID OF SNAKES, WHICH, ALONG WITH MISIDENTIFICATION, CAN CAUSE DISASTROUS ENCOUNTERS AND LEAD TO THE KILLING OF ANY SNAKELIKE ANIMAL. FURTHERMORE. WE FOUND THAT EVEN IN A LARGE CITY, LEGENDS AND MYTHS ABOUT SNAKES AND SNAKELIKE ANIMALS ARE PASSED ON THROUGH GENERATIONS. ADDITIONALLY. PEOPLE ARE UNAWARE THAT SOME SNAKE POPULATIONS OR EVEN SPECIES ARE UNDER RISK OF EXTINCTION. OUR RESULTS POINT TO THE NEED FOR AN EDUCATIONAL PROGRAM THAT CHANGES PUBLIC ATTITUDES TOWARDS SNAKES AND SNAKELIKE ANIMALS AT MUNICIPAL PARKS."
107,"noone","not vetted",NA,"not vetted",107,"LECLAIR G;CHATFIELD M;WOOD J;FREDERICK C",2021,"INFLUENCE OF THE COVID19 PANDEMIC ON AMPHIBIAN ROAD MORTALITY","CONSERVATION SCIENCE AND PRACTICE","3",NA,NA,"10.1111/csp2.535","THE COVID-19 PANDEMIC AND ITS RELATED HUMAN ACTIVITY SHUTDOWNS PROVIDE UNIQUE OPPORTUNITIES FOR BIODIVERSITY MONITORING THROUGH WHAT HAS BEEN TERMED THE ``ANTHROPAUSE'' OR THE ``GREAT HUMAN CONFINEMENT EXPERIMENT.'' THE PANDEMIC CAUSED IMMENSE DISRUPTION TO HUMAN ACTIVITY IN THE NORTHEASTERN UNITED STATES IN THE SPRING OF 2020, WITH NOTABLE REDUCTIONS IN TRAFFIC LEVELS. THESE SHUTDOWNS COINCIDED WITH THE SEASONAL MIGRATION OF ADULT AMPHIBIANS, WHICH ARE TYPICALLY SUBJECT TO INTENSE VEHICLE-IMPACT MORTALITY. USING DATA COLLECTED AS PART OF AN ANNUAL COMMUNITY SCIENCE MONITORING PROGRAM IN MAINE FROM 2018 TO 2021, WE EXAMINED HOW AMPHIBIAN MORTALITY PROBABILITIES RESPONDED TO REDUCTIONS IN TRAFFIC DURING THE PANDEMIC. WHILE WE DETECTED A 50\% DECLINE FOR ALL AMPHIBIANS, THIS WAS DRIVEN ENTIRELY BY REDUCTIONS IN FROG MORTALITY. WILDLIFE COLLISION DATA FROM THE MAINE DEPARTMENT OF TRANSPORTATION ON OTHER WILDLIFE SPECIES SUPPORT OUR FINDING OF DRASTIC DECLINES IN WILDLIFE ROAD MORTALITY IN SPRING 2020 WHEN COMPARED WITH IMMEDIATELY PREVIOUS AND SUBSEQUENT YEARS. ADDITIONALLY, WE FIND THAT FROGS SUFFER SIGNIFICANTLY HIGHER ROAD MORTALITY THAN SALAMANDERS, PARTICULARLY WHEN CONDITIONS ARE WARMER AND WETTER."
108,"noone","not vetted",NA,"not vetted",108,"DOS S J;RAMOS A;AZEVEDO ;JUNIOR R;IUNES D O F L;BARETTA D;BRAN N C E",2018,"SOIL MACROFAUNA IN ORGANIC AND CONVENTIONAL COFFEE PLANTATIONS IN BRAZIL","BIOTA NEOTROPICA","18",NA,NA,"10.1590/1676-0611-BN-2018-0515","BRAZIL HAS ALWAYS BEEN ONE OF THE MOST IMPORTANT COFFEE PRODUCING COUNTRIES. LATELY, THERE HAS EQUALLY BEEN A RENEWED INTEREST IN ALTERNATIVE COFFEE PRODUCTION SYSTEMS. THE STATE OF ESPIRITO SANTO IS THE SECOND GREATEST COFFEE PRODUCER IN BRAZIL; SO, WE USED LOCAL COFFEE PLANTATIONS TO EVALUATE THE RELATIONS BETWEEN SOIL MACROFAUNA AND CHEMICAL AND MICROBIOLOGICAL SOIL PROPERTIES TO IDENTIFY WHICH OF THESE PROPERTIES DISCRIMINATE MORE EFFECTIVELY BETWEEN THE ORGANIC MANAGEMENT SYSTEM (OS) AND THE CONVENTIONAL MANAGEMENT SYSTEM (CS) OF COFFEE PLANTATIONS. FOR EACH OF THESE TWO CULTIVATION SYSTEMS WE CHOSE THREE COFFEE FARMS WHO EMPLOYED BOTH CULTIVATION SYSTEMS AND PICKED OUT THE MOST SIMILAR FIELDS FROM EACH PROPERTY. AT EACH SITE, FIRST WE SAMPLED THE LITTER AT THE SOIL SURFACE. AFTERWARDS, WE SAMPLED NINE SOIL MONOLITHS TO EVALUATE THE MACROFAUNA, IN SUMMER AND WINTER. WE ALSO COLLECTED NINE SUPPLEMENTAL SOIL SAMPLES, TAKEN AT A FEW CENTIMETERS FROM THE SOIL MONOLITHS, FOR CHEMICAL AND MICROBIOLOGICAL ANALYSES. MACROFAUNA DENSITY WAS EVALUATED BY ANOVA AND MULTIVARIATE ANALYSIS. THE CHEMICAL AND MICROBIOLOGICAL PROPERTIES ARE ENVIRONMENTAL VARIABLES, WHILE THE DATA ON MACROFAUNA ARE THE EXPLANATORY VARIABLES. THE TOTAL NUMBER OF INDIVIDUALS RECOVERED IN THIS STUDY WAS 3,354, AND THE CLIMATE, IDENTIFIED BY THE SAMPLING SEASON, WAS A GREAT MODULATOR OF MACROFAUNA, WITH HIGHER NUMBERS IN WINTER. THE PRINCIPAL COMPONENTS ANALYSIS SHOWED THAT SOIL MOISTURE, ORGANIC MATTER, NITROGEN, PHOSPHORUS, BORON, COPPER, PH, ACID AND ALKALINE PHOSPHATASES AND MICROBIAL BIOMASS CARBON, WERE THE MOST OUTSTANDING ONES TO DISCRIMINATE BOTH CULTIVATION SYSTEMS. WE FOUND NO STATISTICAL SIGNIFICANT DIFFERENCES IN MACROFAUNA DENSITY BETWEEN OS AND CS, PROBABLY DUE TO A GENERAL GREAT VARIABILITY, SINCE THERE WAS A TENDENCY FOR MUCH GREATER VALUES IN OS. WE DETECTED THE INTERFERENCE OF CHEMICAL AND MICROBIOLOGICAL SOIL PROPERTIES ON THE MACROFAUNA COMMUNITY IN BOTH SYSTEMS OF COFFEE CULTIVATION, AND SOME RESULTS CLEARLY CORRELATED MUCH BETTER WITH CLIMATE DATA THAN WITH OTHER FACTORS. TO OUR KNOWLEDGE, THIS IS THE FIRST TIME IN WHICH THE DATA POINT TO A CLEAR SEPARATION BETWEEN THE MORE NUMEROUS AND DIVERSIFIED SOIL MACROFAUNA IN COFFEE WITH ORGANIC CULTIVATION FROM THAT WITH A CONVENTIONAL CULTIVATION SYSTEM."
109,"noone","not vetted",NA,"not vetted",109,"WOTTON S;EATON M;SHEEHAN D;MUNYEKENYE F;BURFIELD I;BUTCHART S;MOLEOFI D;NDANG'ANG'A P;POMEROY K;GREGORY R",2020,"DEVELOPING BIODIVERSITY INDICATORS FOR AFRICAN BIRDS","ORYX","54","62-73","62-73","10.1017/S0030605317001181","BIODIVERSITY INDICATORS ARE ESSENTIAL FOR MONITORING THE IMPACTS OF PRESSURES ON THE STATE OF NATURE, DETERMINING THE EFFECTIVENESS OF POLICY RESPONSES, AND TRACKING PROGRESS TOWARDS BIODIVERSITY TARGETS AND SUSTAINABLE DEVELOPMENT GOALS. INDICATORS BASED ON TRENDS IN THE ABUNDANCE OF BIRDS ARE WIDELY USED FOR THESE PURPOSES IN EUROPE AND HAVE BEEN IDENTIFIED AS PRIORITIES FOR DEVELOPMENT ELSEWHERE. TO FACILITATE THIS WE ESTABLISHED BIRD POPULATION MONITORING SCHEMES IN THREE AFRICAN COUNTRIES, BASED ON CITIZEN SCIENCE APPROACHES USED IN EUROPE, AIMING TO MONITOR POPULATION TRENDS IN COMMON AND WIDESPREAD SPECIES. WE RECORDED > 500 BIRD SPECIES FROM C. 450 2-KM TRANSECTS IN BOTSWANA, > 750 SPECIES FROM C. 120 TRANSECTS IN UGANDA, AND > 630 SPECIES FROM C. 90 TRANSECTS IN KENYA. PROVISIONAL WILD BIRD INDICES INDICATE A STRONG INCREASE IN BIRD POPULATIONS IN BOTSWANA AND A SMALL DECREASE IN UGANDA. WE ALSO PROVIDE COMPARISONS BETWEEN TRENDS OF HABITAT GENERALISTS AND SPECIALISTS, OF BIRDS WITHIN AND OUTSIDE PROTECTED AREAS, AND BETWEEN AFRO-PALEARCTIC MIGRANTS AND RESIDENT BIRDS. CHALLENGES ENCOUNTERED INCLUDED RECRUITING, TRAINING AND RETAINING VOLUNTEER SURVEYORS, AND SECURING LONG-TERM FUNDING. HOWEVER, WE SHOW THAT WITH TECHNICAL SUPPORT AND MODEST INVESTMENT (C. USD 30,000 PER SCHEME PER YEAR), MEANINGFUL BIODIVERSITY INDICATORS CAN BE GENERATED AND USED IN AFRICAN COUNTRIES. SUSTAINED RESOURCING FOR THE EXISTING SCHEMES, AND REPLICATION ELSEWHERE, WOULD BE A COST-EFFECTIVE WAY TO IMPROVE OUR UNDERSTANDING OF BIODIVERSITY TRENDS GLOBALLY, AND MEASURE PROGRESS TOWARDS ENVIRONMENTAL GOALS."
110,"noone","not vetted",NA,"not vetted",110,"ZHANG C;LI L;GUAN Y;CAI D;CHEN H;BIAN X;GUO S",2021,"IMPACTS OF VEGETATION PROPERTIES AND TEMPERATURE CHARACTERISTICS ON SPECIES RICHNESS PATTERNS IN DRYLANDS CASE STUDY FROM XINJIANG","ECOLOGICAL INDICATORS","133",NA,NA,"10.1016/j.ecolind.2021.108417","ENERGY AVAILABILITY AT TROPHIC AND HYDROLOGIC LEVEL DOMINATES SPECIES RICHNESS GRADIENTS BY CONSTRAINING FOOD RESOURCES, AND REGULATING POPULATION SIZES AND EXTINCTION RATES. REMOTE SENSING DATASETS HAVE MAPPED VEGETATION PRODUCTIVITIES AS A PROXY FOR ENERGY AVAILABILITY, FOR EXAMPLE, USING DYNAMIC HABITAT INDICES (DHIS). CONSIDERING THE SPARSE VEGETATION ACROSS DRYLANDS, WE DEVELOPED INDICES OF LAND SURFACE TEMPERATURE (ILST) BASED ON DAYTIME LAND SURFACE TEMPERATURE FROM TERRA AND AQUA MODERATE RESOLUTION IMAGING SPECTRORADIOMETER (MODIS), WHICH HAS THREE COMPONENTS: (1) ANNUAL MEAN TEMPERATURE (LSTMEAN), (2) ANNUAL MAXIMUM TEMPERATURE (LSTMAX), AND (3) STANDARD DEVIATION OF TEMPERATURE (LSTSTD). WE HYPOTHESIZED THAT THE TEMPERATURE VARIABLES, SUCH AS ILST, WOULD PREDICT SPECIES RICHNESS BETTER THAN PRODUCTIVITY PROXIES ACROSS DRYLANDS. THUS, OUR OBJECTIVE WAS TO DETERMINE HOW WELL THEY WOULD PREDICT THE RICHNESS OF PLANTS, MAMMALS AND BIRDS ACROSS THE XINJIANG UYGUR AUTONOMOUS REGION. WE CALCULATED THE DHIS AND ILST FROM THE MODIS VEGETATION AND TEMPERATURE PRODUCTS FROM 2001 TO 2015. WE FOUND THAT: (1) ILST COULD CAPTURE MORE ADDITIVE INFORMATION COMPARED WITH DHIS IN TERMS OF THE RELATIVELY HIGH VARIANCE EXPLANATION OF SPECIES RICHNESS AND HIGH VARIABLE IMPORTANCE, AND THE COMBINATION OF ILST AND DHIS GAVE BETTER PREDICTIONS THAN SINGLE METRICS FOR SPECIES RICHNESS PATTERNS. (2) PLANTS AND BIRDS WERE MORE SENSITIVE TO TEMPERATURE THAN VEGETATION PRODUCTIVITY, PROBABLY DUE TO PHYSIOLOGICAL TOLERANCE AND EVOLUTIONARY PROCESSES. (3) LSTSTD WAS THE MOST IMPORTANT VARIABLE AFFECTING SPECIES RICHNESS, EXCEPT ON MAMMALS. HIGH LSTSTD WAS RELATED TO MORE FOOD RESOURCES AND HABITATS, AND LOW LSTSTD REPRESENTED EXTREME ENVIRONMENT AND ENVIRONMENTAL STRESS. COMBINED VEGETATION PROPERTIES AND TEMPERATURE VARIABILITIES ARE GOOD DETERMINANTS OF SPECIES RICHNESS, AND SHOULD BE CAREFULLY CONSIDERED IN FUTURE RESEARCH."
111,"noone","not vetted",NA,"not vetted",111,"HIDASI-NETO J;LOYOLA R;CIANCIARUSO M",2015,"GLOBAL AND LOCAL EVOLUTIONARY AND ECOLOGICAL DISTINCTIVENESS OF TERRESTRIAL MAMMALS IDENTIFYING PRIORITIES ACROSS SCALES","DIVERSITY AND DISTRIBUTIONS","21","548-559","548-559","10.1111/ddi.12320","AIMSPECIES' ECOLOGICAL TRAITS AND EVOLUTIONARY RELATEDNESS HAVE GAINED ATTENTION IN THE SCIENTIFIC COMMUNITY FOR THEIR IMPORTANT ROLES IN THE FUNCTIONING AND STABILITY OF ECOSYSTEMS. HOWEVER, CONSERVATION SCIENCE IS IN URGENT NEED OF METHODS THAT INTEGRATE BOTH ECOLOGICAL AND EVOLUTIONARY COMPONENTS OF BIODIVERSITY INTO CONSERVATION STRATEGIES FOR THREATENED SPECIES. HERE, WE PROPOSE AN APPROACH TO IDENTIFY AND LOCATE ECOLOGICALLY AND EVOLUTIONARILY DISTINCT AND GLOBALLY ENDANGERED' SPECIES (ECOEDGE) AT BROAD AND FINE GEOGRAPHICAL SCALES. LOCATIONGLOBAL. METHODSWE USED PHYLOGENY AND LIFE-HISTORY TRAITS TO CALCULATE EVOLUTIONARY AND ECOLOGICAL DISTINCTIVENESS VALUES OF TERRESTRIAL MAMMALS. WE COMBINED THESE VALUES INTO ONE MEASURE, ECOEDGE, WHICH ALSO CONSIDERS SPECIES' THREAT STATUS. THEN, WE CORRELATED VALUES OF ECOLOGICAL AND EVOLUTIONARY DISTINCTIVENESS (ED) AND MAPPED THE GEOGRAPHICAL DISTRIBUTION OF SPECIES TO LOCATE REGIONS WITH HIGH NUMBER OF MAMMALS WITH GREAT ECOEDGE SCORES. WE ALSO IDENTIFIED AND LOCATED AREAS WITH HIGH NUMBER OF MAMMALS THAT ARE HIGHLY DISTINCT ACROSS MOST LOCAL ASSEMBLAGES IN WHICH THEY OCCUR. RESULTSECOLOGICAL AND ED TENDED TO BE COMPLEMENTARY TO EACH OTHER RATHER THAN REDUNDANT. EVOLUTIONARILY DISTINCT THREATENED SPECIES WERE MOSTLY CONCENTRATED IN THE TROPICS, WHILE ECOLOGICALLY DISTINCT THREATENED SPECIES WERE DISTRIBUTED ACROSS TROPICAL AND TEMPERATE REGIONS. IN ADDITION, BOTH ECOLOGICALLY AND EVOLUTIONARILY DISTINCT THREATENED SPECIES OVERLAPPED THEIR DISTRIBUTIONS WITH BIODIVERSITY HOTSPOTS, INCLUDING THE ATLANTIC FOREST, THE CERRADO, INDO-BURMA AND SUNDALAND. MAMMALS WITH GREAT ECOEDGE SCORES WERE CONCENTRATED IN THE TROPICS, BUT BECAUSE THEY RETAINED PATTERNS FROM ECOLOGICALLY DISTINCT SPECIES, THEIR DISTRIBUTION STRETCHED INTO TEMPERATE REGIONS. MOREOVER, AFRICA, AUSTRALIA AND INDO-MALAYAN REGIONS HELD A GREAT NUMBER OF MAMMALS WITH UNIQUE ECOLOGICAL AND EVOLUTIONARY ROLES IN THE LOCAL ASSEMBLAGES WHERE THEY OCCUR. MAIN CONCLUSIONSECOLOGICALLY AND EVOLUTIONARILY DISTINCT AND GLOBALLY ENDANGERED BUILDS UPON EXISTING STRATEGIES THAT INCLUDE ECOLOGICAL TRAITS INTO A SPECIES-FOCUSED PRIORITIZATION APPROACH AND, THUS, FURTHER INFORMS CONSERVATION OF ECOSYSTEM PROCESSES AND SERVICES AT MULTIPLE GEOGRAPHICAL SCALES."
113,"noone","not vetted",NA,"not vetted",113,"SAUNDERS D;WINTLE B;MAWSON R",2013,"EGGLAYING AND RAINFALL SYNCHRONY IN AN ENDANGERED BIRD SPECIES IMPLICATIONS FOR CONSERVATION IN A CHANGING CLIMATE","BIOLOGICAL CONSERVATION","161","1-9","1-9","10.1016/j.biocon.2013.02.004","BIRDS USE A NUMBER OF ENVIRONMENTAL CUES TO TIME THEIR BREEDING SEASON TO MAXIMISE THEIR CHANCES OF RAISING YOUNG WHEN FOOD IS MOST ABUNDANT. SUCH CUES INCLUDE PHOTOPERIOD, TEMPERATURE AND RAINFALL. IN VERY ARID REGIONS, BIRDS MAY START EGG-LAYING WITH THE ONSET OF RAIN TO ALLOW FLEDGING TO COINCIDE WITH THE AVAILABILITY OF GRASS SEEDS. HOWEVER THE INFLUENCE OF RAINFALL ON TIMING OF EGG-LAYING IN AREAS WITH VARIABLE, BUT MORE RELIABLE, RAINFALL HAS NOT BEEN AS CLEAR. CARNABY'S COCKATOO, AN ENDEMIC SPECIES OF SOUTHWESTERN AUSTRALIA, A REGION WITH A MEDITERRANEAN CLIMATE, IS KNOWN COLLOQUIALLY AS ``THE RAINBIRD'' AS ITS MOVEMENTS TO THE BREEDING AREAS APPEAR TO COINCIDE WITH THE START OF THE WETTER PART OF THE YEAR. HERE WE USE A LONG-TERM DATA SET ON THE BREEDING OF THIS SPECIES (24 YEARS OF DATA FROM 1969 TO 2011) TO QUANTIFY THE LINK BETWEEN THE TIMING OF AUTUMN RAINS AND THE COMMENCEMENT OF EGG-LAYING IN THIS ENDANGERED COCKATOO. WE FOUND A TIGHT SYNCHRONY WHICH INDICATES A STRONG RELIANCE OF THE SPECIES ON EARLY AUTUMN RAINS AS A CUE FOR BREEDING. WE DESCRIBE THE CONSERVATION IMPLICATIONS OF INCREASED VARIABILITY IN TIMING AND QUANTITY OF RAINFALL FOR THE LONG-TERM VIABILITY OF CARNABY'S COCKATOO. (C) 2013 ELSEVIER LTD. ALL RIGHTS RESERVED."
114,"noone","not vetted",NA,"not vetted",114,"TONHATTI C;LOUVISE J;DE S A;DOS R S;LABORDA P",2014,"DEVELOPMENT OF MICROSATELLITE LOCI FOR THE FISH POECILIA VIVIPARA CYPRINODONTIFORMES POECILIIDAE","CONSERVATION GENETICS RESOURCES","6","383-385","383-385","10.1007/s12686-013-0098-z","POECILIA VIVIPARA IS A SMALL FISH FOUND THROUGHOUT THE COASTAL LOWLANDS OF SOUTH AMERICA. WE REPORT THE ISOLATION AND CHARACTERIZATION OF 25 MICROSATELLITE LOCI IN THIS TROPICAL FISH. IN 24 INDIVIDUALS FROM TWO POPULATIONS, 18 LOCI WERE POLYMORPHIC. THE LOCI HAD 2-12 ALLELES, EXPECTED HETEROZYGOSITIES OF 0.194-0.836, OBSERVED HETEROZYGOSITIES OF 0.208-0.792, AND DISCRIMINATORY POWERS OF 0.202-0.872. FOUR LOCI SHOWED SIGNIFICANT DEVIATIONS FROM HARDY-WEINBERG EQUILIBRIUM. THE MICROSATELLITE LOCI WILL BE USEFUL FOR INVESTIGATING GENETIC DIVERSITY AND POPULATION GENETIC STRUCTURE, WHICH WILL CONTRIBUTE TO THE DEVELOPMENT OF EFFICIENT CONSERVATION PROGRAMS FOR COASTAL LOWLANDS WHERE P. VIVIPARA OCCURS."
115,"noone","not vetted",NA,"not vetted",115,"SOBRAL F;JARDIM L;LEMES P;MACHADO N;LOYOLA R;CIANCIARUSO M",2014,"SPATIAL CONSERVATION PRIORITIES FOR TOP PREDATORS REVEAL MISMATCHES AMONG TAXONOMIC PHYLOGENETIC AND FUNCTIONAL DIVERSITY","NATUREZA \& CONSERVACAO","12","150-155","150-155","10.1016/j.ncon.2014.09.008","SYSTEMATIC CONSERVATION PLANNING IS TRADITIONALLY BASED ON BIOLOGICAL FEATURES, SOMETIMES REPRESENTING A SINGLE BIODIVERSITY COMPONENT, SUCH AS TOP PREDATORS. HOWEVER, FEW STUDIES HAVE TESTED THE EFFICIENCY OF TRADITIONAL SPATIAL PRIORITIZATIONS TO CAPTURE THE PHYLOGENETIC AND FUNCTIONAL DIVERSITY OF ENTIRE FAUNAS. HERE, WE EVALUATED (1) THE CONGRUENCE AMONG SPATIAL PRIORITIZATION ANALYSES BASED ON TAXONOMIC, PHYLOGENETIC AND FUNCTIONAL DIVERSITY FOR MAMMALS AND BIRDS OCCURRING IN BRAZIL; AND (2) THE CONGRUENCE AMONG OUTPUTS OF SPATIAL PRIORITIES FOR CARNIVORES AND BIRDS OF PREY AND PRIORITIES FOR CONSERVING THE PHYLOGENETIC AND FUNCTIONAL DIVERSITY OF ALL MAMMAL AND BIRD SPECIES. PRIORITY SITES DIFFERED AMONG TAXONOMIC GROUPS AS WELL AS AMONG BIODIVERSITY ASPECTS, WITH LOW CONGRUENCE AMONG THEM. OVERALL, BOTH STRATEGIES - FULL GROUP AND TOP PREDATORS - WERE NOT EFFICIENT AND HAVE NOT CAPTURED EVEN HALF OF ALL VARIATION IN PHYLOGENETIC AND FUNCTIONAL DIVERSITY EXISTING IN THE GROUPS. @ 2014 ASSOCIACAO BRASILEIRA DE CIENCIA ECOLOGICA E CONSERVACAO. PUBLISHED BY ELSEVIER EDITORA LTDA. ALL RIGHTS RESERVED."
116,"noone","not vetted",NA,"not vetted",116,"DENG H;JIM C",2017,"SPONTANEOUS PLANT COLONIZATION AND BIRD VISITS OF TROPICAL EXTENSIVE GREEN ROOF","URBAN ECOSYSTEMS","20","337-352","337-352","10.1007/s11252-016-0596-3","GREEN ROOFS CAN CONTRIBUTE TO ENRICHMENT AND CONSERVATION OF URBAN ECOLOGY. AN EXPERIMENTAL GREEN ROOF WAS ESTABLISHED IN HUMID-TROPICAL HONG KONG TO MONITOR OVER TWO YEARS ITS SPONTANEOUS COLONIZATION BY PLANTS AND BIRD VISITS. SOME 94 VOLUNTARY VASCULAR PLANT SPECIES FROM 26 FAMILIES AND 76 GENERA WERE ESTABLISHED, WITH PROPAGULES BROUGHT MAINLY BY BIRDS AND WIND AND SECONDARILY INHERITED FROM SOIL SEED BANK. PLANT SPECIES COMPOSITION CHANGED DYNAMICALLY DURING THE STUDY PERIOD. THEY FALL INTO THREE GROUPS, NAMELY DOMINANT RUDERAL (HERBACEOUS AND SUB-SHRUB) AS SURROGATE OF EARLY-STAGE LOCAL GRASSLAND ECOSYSTEM SUCCESSION, ARBOREAL (TREES AND SHRUBS), AND HYGROPHILOUS HERB. PROGRESSIVE INCREASE IN VEGETATION COVER WAS ACCOMPANIED BY CHANGES IN SPECIES DIVERSITY AND EVENNESS. IN ADDITION, 16 BIRD SPECIES FROM 8 FAMILIES AND 14 GENERA WERE RECORDED. TEN SPECIES WERE RESIDENTS AND THE SIX MIGRANT SPECIES WERE WINTER VISITORS. THEIR FOOD PREFERENCE WAS MAINLY OMNIVORE AND INSECTIVORE. WINTER AND THE SECOND YEAR ENCOUNTERED HIGHER SPECIES RICHNESS, DIVERSITY, AND EVENNESS. MOST VEGETATION PARAMETERS CORRELATED POSITIVELY WITH AVIAN COMMUNITY INDEXES, SIGNIFYING PROVISION OF SUSTENANCE BY GREEN-ROOF ECOSYSTEM TO BIRDS. VEGETATION COVERAGE CORRELATED NEGATIVELY WITH AVIAN ABUNDANCE, DUE TO SHUNNING BY THE ABUNDANT GROUND-FORAGING TREE SPARROW. BOTH LOCAL COMMON RUDERAL PLANT SPECIES AND COMMON URBAN BIRD SPECIES CAN SUCCESSFULLY ESTABLISH AND REPRODUCE ON THE EXTENSIVE GREEN ROOF, CONFIRMING POTENTIALS FOR URBAN ECOLOGY AND BIODIVERSITY ENHANCEMENT AND CONSERVATION EVEN IN DENSELY-DEVELOPED URBAN AREAS. THE SUCCESSFUL NURTURING OF NATURALISTIC GREEN ROOF OFFERS NEW OPPORTUNITIES FOR GREEN ROOF DESIGN THAT DEVIATES FROM THE PREDOMINANT CULTIVATED-HORTICULTURAL APPROACH."
117,"noone","not vetted",NA,"not vetted",117,"GARSIDE D;GEBRIL A;ALSAADI M;FERRO V",2014,"FERTILITY CONTROL IN WILDLIFE REVIEW OF CURRENT STATUS INCLUDING NOVEL AND FUTURE TECHNOLOGIES","REPRODUCTIVE SCIENCES IN ANIMAL CONSERVATION: PROGRESS AND PROSPECTS","753","467-488","467-488","10.1007/978-1-4939-0820-2\_18","OVERPOPULATION OF SELECTED GROUPS OF ANIMALS IS WIDELY RECOGNISED AS AN ISSUE THAT CAN HAVE ADVERSE EFFECTS ON SEVERAL CURRENT GLOBAL PROBLEMS, SUCH AS ANIMAL AND HUMAN HEALTH, CONSERVATION AND ENVIRONMENTAL CHANGES. THIS REVIEW WILL, THEREFORE, FOCUS ON RECENT NOVEL CONTRACEPTION TOGETHER WITH FUTURE TECHNOLOGIES THAT MAY PROVIDE ADDITIONAL CONTRACEPTIVE METHODS."
118,"noone","not vetted",NA,"not vetted",118,"SUBRAMANIAN M",2012,"ZOONOTIC DISEASE RISK AND THE BUSHMEAT TRADE ASSESSING AWARENESS AMONG HUNTERS AND TRADERS IN SIERRA LEONE","ECOHEALTH","9","471-482","471-482","10.1007/s10393-012-0807-1","THE BUSHMEAT INDUSTRY HAS BEEN A TOPIC OF INCREASING IMPORTANCE AMONG BOTH CONSERVATIONISTS AND PUBLIC HEALTH OFFICIALS FOR ITS INFLUENCE ON ZOONOTIC DISEASE TRANSMISSION AND ANIMAL CONSERVATION. WHILE THE ASSOCIATION BETWEEN INFECTIOUS DISEASES AND THE BUSHMEAT TRADE IS WELL ESTABLISHED IN THE RESEARCH COMMUNITY, RISK PERCEPTION AMONG BUSHMEAT HUNTERS AND TRADERS HAS NOT BEEN WELL CHARACTERIZED. I CONDUCTED SURVEYS OF 123 BUSHMEAT HUNTERS AND TRADERS IN RURAL SIERRA LEONE TO INVESTIGATE HUNTING PRACTICES AND AWARENESS OF ZOONOTIC DISEASE RISK ASSOCIATED WITH THE BUSHMEAT TRADE. TWENTY-FOUR PERCENT OF BUSHMEAT HUNTERS AND TRADERS REPORTED KNOWLEDGE OF DISEASE TRANSMISSION FROM ANIMALS TO HUMANS. FORMAL EDUCATION DID NOT SIGNIFICANTLY AFFECT AWARENESS OF ZOONOTIC DISEASE TRANSMISSION. INDIVIDUALS WHO ENGAGED EXCLUSIVELY IN PREPARATION AND TRADING OF BUSHMEAT WERE MORE LIKELY TO ACCIDENTALLY CUT THEMSELVES COMPARED TO THOSE WHO PRIMARILY ENGAGED IN BUSHMEAT HUNTING (P < 0.001). IN ADDITION, WOMEN INVOLVED IN THE BUSHMEAT TRADE WERE AT GREATER RISK OF EXPOSING THEMSELVES TO POTENTIAL ZOONOTIC PATHOGENS THROUGH ACCIDENTAL SELF-CUTTING COMPARED TO MEN (P < 0.01). THIS STUDY COLLECTED PRELIMINARY INFORMATION ON RISK PERCEPTION AMONG BUSHMEAT HUNTERS THAT COULD GUIDE THE CREATION OF A FUTURE PUBLIC HEALTH-BASED EDUCATION PROGRAM TO MINIMIZE ZOONOTIC DISEASE TRANSMISSION RISK AMONG VULNERABLE COMMUNITIES."
119,"noone","not vetted",NA,"not vetted",119,"ARANDA R;GRACIOLLI G",2015,"SPATIALTEMPORAL DISTRIBUTION OF THE HYMENOPTERA IN THE BRAZILIAN SAVANNA AND THE EFFECTS OF HABITAT HETEROGENEITY ON THESE PATTERNS","JOURNAL OF INSECT CONSERVATION","19","1173-1187","1173-1187","10.1007/s10841-015-9832-z","THE BRAZILIAN SAVANNA IS CONSIDERED A GLOBAL HOTSPOT AND HABITAT LOSS HAS POSED A SERIOUS THREAT TO INSECT FAUNA, INCLUDING HYMENOPTERA PARASITOIDS. WE TESTED THE EFFECT OF FRAGMENT SIZE, SEASONAL ABUNDANCE, AND VEGETATION STRUCTURE, ON HYMENOPTERAN COMMUNITY COMPOSITION. THIS IS THE FIRST STUDY THAT DESCRIBES THE HYMENOPTERA COMMUNITY AT THE MORPHOSPECIES LEVEL FOR THE BRAZILIAN SAVANNA. NO RELATIONSHIP BETWEEN COMMUNITY STRUCTURE AND FRAGMENT SIZE WAS FOUND. INSTEAD, VARIATION IN INDIVIDUAL ABUNDANCE WAS HIGHER WITH LOW RAINFALL AND TEMPERATURE. IT WAS POSSIBLE TO IDENTIFY TWO GROUPS, WITH DIFFERENT COMPOSITIONS. ONE GROUP WAS INFLUENCED BY LEAF-LITTER AND THE SHRUB LAYER, WHILST THE OTHER HAD AN AFFINITY WITH VERTICAL VARIABLES AND THE ARBOREAL STRATUM. IN THE BRAZILIAN SAVANNA, THE HYMENOPTERAN FAUNA IS NOT WELL KNOWN AND THE EFFECT OF FRAGMENTATION AND HABITAT STRUCTURE ARE IMPORTANT FACTORS FOR THE STRUCTURE AND COMPOSITION OF THE HYMENOPTERAN COMMUNITY. SAVANNA, WITH ITS HIGH BIODIVERSITY, CONFIRMS THIS BIOGEOGRAPHICAL REGION AS A HOTSPOT FOR HYMENOPTERA. WE CAN CONCLUDE FROM THE RESULTS OF THIS STUDY THAT SEASONALITY, SPATIAL ARRANGEMENT, AND VARIATIONS IN THE STRUCTURAL COMPLEXITY OF FRAGMENTS AFFECTS THE COMPOSITION AND DISTRIBUTION OF HYMENOPTERA IN THE BRAZILIAN SAVANNA BIOME."
120,"noone","not vetted",NA,"not vetted",120,"SHULSE C;SEMLITSCH R;TRAUTH K",2013,"MOSQUITOFISH DOMINATE AMPHIBIAN AND INVERTEBRATE COMMUNITY DEVELOPMENT IN EXPERIMENTAL WETLANDS","JOURNAL OF APPLIED ECOLOGY","50","1244-1256","1244-1256","10.1111/1365-2664.12126","RESTORED AND CONSTRUCTED HABITATS CAN PLAY IMPORTANT CONSERVATION ROLES. PREDATORS HELP SHAPE COMMUNITIES IN THESE HABITATS THROUGH COMPLEX INTERACTIONS WITH PREY, OTHER PREDATORS AND BIOTIC AND ABIOTIC CHARACTERISTICS OF THE ENVIRONMENT. HOWEVER, INTRODUCED PREDATORS CAN HAVE DRAMATIC EFFECTS THAT MAY BE DIFFICULT TO PREDICT. USING REGRESSION MODELS, WE COMPARED INFLUENCES OF INTRODUCED INVASIVE WESTERN MOSQUITOFISH GAMBUSIA AFFINIS TO THOSE OF TWO NATURALLY COLONIZING PREDATORS (CRAYFISH AND DRAGONFLIES), AND VEGETATION, ON THREE ANURAN SPECIES IN EXPERIMENTALLY CONSTRUCTED WETLANDS. USING ANALYSES OF COVARIANCE, WE ALSO EXAMINED INFLUENCES OF MOSQUITOFISH AND VEGETATION ON AQUATIC INVERTEBRATE COMMUNITIES. WE FOUND THAT MOSQUITOFISH REDUCED ABUNDANCES OF GREY TREEFROGS HYLA VERSICOLOR AND H.CHRYSOSCELIS AND BOREAL CHORUS FROG PSEUDACRIS MACULATA, BUT HAD NO SIGNIFICANT INFLUENCE ON GREEN FROG LITHOBATES CLAMITANS. MOSQUITOFISH ALSO REDUCED INVERTEBRATE ABUNDANCE, BUT THEIR EFFECT ON RICHNESS WAS LESS CLEAR. VEGETATION COVER DID NOT SIGNIFICANTLY INCREASE MOST ANURAN OR INVERTEBRATE ABUNDANCES. HOWEVER, VEGETATION INCREASED INVERTEBRATE RICHNESS. AFTER FISH REMOVAL, INVERTEBRATE ABUNDANCE INCREASED. FISH REMOVAL MAY HAVE FACILITATED CHORUS FROG RE-COLONIZATION INTO WETLANDS WITH LOW ABUNDANCE OF INVERTEBRATE PREDATORS. OUR RESULTS INDICATE THAT MOSQUITOFISH ARE DETRIMENTAL TO WETLAND COMMUNITIES, AND WE RECOMMEND THAT MANAGERS AVOID STOCKING MOSQUITOFISH. WE ALSO ENCOURAGE TEMPORARY OR DRAINABLE WETLANDS TO PREVENT MOSQUITOFISH PERSISTENCE IF COLONIZATION OCCURS. IMPLEMENTING THESE RECOMMENDATIONS WILL IMPROVE THE CONSERVATION POTENTIAL OF RESTORED WETLANDS."
