"STUDY_ID","REVIEWERS","INCLUDE","REVIEWERS","INCLUDE","STUDY_ID","AUTHORS","YEAR","TITLE","JOURNAL","VOLUME","LPAGES","UPAGES","DOI","ABSTRACT"
93,"Darren","not vetted",NA,"not vetted",93,"RIBEIRO M;PATINO-MARTINEZ J;AGUES A;NUNO A",2022,"EXPLORING A COMPREHENSIVE BEHAVIOURAL MODEL TO INVESTIGATE ILLEGAL SEA TURTLE TRADE IN CABO VERDE","CONSERVATION \& SOCIETY","20","325-335","325-335","10.4103/cs.cs\_98\_21","SUCCESSFUL CONSERVATION OUTCOMES OFTEN DEPEND ON CHANGING HUMAN BEHAVIOURS THAT NEGATIVELY IMPACT BIODIVERSITY, SUCH AS UNSUSTAINABLE WILDLIFE HARVESTING OR ILLEGAL WILDLIFE TRADE (IWT). HOWEVER, INCLUSIVE PSYCHOLOGY MODELS THAT EXAMINE MOTIVATIONS OF THOSE BEHAVIOURS HAVE BEEN UNDERUTILISED IN IWT CONTEXTS. THIS RESEARCH EXAMINES THE DRIVERS OF ILLEGAL HARVESTING AND CONSUMPTION OF SEA TURTLES ON MAIO, CABO VERDE (WEST AFRICA), BY ADAPTING DATA FROM INTERVIEWS (N=20) AND QUESTIONNAIRES (N=325) INTO THE COMPREHENSIVE ACTION DETERMINATION MODEL, AN ENVIRONMENTAL PSYCHOLOGY THEORETICAL FRAMEWORK. INITIAL FINDINGS SUGGEST LOCAL BEHAVIOURAL MOTIVATIONS HAVE CHANGED OVER TIME, BUT KEY BELIEFS REMAINED INTACT. STRUCTURAL EQUATION MODELLING SHOWED INTENTION TO CONSUME TURTLES IS INFLUENCED BY POSITIVE ATTITUDES TOWARDS CONSUMPTION, BUT INTERVIEWS SUGGEST NORMATIVE PERSONAL AND SOCIAL BELIEFS ARE BECOMING RELEVANT TO CONSUMPTIVE BEHAVIOUR MITIGATION. THE SAME SEEMS TRUE OF HARVESTING, REPORTEDLY PERFORMED MOSTLY BY YOUNG MEN LOOKING TO SELL TURTLE BY-PRODUCTS. OVERALL, RESULTS INDICATE THE BELIEFS UNDERLYING HARVEST AND CONSUMPTION BEHAVIOURS ARE DISTINCT, SUCH THAT OUTREACH INITIATIVES MUST BE DESIGNED TO ADDRESS EACH. RESULTS DEMONSTRATE HOW CONCEPTUAL MODELS DEVELOPED IN UNDERUTILISED DISCIPLINES CAN BE ADAPTED TO EXPAND THE TRANSDISCIPLINARY TOOLS AVAILABLE TO CONSERVATION PRACTITIONERS. EMBRACING BEHAVIOUR-FOCUSED APPROACHES IS CRUCIAL TO ADDRESS THE INTRICATE CULTURAL AND CONTEXTUAL FACTORS OF IWT."
94,"Darren","not vetted",NA,"not vetted",94,"GONZALEZ-MAYA J;CARDENAL-PORRAS J;WYATT S;MATA-LORENZEN J",2011,"NEW LOCALITIES AND ALTITUDINAL RECORDS FOR THE SNAKES OXYRHOPUS PETOLARIUS SPILOTES PULLATUS AND UROTHECA FULVICEPS IN TALAMANCA COSTA RICA","REVISTA MEXICANA DE BIODIVERSIDAD","82","1340-1342","1340-1342",NA,"DISTRIBUTION RECORDS ARE THE BASIS FOR CONSERVATION PLANNING AND SPECIES CONSERVATION ASSESSMENTS. NEW LOCALITY AND ELEVATION RECORDS ARE REPORTED FOR 2 DIPSADID SNAKES (OXYRHOPUS PETOLARIUS AND UROTHECA FULVICEPS) AND 1 COLUBRID (SPILOTES PULLATUS) FROM THE TALAMANCA MOUNTAIN RANGE OF COSTA RICA AS ESTABLISHED BY DIRECT SIGHTINGS. THESE NEW RECORDS REPRESENT IMPORTANT ADDITIONS TO THE KNOWLEDGE OF THE SPECIES AND MORE GENERALLY FOR THE TALAMANCA ECOREGION."
98,"Darren","not vetted",NA,"not vetted",98,"WALKER J;ROTELLA J;LOESCH C;RENNER R;RINGELMAN J;LINDBERG M;DELL R;DOHERTY K",2013,"AN INTEGRATED STRATEGY FOR GRASSLAND EASEMENT ACQUISITION IN THE PRAIRIE POTHOLE REGION USA","JOURNAL OF FISH AND WILDLIFE MANAGEMENT","4","267-279","267-279","10.3996/052013-JFWM-035","ACQUISITION OF PERPETUAL GRASSLAND EASEMENTS IS A PRINCIPAL TACTIC USED BY THE UNITED STATES FISH AND WILDLIFE SERVICE (USFWS) AND ITS PARTNERS TO PROTECT NESTING HABITAT FOR MIGRATORY BIRDS IN THE PRAIRIE POTHOLE REGION OF NORTH AND SOUTH DAKOTA, USA. THIS PUBLIC-PRIVATE PARTNERSHIP RESULTED IN THE CONSERVATION OF >344,000 HA OF GRASSLAND DURING 1998-2012. PAST EASEMENT ACQUISITION HAS BEEN TARGETED TO LANDSCAPES WITH GREATEST EXPECTED ACCESSIBILITY TO BREEDING DUCK PAIRS WITHOUT ACTIVE CONSIDERATION OF PROBABILITY OF CONVERSION OR COST OF PROTECTION. THE RISING COST OF EASEMENT ACQUISITION IN RECENT YEARS INDICATES THAT RE-EVALUATION AND REFINEMENT OF THE EASEMENT ACQUISITION STRATEGY COULD HELP TO IMPROVE PROGRAMMATIC OUTCOMES. WE ASSESSED REGIONAL PATTERNS OF EASEMENT ACQUISITION DURING 1998-2012, EVALUATED THE CURRENT TARGETING STRATEGY, AND USED A COMBINATION OF PUBLICLY AVAILABLE AND PROPRIETARY GEOSPATIAL DATA TO DEVELOP AN EASEMENT-TARGETING GEOGRAPHIC INFORMATION SYSTEM THAT INTEGRATED INFORMATION ABOUT CONVERSION PROBABILITY AND PROTECTION COST WITH CURRENT TARGETING CRITERIA. OUR ASSESSMENT INDICATED THAT GRASSLAND PROTECTION WAS NEGATIVELY AFFECTED BY RISING LAND PRICES DURING 1998-2012. IN THE 5 Y BETWEEN 2008 AND 2012, ABOUT 100,000 HA OF GRASSLAND WERE PROTECTED AT A COST OF \$83 MILLION (U. S. DOLLARS). THE 2008-2012 ACQUISITIONS REPRESENTED 30\% OF TOTAL PROTECTION DURING 1998-2012 BUT COMPOSED 47\% OF THE TOTAL EXPENDITURE. WE OBSERVED STRONG EVIDENCE THAT EASEMENTS WERE TARGETED TO PRIORITY LANDSCAPES BOTH BEFORE AND AFTER FORMALIZATION OF THE USFWS CONSERVATION STRATEGY IN 2004. WE ALSO FOUND EVIDENCE OF AN OPPORTUNITY TO INCREASE EFFICIENCY OF FUTURE ACQUISITIONS. WE IDENTIFIED 0.9 MILLION HA OF CURRENTLY UNPROTECTED PRIORITY GRASSLAND IN THE REGION WITH GREATER THAN EXPECTED CONVERSION RISK AND SMALLER THAN EXPECTED PROTECTION COST. WE SUGGEST THAT FUTURE GRASSLAND EASEMENT ACQUISITION BE REFOCUSED ON THIS REFINED PRIORITY AREA AND THAT AN ADAPTIVE APPROACH TO FUTURE EASEMENT ACQUISITION (INCLUDING TARGETED ACQUISITIONS, DIRECTED MONITORING, AND DATA-BASED DECISIONS) PROVIDES A LOGICAL FRAMEWORK FOR IMPLEMENTATION OF THIS NEW STRATEGY AND WILL FACILITATE CONTINUED CONSERVATION SUCCESS."
100,"Darren","not vetted",NA,"not vetted",100,"COX W;SCHWARZER A;TORNWALL B",2019,"POSTFLEDGING SURVIVAL OF THE WORTHINGTONS MARSH WREN CISTOTHORUS PALUSTRIS GRISEUS","AVIAN CONSERVATION AND ECOLOGY","14",NA,NA,"10.5751/ACE-01472-140219","THE POSTFLEDGING PERIOD OF A PASSERINE BIRD'S LIFE IS INCREASINGLY RECOGNIZED AS AN UNDERSTUDIED COMPONENT OF SONGBIRD CONSERVATION, BECAUSE THE HABITAT NEEDS OF FLEDGLINGS CAN DIFFER FROM NESTING ADULTS AND SURVIVORSHIP DURING THIS PERIOD CAN SUBSTANTIALLY AFFECT POPULATION GROWTH RATES. WE STUDIED POSTFLEDGING SURVIVAL OF THE WORTHINGTON'S MARSH WREN (CISTOTHORUS PALUSTRIS GRISEUS), A STATE-LISTED SALT MARSH SONGBIRD SUBSPECIES IN NORTHEASTERN FLORIDA, USA, DURING 2016-2017. POSTFLEDGING SURVIVAL WAS LOW DURING THE FIRST 21 D FOLLOWING FLEDGING FOR THE COHORT OF TRACKED BIRDS (0.10; 95\% CONFIDENCE INTERVAL: 0.01, 0.37). THE TOP A PRIORI MODEL INDICATED THAT HEAVIER BIRDS AT THE TIME OF TAGGING EXHIBITED GREATER SURVIVAL THAN LIGHTER BIRDS, AND BIRDS FROM LARGER BROODS HAD GREATER SURVIVAL THAN BIRDS FROM SMALLER BROODS. OTHER COVARIATES NOT IN THE TOP MODEL THAT ALSO INFLUENCED SURVIVAL INCLUDED THE AMOUNT OF TALL-FORM SMOOTH CORDGRASS (SPARTINA ALTERNIFLORA) WITHIN THE NATAL PATCH, WHICH POSITIVELY INFLUENCED SURVIVAL, AND THE AMOUNT OF BLACK NEEDLERUSH (JUNCUS ROEMERIANUS) WITHIN THE NATAL PATCH, WHICH NEGATIVELY AFFECTED SURVIVAL. THE LOW RATES OF POSTFLEDGING SURVIVAL COMBINED WITH LOW RATES OF NEST SURVIVAL REPORTED ELSEWHERE INDICATE THAT WORTHINGTON'S MARSH WRENS IN NORTHEASTERN FLORIDA REQUIRE CONTINUED PROTECTION AND WARRANT FURTHER RESEARCH INTO MANAGEMENT AND RESTORATION ACTIVITIES THAT WILL IMPROVE THEIR HABITAT."
101,"Darren","not vetted",NA,"not vetted",101,"DUDA M",2016,"THE EFFICIENCY OF LANDSCAPE MANAGEMENT ON SELECTED THERMOPHILOUS LAND SNAILS A SMALLSCALE CASE REPORT FROM THE VINEYARD AREA IN NORTHERN VIENNA","ECO MONT-JOURNAL ON PROTECTED MOUNTAIN AREAS RESEARCH","8","22-32","22-32","10.1553/eco.mont-8-2s22","DIRECT IMPLICATIONS OF LANDSCAPE MANAGEMENT MEASURES, SUCH AS CLEARING AND GRUBBING, ON SNAILS ARE ONLY SPARSELY PUBLISHED. THUS THE IMPACT OF MANAGEMENT ON TWO XEROTHERMOPHILOUS TERRESTRIAL GASTROPOD SPECIES, ZEBRINA DETRITA AND CAUCASOTACHEA VINDOBONENSIS, AND ON LAND SNAILS IN GENERAL, WAS EVALUATED IN THE VINEYARD AREA OF NORTHERN VIENNA. THIS AREA BELONGS TO THE BUFFER ZONE OF UNESCO WIENERWALD BIOSPHERE RESERVE IN AUSTRIA. A TOTAL OF 18 SITES WERE INVESTIGATED, INCLUDING VINEYARD EMBANKMENTS AND DRY MEADOWS WITH DIFFERENT INTENSITY LEVELS OF CLEARING AND GRUBBING IN RECENT YEARS. OCCURRENCE OF BOTH TARGET SPECIES AND THEIR ABILITY TO RECOLONIZE NEWLY CREATED HABITATS WERE ASSESSED. SNAILS ARE ABLE TO COLONIZE NEW AREAS IN DIRECT VICINITY OF EXISTING POPULATIONS THAT ARE ABOVE DETECTION LEVEL. ONLY ANNUALLY REPEATED CLEARING OF MEADOWS AND EMBANKMENTS WITH ORIGINALLY STRONG SHRUB COVERAGE RESULTED IN A VISIBLE EFFECT. CONTINUOUS CLEARING EFFORTS OVER 10 YEARS WERE ASSOCIATED WITH A DENSE POPULATION OF Z. DETRITA ON A FORMERLY UNSUITED BUSH-COVERED MEADOW. IN CONTRAST, VINEYARD EMBANKMENTS THAT WERE CUT FREE JUST ONCE WITHIN TWO YEARS BEFORE THE STUDY HARBOURED ONLY A FEW SPECIMENS OF Z. DETRITA. ALSO THE FORMER OCCURRENCE OF EMPTY SHELLS OF GRASSLAND SPECIES SHOULD BE TAKEN INTO CONSIDERATION WHEN PLANNING LANDSCAPE MANAGEMENT, BECAUSE THEY CAN PROVIDE INFORMATION ON THE POTENTIAL SUCCESS OF RESTORING OPEN GRASSLAND."
102,"Darren","not vetted",NA,"not vetted",102,"ZHENG Z;ZHUANG Y;CHEN H;GE R;LI Y;LIU G",2022,"SEASONALITY SHAPES COMMUNITY STRUCTURE AND FUNCTIONAL GROUP DYNAMICS OF ZOOPLANKTON IN CHANGJIANG RIVER ESTUARY AND ITS ADJACENT WATERS","DIVERSITY AND DISTRIBUTIONS","28","2152-2170","2152-2170","10.1111/ddi.13615","AIM: FUNCTIONAL TRAIT-BASED APPROACH LINKS THE ZOOPLANKTON COMMUNITY TO THE MARINE ECOSYSTEM FUNCTIONING. IT PROVIDES A COMPREHENSIVE INSIGHT INTO THE DIVERSITY OF ZOOPLANKTON ECOLOGICAL STRATEGIES BUT HAS RARELY BEEN USED TO CHARACTERIZE THE ZOOPLANKTON COMMUNITY IN ESTUARINE ECOSYSTEM. HERE, WE INVESTIGATED THE SEASONALITY OF MESOZOOPLANKTON FUNCTIONAL STRUCTURE WITH RESPECT TO ENVIRONMENTAL CHANGES IN CHANGJIANG RIVER ESTUARY (CRE) AND ITS ADJACENT WATERS. LOCATION: CHANGJIANG RIVER ESTUARY AND ITS ADJACENT WATERS. METHODS: SAMPLES WERE COLLECTED IN THREE SEASONS OF 2019. MORPHOLOGICALLY IDENTIFIED SPECIES WERE ASSIGNED FUNCTIONAL TRAITS INCLUDING BODY LENGTH, FEEDING STRATEGY, TROPHIC GROUP, REPRODUCTION MODE AND HABITAT TYPE, AND CLUSTERED INTO FUNCTIONAL GROUPS. TAXONOMIC AND FUNCTIONAL DIVERSITY INDICES WERE CALCULATED. THE RELATIVE IMPORTANCE OF THE ENVIRONMENTAL VARIABLES IN EXPLAINING THE SEASONALITY OF FUNCTIONAL STRUCTURES WAS ASSESSED. RESULTS: TEN FUNCTIONAL GROUPS WERE IDENTIFIED, AND FUNCTIONAL STRUCTURE SHOWED STRONG SEASONAL DYNAMICS. CURRENT- AND MIXED-FEEDING OMNIVORE-HERBIVORES WERE THE PREDOMINANT GROUP OVER SEASONS. THE CONTRIBUTION OF CARNIVOROUS, DETRITIVOROUS AND OMNIVOROUS GROUPS INCREASED FROM WINTER-SPRING TO AUTUMN. THE SEASONALITY OF ZOOPLANKTON FUNCTIONAL STRUCTURE WAS MAINLY EXPLAINED BY THE EFFECT OF TEMPERATURE, FLUVIAL DISCHARGE AND WARM CURRENT. LOW TEMPERATURE AND RIVERINE INPUT OF NUTRIENT IN WINTER-SPRING FAVOURED THE SMALL-SIZED HERBIVORES. SUBSEQUENTLY, THE RISING TEMPERATURE AND RUN-OFF IN SUMMER SHIFTED THE ZOOPLANKTON COMMUNITY TO LARGER HERBIVORES AND CARNIVORES. MODERATE TEMPERATURE AND RELATIVELY ENHANCED EFFECT OF WARM CURRENT PROMOTED THE PROLIFERATION OF CARNIVORES AND DETRITIVORES IN AUTUMN. FUNCTIONAL DIVERSITY ALSO VARIED OVER SEASONS. MAIN CONCLUSIONS: THE FUNCTIONAL DYNAMICS OF MESOZOOPLANKTON IN CRE ACROSS ESTUARINE GRADIENT AND SEASONALITY IS SHAPED BY THE SEASONAL VARIATION OF TEMPERATURE, FLUVIAL PULSE AND WARM CURRENT INTRUSION. OUR FINDINGS PAVE THE WAY FOR FURTHER UNDERSTANDING ESTUARINE BIODIVERSITY AND HAVE IMPLICATIONS IN CONSERVATION STRATEGIES."
112,"Darren","not vetted",NA,"not vetted",112,"BROWN C;ABDULLAH S;MUMBY P",2015,"MINIMIZING THE SHORTTERM IMPACTS OF MARINE RESERVES ON FISHERIES WHILE MEETING LONGTERM GOALS FOR RECOVERY","CONSERVATION LETTERS","8","180-189","180-189","10.1111/conl.12124","MARINE RESERVES ARE A PROMISING TOOL FOR RECOVERING OVERFISHED ECOSYSTEMS. HOWEVER, RESERVES DESIGNED TO REBUILD PROFITS IN THE LONG-TERM MAY CAUSE SHORT-TERM LOSSES-A SERIOUS ISSUE IN REGIONS WHERE FISHERIES ARE KEY FOR FOOD SECURITY. WE EXAMINE THE TENSION BETWEEN THE LONG-TERM BENEFITS OF RESERVES AND SHORT-TERM LOSSES, USING A MULTISPECIES MODEL OF CORAL REEF FISHERIES. RESERVES DESIGNED TO MAXIMIZE LONG-TERM PROFITS CAUSED SIGNIFICANT SHORT-TERM LOSSES. WE MODEL SEVERAL POLICY SOLUTIONS, WHERE WE INCREMENTALLY INCREASED EITHER: THE NUMBER OF MONTHS PER YEAR THAT THE RESERVE IS CLOSED TO FISHING; THE SIZE OF THE RESERVE; OR THE NUMBER SPECIES PROTECTED WITHIN THE RESERVE. PROTECTING SPECIES SEQUENTIALLY, STARTING WITH THE MOST VALUED SPECIES, PROVIDED THE BEST OUTCOME IN THE SHORT-TERM WITH THE MOST RAPID RECOVERY OF PROFITS. SOLVING THE DILEMMA OF MEETING SHORT-AND LONG-TERM GOALS WILL ULTIMATELY IMPROVE THE EFFECTIVENESS OF MARINE RESERVES FOR MANAGING FISHERIES AND CONSERVING ECOSYSTEMS."
121,"Darren","not vetted",NA,"not vetted",121,"BOUCHARD C;TESSIER N;LAPOINTE F",2019,"WATERSHEDS INFLUENCE THE WOOD TURTLES GLYPTEMYS INSCULPTA GENETIC STRUCTURE","CONSERVATION GENETICS","20","653-664","653-664","10.1007/s10592-019-01169-1","THE WOOD TURTLE (GLYPTEMYS INSCULPTA) IS A FRESHWATER SPECIES ENDEMIC TO EASTERN NORTH AMERICA AND IS CURRENTLY LISTED AS ENDANGERED BY THE INTERNATIONAL UNION FOR CONSERVATION OF NATURE. WOOD TURTLE LOCAL POPULATIONS ARE CONSIDERED UNITS FOR THE SPECIES RECOVERY, AND ARE DEFINED AS DISCRETE INTERBREEDING POPULATIONS IN A DISTINCT WATERSHED; HOWEVER, THERE ARE NO STUDIES TO DATE SUPPORTING THIS DEFINITION. THE MAIN OBJECTIVE OF THIS PAPER WAS TO GENETICALLY CHARACTERIZE WOOD TURTLES FROM A NORTHERN PORTION OF THEIR RANGE, AND TEST AN ISOLATION-BY-WATERSHED HYPOTHESIS, THE FIRST OF ITS KIND AT SUCH A LARGE GEOGRAPHICAL SCALE. TURTLES WERE SAMPLED IN 24 WATERCOURSES FROM 12 DIFFERENT WATERSHEDS FOR A TOTAL OF 331 INDIVIDUALS, EACH GENOTYPED FOR NINE MICROSATELLITE LOCI. WITHIN EACH WATERSHED, GENETIC DIVERSITY WAS SIMILAR BETWEEN SITES, AND OBSERVED HETEROZYGOSITY RANGED FROM 0.677 TO 0.754. PARTIAL REDUNDANCY ANALYSES THEN CONFIRMED THAT WATERSHED ISOLATION CONTRIBUTED TO 18\% OF THE TOTAL OBSERVED GENETIC VARIATION, WHILE SPATIAL AUTOCORRELATION AND THE POST-GLACIAL EXPANSION MODEL DID NOT SIGNIFICANTLY EXPLAIN ANY VARIATION. CLUSTERING METHODS REVEALED SUBSTANTIAL SPATIAL GENETIC STRUCTURE, WITH SAMPLED GROUPS FALLING INTO TEN NESTED HIERARCHICAL CLUSTERS. WE RECOMMEND FURTHER CONSIDERATION OF THESE TEN CLUSTERS TO DETERMINE IF THEY MEET THE EVOLUTIONARY SIGNIFICANCE CRITERION TO BECOME DESIGNATABLE UNITS, WHOSE GENETIC STRUCTURES WERE INFLUENCED BY WATERSHED STRUCTURE."
124,"Darren","not vetted",NA,"not vetted",124,"BENITEZ-LOPEZ A;VINUELA J;MOUGEOT F;GARCIA J",2017,"A MULTISCALE APPROACH FOR IDENTIFYING CONSERVATION NEEDS OF TWO THREATENED SYMPATRIC STEPPE BIRDS","BIODIVERSITY AND CONSERVATION","26","63-83","63-83","10.1007/s10531-016-1222-7","HABITAT SELECTION IS AN INHERENTLY SCALE-SENSITIVE PROCESS IN WHICH DETECTED SELECTION PATTERNS FREQUENTLY DEPEND ON THE SCALE OF ANALYSIS EMPLOYED. WE USED A MULTI-SCALE MODELLING APPROACH TO IDENTIFY HOW THE DISTRIBUTIONS OF TWO SYMPATRIC BIRDS ARE SHAPED BY DIFFERENTIAL SELECTION AT THE LANDSCAPE, LAND USE AND MICROHABITAT SCALES AND BY HUMAN INFRASTRUCTURES AS POSSIBLE SOURCES OF DISTURBANCE. WE STUDIED TWO THREATENED STEPPE BIRDS, THE PIN-TAILED SANDGROUSE (PTS) AND BLACK-BELLIED SANDGROUSE (BBS) IN CENTRAL SPAIN. LAND USE GRADIENTS EXPLAINED MOST OF THE VARIATION IN PTS AND BBS OCCURRENCE, BUT THERE WAS CROSS-SCALE INTERDEPENDENCE BETWEEN THE LOWER (MICROHABITAT) AND UPPER (LANDSCAPE) SPATIAL SCALES FOR THE PTS. SYNERGIES BETWEEN THE THREE SCALES HIGHLIGHTED THE IMPORTANCE OF INTEGRATING HABITAT SCALES IN A SINGLE MODELLING FRAMEWORK. THE PROCESS OF HABITAT SELECTION WAS ALSO MODULATED BY HUMAN DISTURBANCE. BOTH SPECIES SELECTED PLOUGHS OF LARGE SIZE DISTANT FROM HOUSES, TRACKS AND OTHER INFRASTRUCTURES, ALTHOUGH BBS EXHIBITED BROADER HABITAT TOLERANCE THAN THE PTS, AND WAS MORE SENSITIVE TO HUMAN DISTURBANCE. AT MICROHABITAT SCALE, PTS SELECTED PLOUGHS WITH GREATER GREEN VEGETATION COVER AND INSECT ABUNDANCE AND FALLOWS WITH LOWER DRY VEGETATION COVER AND HEIGHT BUT GREATER STONE COVER. THIS MIGHT REFLECT A TRADE-OFF BETWEEN CAMOUFLAGE (VEGETATION AND STONE COVER FOR CONCEALMENT) AND VISIBILITY FOR PREDATOR DETECTION AND ESCAPE. PLOUGHS AND FALLOWS SHOULD BE MAINTAINED BY MEANS OF TRADITIONAL 2-YEAR ROTATIONS AND LOW MANAGEMENT DURING THE BREEDING SEASON. ONGOING URBANIZATION TRENDS AND INFRASTRUCTURE DEVELOPMENT INSIDE PROTECTED AREAS SHOULD BE LIMITED. MULTI-SCALE MODELS WERE KEY TO IDENTIFY SCALE-SPECIFIC FACTORS THAT DETERMINE SANDGROUSE HABITAT PREFERENCES AND CONSERVATION REQUIREMENTS AT APPROPRIATE LEVELS, AND ARE RECOMMENDED TO BETTER GUIDE REGIONAL AND LOCAL CONSERVATION EFFORTS OF THREATENED SPECIES."
130,"Darren","not vetted",NA,"not vetted",130,"ROGAN J",2021,"FIRST LOCALITY RECORD OF MELANISTIC ONCILLA LEOPARDUS TIGRINUS IN MONTEVERDE COSTA RICA","NEOTROPICAL BIOLOGY AND CONSERVATION","16","427-434","427-434","10.3897/neotropical.16.e65464","THE PERSISTENCE OF THE COAT COLOR POLYMORPHISM MELANISM HAS BEEN REPORTED FOR SEVERAL TROPICAL FELIDS, BUT ITS EVOLUTIONARY ADVANTAGES REMAIN AN ACTIVE AREA OF RESEARCH. FEW PUBLICATIONS HAVE EXPLORED MELANISM IN THE ELUSIVE SPECIES, ONCILLA (LEOPARDUS TIGRINUS) WITHIN THE NEOTROPICAL PART OF THEIR RANGE IN COSTA RICA. HEREIN, I PRESENT THE FIRST RECORD OF A MELANISTIC ONCILLA WITHIN THE MONTANE CLOUD FOREST OF MONTEVERDE, COSTA RICA. RECENT STUDIES HAVE FOUND SUPPORT FOR THEORIES (E.G. TEMPORAL SEGREGATION HYPOTHESIS AND GLOGER'S RULE) EXPLAINING THE ECOLOGICAL ADVANTAGES DRIVING MELANISM IN ONCILLA AND TROPICAL FELID POPULATIONS. HOWEVER, IT IS UNCLEAR WHAT IS DRIVING MELANISM IN THIS MONTEVERDE ONCILLA POPULATION DUE TO THE SINGULAR OBSERVATION. FURTHER RESEARCH INVESTIGATING WHETHER MELANISM IS OCCURRING AT A HIGHER FREQUENCY IN OTHER INDIVIDUALS IN THE REGION IS CRITICAL TO BETTER UNDERSTANDING THE OCCURRENCE OF MELANISM IN LOCAL POPULATIONS OF THIS CRYPTIC SPECIES. THE MONTANE CLOUD FOREST IN MONTEVERDE PROVIDES CRITICAL HABITAT TO THIS VULNERABLE SPECIES WITHIN THE SMALL NEOTROPICAL PART OF THEIR RANGE. MELANISTIC INDIVIDUALS MAY BE PARTICULARLY THREATENED BY LAND-USE CHANGE AND INCREASING HUMAN PRESSURE IF THEORIES FOR THE EVOLUTIONARY ADVANTAGES AND ECOLOGICAL CONDITIONS MOTIVATING MELANISM ARE SUPPORTED."
133,"Darren","not vetted",NA,"not vetted",133,"JULIEN A;COUNSELL K;BURGER A;BARBER D;COBOS C;JENNINGS R;CHRISTMAN B;KOUBA C",NA,"EFFECTS OF WILD SEMICAPTIVE AND CAPTIVE MANAGEMENT ON MALE CHIRICAHUA LEOPARD FROG SPERM QUALITY WITH IMPLICATIONS FOR CONSERVATION BREEDING PROGRAMS","CONSERVATION SCIENCE AND PRACTICE",NA,NA,NA,"10.1111/csp2.12864","THE CHIRICAHUA LEOPARD FROG (LITHOBATES CHIRICAHUENSIS) IS A THREATENED SPECIES ENDEMIC TO THE SOUTHWESTERN UNITED STATES AND NORTHERN MEXICO. CAPTIVE BREEDING PROGRAMS WERE ESTABLISHED TO SUPPORT REINTRODUCTION EFFORTS, YET REPRODUCTIVE OUTPUT HAS BEEN LOWER THAN NEEDED FOR RECOVERY OF THE SPECIES. THIS STUDY AIMED TO EVALUATE THE EFFECTS OF CAPTIVITY ON AMPHIBIAN REPRODUCTION BY (1) DETERMINING IF CAPTIVE, SEMI-CAPTIVE, AND WILD MALE L. CHIRICAHUENSIS PRODUCE SPERM AT SIMILAR RATES AND CONCENTRATION IN RESPONSE TO HORMONE TREATMENT; AND (2) EVALUATING THE QUALITY OF SPERM OBTAINED OVER TIME FROM THESE POPULATIONS. MALES FROM CAPTIVE, SEMI-CAPTIVE, AND WILD LOCATIONS WERE ADMINISTERED A COMBINATION OF HUMAN CHORIONIC GONADOTROPIN AND GONADOTROPIN-RELEASING HORMONE TO STIMULATE SPERM PRODUCTION AND RELEASE. A HIGH PERCENTAGE OF MALES IN THE CAPTIVE (60\%), SEMI-CAPTIVE (100\%), AND WILD (95.3\%) POPULATIONS PRODUCED SPERM FOLLOWING TREATMENT. SPERM QUALITY (FORWARD PROGRESSIVE MOTILITY AND TOTAL SPERM MOTILITY) DID NOT DIFFER BETWEEN GROUPS. HOWEVER, SPERM QUANTITY (SPERM/ML) DIFFERED (P < .05) BETWEEN POPULATIONS, WITH SEMI-CAPTIVE AND WILD MALES PRODUCING HIGHER CONCENTRATIONS OF SPERM THAN CAPTIVE MALES. THESE RESULTS SUGGEST THAT CHIRICAHUA LEOPARD FROG SPERM QUANTITY, BUT NOT QUALITY, MAY BECOME NEGATIVELY IMPACTED BY LONG-TERM CAPTIVITY IN INDOOR, CONTROLLED SETTINGS."
134,"Darren","not vetted",NA,"not vetted",134,"PAILLET Y;ARCHAUX F;DU P S;BOUGET C;BOULANGER V;DEBAIVE N;GILG O;GOSSELIN F;GUILBERT E",2018,"THE INDICATOR SIDE OF TREE MICROHABITATS A MULTITAXON APPROACH BASED ON BATS BIRDS AND SAPROXYLIC BEETLES","JOURNAL OF APPLIED ECOLOGY","55","2147-2159","2147-2159","10.1111/1365-2664.13181","1. NATIONAL AND INTERNATIONAL FOREST BIODIVERSITY ASSESSMENTS LARGELY RELY ON INDIRECT INDICATORS, BASED ON ELEMENTS OF FOREST STRUCTURE THAT ARE USED AS SURROGATES FOR SPECIES DIVERSITY. THESE PROXIES ARE REPUTEDLY EASIER AND CHEAPER TO ASSESS THAN BIODIVERSITY. TREE MICROHABITATSTREE-BORNE SINGULARITIES SUCH AS CAVITIES, CONKS OF FUNGI OR BARK CHARACTERISTICSHAVE GAINED ATTENTION AS POTENTIAL FOREST BIODIVERSITY INDICATORS. HOWEVER, AS WITH MOST BIODIVERSITY INDICATORS, THERE IS A LACK OF SCIENTIFIC EVIDENCE DOCUMENTING THEIR QUANTITATIVE LINK WITH THE BIODIVERSITY THEY ARE SUPPOSED TO ASSESS. 2. WE EXPLORED THE LINK BETWEEN MICROHABITAT INDICES AND THE RICHNESS AND ABUNDANCE OF THREE TAXONOMIC GROUPS: BATS, BIRDS AND SAPROXYLIC BEETLES. USING A NATION-WIDE MULTI-TAXON SAMPLING DESIGN IN FRANCE, WE COMPARED 213 PLOTS LOCATED INSIDE AND OUTSIDE STRICT FOREST RESERVES. WE HYPOTHESIZED THAT THE POSITIVE EFFECT SETTING ASIDE FOREST RESERVES HAS ON BIODIVERSITY CONSERVATION IS INDIRECTLY DUE TO AN INCREASE IN THE PROPORTION OF LARGE STRUCTURAL ELEMENTS (E.G., LIVING TREES, STANDING AND LYING DEADWOOD). THESE, IN TURN, ARE LIKELY TO FAVOUR THE QUANTITY AND DIVERSITY OF MICROHABITATS. WE ANALYSED THE RELATIONSHIP BETWEEN THE ABUNDANCE AND SPECIES RICHNESS OF DIFFERENT GROUPS AND GUILDS (E.G., RED-LISTED SPECIES, FOREST SPECIALISTS, CAVITY DWELLERS) AND MICROHABITAT DENSITY AND DIVERSITY. WE THEN USED CONFIRMATORY STRUCTURAL EQUATION MODELS TO ASSESS THE DIRECT AND INDIRECT EFFECTS OF MANAGEMENT ABANDONMENT, LARGE STRUCTURAL ELEMENTS AND MICROHABITATS ON THE BIODIVERSITY OF THE TARGET SPECIES. 3. FOR SEVERAL GROUPS OF BIRDS AND BATS, THE INDIRECT EFFECT OF MANAGEMENT ABANDONMENT AND LARGE STRUCTURAL ELEMENTS ON BIODIVERSITY WAS MEDIATED BY MICROHABITATS. HOWEVER, THE MAGNITUDE OF THE LINK BETWEEN MICROHABITAT INDICES AND BIODIVERSITY WAS MODERATE. IN PARTICULAR, SAPROXYLIC BEETLES' BIODIVERSITY WAS POORLY EXPLAINED BY MICROHABITATS, LARGE STRUCTURAL ELEMENTS OR MANAGEMENT ABANDONMENT."
140,"Darren","not vetted",NA,"not vetted",140,"SIMBA L;PRYKE J;ROETS C",2022,"INTERACTIVE EFFECTS OF RANGELAND MANAGEMENT AND RAINFALL ON DUNG BEETLE DIVERSITY","BIODIVERSITY AND CONSERVATION","31","2639-2656","2639-2656","10.1007/s10531-022-02448-z","INSECTS PERFORM MANY ECOSYSTEM FUNCTIONS, YET THEIR RESPONSES TO DISTURBANCE CAN BE UNPREDICTABLE. CHANGES IN CLIMATE MAY INTERACT WITH LAND USE DISTURBANCES, AND GIVEN THAT ARTHROPOD SPECIES DIVERSITY, ABUNDANCE, AND TRAITS WITHIN ASSEMBLAGES VARY WITH HABITAT STRUCTURE AND CLIMATIC VARIABLES, ECOLOGICAL FUNCTION MAY BE IMPAIRED. HERE, WE ASSESSED HOW DUNG BEETLE SPECIES RICHNESS, ABUNDANCE, FUNCTIONAL DIVERSITY, MEAN BODY SIZE AND BODY SIZE INEQUALITY (WHICH CAN SIGNAL ASSEMBLAGE STRESS RESPONSES) VARIED WITH CLIMATIC, MANAGEMENT AND HABITAT VARIABLES ON LIVESTOCK FARMS AND PROTECTED AREAS ACROSS A RAINFALL GRADIENT (138-381 MM/YEAR) IN ARID/SEMI-ARID SHRUBLAND (KAROO, SOUTH AFRICA, AN AREA FOR WHICH ENTOMOLOGICAL BIODIVERSITY IS RELATIVELY POORLY KNOWN), DURING A PROLONGED DROUGHT. SPECIES RICHNESS WAS SIMILAR BETWEEN FARMS AND PROTECTED AREAS, BUT ABUNDANCE WAS GREATER IN PROTECTED AREAS. FARMS TEND TO BE DOMINATED BY SHEEP IN THIS REGION, AND THE TYPE OF DUNG AND PAUCITY OF DUNG DIVERSITY, ALONG WITH USE OF ANTHELMINTICS MAY EXPLAIN THIS REDUCED ABUNDANCE. SPECIES RICHNESS AND ABUNDANCE INCREASED WITH MAMMALIAN HERBIVORE STOCKING RATES AND RAINFALL. MOST RECENT RAINFALL BEST PREDICTED SPECIES RICHNESS, BUT ABUNDANCE WAS BEST EXPLAINED BY THE LONG-TERM MEASURE OF RAINFALL (MEAN ANNUAL PRECIPITATION). FUNCTIONAL DIVERSITY SHOWED NO PATTERNS WITH THE ENVIRONMENTAL OR MANAGEMENT VARIABLES WE MEASURED. MEAN BODY LENGTH AND SIZE VARIATION DID NOT DIFFER BETWEEN PROTECTED AREAS AND FARMS, BUT THE SPREAD OF BEETLE SIZES WAS MORE EVEN AS VEGETATION COVER INCREASED AND SOIL CLAY CONTENT DECREASED. FUTURE CLIMATE PROJECTIONS INDICATE EXTREME DECLINES IN RAINFALL IN THIS AREA, AND OUR RESULTS SUGGEST THAT THIS WOULD DRAMATICALLY IMPACT DUNG BEETLE COMMUNITIES. MAINTAINING VEGETATION COVER MAY HELP MITIGATE EFFECTS OF CLIMATE CHANGE."
