"STUDY_ID","REVIEWERS","INCLUDE","REVIEWERS","INCLUDE","STUDY_ID","AUTHORS","YEAR","TITLE","JOURNAL","VOLUME","LPAGES","UPAGES","DOI","ABSTRACT"
1,"noone","not vetted",NA,"not vetted",1,"KALTSAS D;PANAYIOTOU E;KOUGIOUMOUTZIS K;CHATZAKI M",2019,"OVERGRAZED SHRUBLANDS SUPPORT HIGH TAXONOMIC FUNCTIONAL AND TEMPORAL DIVERSITY OF MEDITERRANEAN GROUND SPIDER ASSEMBLAGES","ECOLOGICAL INDICATORS","103","599-609","599-609","10.1016/j.ecolind.2019.04.024","THE PHRYGANIC AND MAQUIS SHRUBLANDS FORM THE MOST TYPICAL VEGETAL FORMATIONS IN THE EASTERN MEDITERRANEAN THAT SINCE THOUSANDS OF YEARS HAVE BEEN SUBJECT TO VARIOUS TYPES OF ANTHROPOGENIC DISTURBANCE, INCLUDING GRAZING. WE STUDIED THE IMPACT OF SHEEP AND GOAT GRAZING ON 50 ASSEMBLAGES OF GROUND SPIDERS (ARANEAE: GNAPHOSIDAE) IN PHRYGANIC, MAQUIS AND FOREST HABITATS FROM ZERO TO 2000 M ELEVATION ON CRETE, GREECE USING PITFALL TRAPS FOR ONE YEAR AT EACH SAMPLING SITE. IN TOTAL, 58 GNAPHOSID SPECIES AND 16,592 INDIVIDUALS WERE COLLECTED. CRETAN ENDEMIC GNAPHOSIDAE WERE NEGATIVELY AFFECTED BY INTENSIVE GRAZING AND, CONTRARY TO FINDINGS ON OTHER TAXA STUDIED ON THE ISLAND, THEY WERE SPARSE AND RARE THROUGHOUT THE STUDY AREA. THE SPECIES COMPOSITION OF GNAPHOSID ASSEMBLAGES WAS PRIMARILY DETERMINED BY ELEVATION. TRACHYZELOTES LYONNETI, UROZELOTES RUSTICUS, ZELOTES SCRUTATUS, ANAGRAPHIS PALLENS AND BERINDA AMABILIS PROVED TO BE SIGNIFICANT INDICATORS OF OVERGRAZING. THE VAST MAJORITY OF SPIDERS BELONGING TO SYNANTHROPIC AND NATIONALLY RED-LISTED SPECIES WERE FOUND IN OVERGRAZED SITES. DESPITE THEORETICAL EXPECTATIONS, WHILE THE AVERAGE ACTIVITY DENSITY DECREASED, THE NUMBER OF SPECIES, EVENNESS, RARITY, TAXONOMIC, TEMPORAL AND FUNCTIONAL DIVERSITY (FRIC) INDICES INCREASED WITH INCREASING GRAZING INTENSITY. THIS WAS MAINLY DUE TO THE NATURE OF DISTURBANCE ITSELF, WHICH PROBABLY ALLOWS EQUIBALANCED LOW ABUNDANCES OF INDIGENOUS OR SYNANTHROPIC SPECIES, RATHER THAN OVERDOMINANCE OF FEW, THUS PARTLY REFUTING THE OPPORTUNISTIC SPECIES HYPOTHESIS (OSH). GROUND SPIDER ASSEMBLAGES IN OVERGRAZED SITES COMPRISED SPARSE POPULATIONS OF MOSTLY RARE, OPPORTUNISTIC SPECIES WITH DIFFERENT COMBINATIONS OF LIFE-HISTORY TRAITS THAT PARTLY REPLACE OTHER SPECIES MORE COMMONLY FOUND IN THE LESS DEGRADED SITES. SPECIES OF THESE ASSEMBLAGES SHORTEN THEIR PHENOLOGIES TO MINIMIZE TEMPORAL CO-OCCURRENCE WITH EACH OTHER DUE TO RESOURCE LIMITATION. THESE DISTINCT COMMUNITY PATTERNS HIGHLIGHT GROUND SPIDERS AS GOOD INDICATORS OF GRAZING PRESSURE ON CRETE, ON SPECIES AND ASSEMBLAGE LEVEL. TO CONSERVE THE INDIGENOUS AND POTENTIALLY ENDANGERED INVERTEBRATE FAUNA, THE SPATIOTEMPORAL DISCONTINUITY OF GRAZING INCLUDING RESTED PATCHES IS IMPORTANT IN ORDER TO MAINTAIN SPATIAL VARIABILITY AND POSSIBLY LEAD TO HABITAT RESTORATION."
2,"noone","not vetted",NA,"not vetted",2,"MA B;XIE Y;ZHANG T;ZENG W;XUE Y",2021,"CONSTRUCTION OF A HUMANWILDLIFE SPATIAL INTERACTION INDEX IN THE THREERIVER SOURCE REGION CHINA","ECOLOGICAL INDICATORS","129",NA,NA,"10.1016/j.ecolind.2021.107986","IN THE CONTEXT OF TODAY'S RAPID ECONOMIC DEVELOPMENT AND INCREASINGLY STRICT ECOLOGICAL PROTECTION, INTERACTIONS BETWEEN HUMANS AND WILDLIFE WILL INTENSIFY. THEREFORE, WE NEED TO IDENTIFY THE SPATIAL DISTRIBUTION OF SUCH INTERACTIONS AND TO TAKE MEASURES TO MITIGATE POSSIBLE NEGATIVE INTERACTIONS. USING THE THREE-RIVERS SOURCE REGION AS A CASE STUDY, WE COMBINED SPECIES HABITAT SUITABILITY, SPECIES FEEDING HABITS, SPECIES CONSERVATION LEVELS AND HUMAN IMPACT INTENSITY TO CONSTRUCT A ``HUMAN-WILDLIFE SPATIAL INTERACTION INDEX'' (HWSII) TO EVALUATE THE INTENSITY OF HUMAN-WILDLIFE SPATIAL INTERACTIONS. THE OVERALL LEVEL OF HWSII WAS RELATIVELY LOW IN THE THREE-RIVER SOURCE REGION. HIGHER POTENTIAL HUMAN-WILDLIFE INTERACTIONS OCCURRED IN AREAS WITH ROADS AND RAILWAYS. AREAS OF RELATIVELY HIGH INTERACTIONS BETWEEN CARNIVORES AND LIVESTOCK WERE MAINLY LOCATED IN THE SOUTHERN PART OF THE STUDY AREA, AND THOSE WITH RELATIVELY HIGH INTERACTIONS BETWEEN HERBIVORES AND LIVESTOCK APPEARED IN THE WESTERN AND EASTERN PARTS. MANAGERS IN THESE AREAS SHOULD CONSIDER MITIGATION MEASURES. ALTHOUGH DEVELOPED FOR A SPECIFIC REGION OF CHINA, THE `HUMAN-WILDLIFE SPATIAL INTERACTION INDEX' COULD HAVE APPLICATION IN OTHER AREAS OF THE WORLD FOR SETTING A BASELINE REFERENCE TO IDENTIFY AREAS WITH THE POTENTIAL FOR HIGH LEVELS OF HUMAN-WILDLIFE INTERACTIONS AND PINPOINT PLACES WHERE POTENTIAL NEGATIVE INTERACTIONS CAN BE MITIGATED."
3,"noone","not vetted",NA,"not vetted",3,"TILLER L;HUMLE T;AMIN R;DEERE N;LAGO B;LEADER-WILLIAMS N;SINONI F;SITATI N;WALPOLE M;SMITH R",2021,"CHANGING SEASONAL TEMPORAL AND SPATIAL CROPRAIDING TRENDS OVER 15 YEARS IN A HUMANELEPHANT CONFLICT HOTSPOT","BIOLOGICAL CONSERVATION","254",NA,NA,"10.1016/j.biocon.2020.108941","HUMAN-WILDLIFE CONFLICT IS INCREASING DUE TO RAPID NATURAL VEGETATION LOSS AND FRAGMENTATION. WE INVESTIGATED SEASONAL, TEMPORAL AND SPATIAL TRENDS OF ELEPHANT CROP-RAIDING IN THE TRANS MARA, KENYA DURING 2014-2015 AND COMPARED OUR RESULTS WITH A PREVIOUS STUDY FROM 1999 TO 2000. OUR RESULTS SHOW EXTENSIVE CHANGES IN CROP RAIDING PATTERNS. THERE WAS A 49\% INCREASE IN INCIDENTS BETWEEN 1999-2000 AND 2014-2015 BUT AN 83\% DECLINE IN THE AMOUNT OF DAMAGE PER FARM. CROP-RAIDING WENT FROM HIGHLY SEASONAL DURING 1999-2000 TO YEARROUND DURING 2014-2015, WITH CROPS BEING DAMAGED AT ALL GROWTH STAGES. ADDITIONALLY, WE IDENTIFIED A NEW ELEPHANT GROUP TYPE INVOLVED IN CROP-RAIDING, COMPRISING OF MIXED GROUPS. SPATIAL PATTERNS OF CROP-RAIDING ALSO CHANGED, WITH MORE INCIDENTS DURING 2014-2015 NEIGHBOURING THE PROTECTED AREA, ESPECIALLY BY BULL GROUPS. CROP-RAIDING INTENSITY DURING 2014-15 INCREASED WITH FARMLAND AREA UNTIL A THRESHOLD OF 0.4 KM(2) WITHIN A 1 KM(2) GRID SQUARE, AND FARMS WITHIN 1 KM FROM THE FOREST BOUNDARY, 5 KM FROM THE PROTECTED AREA BOUNDARY AND 2 KM FROM VILLAGE CENTRES WERE MOST AT RISK OF CROP-RAIDING. IN THE LAST 20 YEARS THE MARA ECOSYSTEM HAS BEEN IMPACTED BY CLIMATE CHANGE, AGRICULTURAL EXPANSION AND INCREASED CATTLE GRAZING WITHIN PROTECTED AREAS. ELEPHANTS SEEM TO HAVE RESPONDED BY CROP-RAIDING CLOSER TO REFUGES, MORE FREQUENTLY AND THROUGHOUT THE YEAR BUT CAUSE LESS DAMAGE OVERALL. WHILE THIS MEANS THE DIRECT ECONOMIC IMPACT HAS DROPPED, MORE FARMERS MUST SPEND MORE TIME PROTECTING THEIR FIELDS, FURTHER REDUCING SUPPORT FOR CONSERVATION IN COMMUNITIES WHO CURRENTLY RECEIVE FEW BENEFITS FROM LIVING WITH WILDLIFE."
4,"noone","not vetted",NA,"not vetted",4,"WINTON S;BISHOP C;LARSEN K",2020,"WHEN PROTECTED AREAS ARE NOT ENOUGH LOWTRAFFIC ROADS PROJECTED TO CAUSE A DECLINE IN A NORTHERN VIPER POPULATION","ENDANGERED SPECIES RESEARCH","41","131-139","131-139","10.3354/esr01017","ANIMAL MORTALITY RESULTING FROM COLLISIONS WITH VEHICLES HAS EMERGED AS A MAJOR HUMAN-CAUSED THREAT TO WILDLIFE. WHILE DIRECT MORTALITY OF WILDLIFE FROM VEHICLES HAS BEEN WELL DOCUMENTED, FEWER STUDIES HAVE FOCUSSED ON THE POPULATION-LEVEL EFFECTS OF ROAD MORTALITY, PARTICULARLY DUE TO LOW-TRAFFIC VOLUME ROADS. WE CONDUCTED A POPULATION VIABILITY ANALYSIS (PVA) ON WESTERN RATTLESNAKES CROTALUS OREGANUS OCCUPYING A PROTECTED AREA WITH LOW ROAD DENSITY AND AN AVERAGE TRAFFIC VOLUME OF APPROXIMATE TO 350 VEHICLES D(-1), NEAR THE NORTHERN PERIPHERY OF THE SPECIES' RANGE. WE USED THE PROGRAM VORTEX WITH A FIELD-DERIVED DATABASE ON ROAD MORTALITY, POPULATION DEMOGRAPHY, AND EXTENT OF OCCURRENCE. THE MODEL SHOWED THAT ALTHOUGH THE POPULATION HAD A HIGH LIKELIHOOD OF PERSISTENCE OVER THE NEXT 100 YR (EXTINCTION PROBABILITY <0.01), A SUBSTANTIAL DECLINE WAS PROJECTED (STOCHASTIC GROWTH RATE -0.035, 97\% DECREASE IN MEAN POPULATION SIZE, FROM 2131 TO 72) UNDER THE CURRENT ROAD MORTALITY RATE (6.6\% OF POPULATION YR())(-1); ANY INCREASES IN ROAD MORTALITY RATES WERE PROJECTED TO CAUSE EXTIRPATION IN UNDER 100 YR. OUR STUDY PROVIDES STRONG EVIDENCE THAT ROAD MORTALITY IS AND WILL CONTINUE TO BE A SIGNIFICANT CONTRIBUTOR TO THE DECLINE OF THIS THREATENED SPECIES, EVEN WITHOUT HIGHER TRAFFIC VOLUMES AND OTHER SIGNIFICANT ANTHROPOGENIC IMPACTS."
7,"noone","not vetted",NA,"not vetted",7,"LECQ S;BALLOUARD J;CARON S;LIVOREIL V;MATTHIEU L;BONNET X",2014,"BODY CONDITION AND HABITAT USE BY HERMANNS TORTOISES IN BURNT AND INTACT HABITATS","CONSERVATION PHYSIOLOGY","2",NA,NA,"10.1093/conphys/cou019","IN MEDITERRANEAN REGIONS, FIRES THREATEN TERRESTRIAL TORTOISES. NEVERTHELESS, VARYING PROPORTIONS OF ADULTS SURVIVE FIRE; THESE SURVIVING INDIVIDUALS CAN PLAY A CENTRAL ROLE FOR POPULATION RECOVERY. THE REGIONS DEVASTATED BY FIRE OFTEN INCLUDE IMPORTANT HABITAT OF HERMANN'S TORTOISES (TESTUDO HERMANNI HERMANNI), SO ASSESSING THE ABILITY OF SURVIVORS TO PERSIST IS ESSENTIAL FOR CONSERVING THE SPECIES. BODY-CONDITION INDICES PROVIDE AN INTEGRATIVE ESTIMATE OF HOW WELL INDIVIDUALS COPE WITH ENVIRONMENTAL VARIATIONS AND IMPACTS, INCLUDING FIRES. BETWEEN 2002 AND 2009, WE MONITORED HERMANN'S TORTOISES IN INTACT AND BURNT HABITATS IN SOUTHEASTERN FRANCE. IN SUMMER 2003, A STRONG FIRE RAVAGED HALF OF THE SURVEYED ZONE, PROVIDING AN OPPORTUNITY TO COMPARE BODY CONDITION OF TORTOISES BETWEEN INTACT AND BURNT AREAS OVER TIME. SIX YEARS LATER, THE IMPACT OF FIRE ON VEGETATION WAS STILL MARKED; LARGE TREES WERE ABUNDANT IN THE INTACT AREA, WHEREAS OPEN SHRUB VEGETATION PREVAILED IN THE BURNT AREA. IN BOTH AREAS, THE MEAN BODY CONDITION OF TORTOISES FLUCTUATED OVER TIME; HOWEVER, THERE WERE NO DIFFERENCES BETWEEN THE TWO AREAS. A RADIO-TRACKING EXPERIMENT DEMONSTRATED THAT INDIVIDUALS FROM EACH AREA WERE RESIDENTS, AND NOT VAGRANTS COMMUTING BETWEEN AREAS. WE ALSO ASSESSED CHANGES IN BODY CONDITION AND MICROHABITAT USE IN RADIO-TRACKED INDIVIDUALS. WE FOUND NO SIGNIFICANT DIFFERENCES BETWEEN THE TORTOISES LIVING IN THE BURNT AND INTACT AREAS, DESPITE SUBTLE DIFFERENCES IN HABITAT USE. IN CONCLUSION: (I) SURVIVING TORTOISES IN AN AREA RAVAGED BY FIRE CAN MAINTAIN THEIR BODY CONDITION LIKE INDIVIDUALS LIVING IN AN INTACT AREA, AND THUS, INDIVIDUALS FROM BURNT AREAS SHOULD NOT BE TRANSLOCATED TO SUPPOSEDLY BETTER AREAS; AND (II) DEPOPULATED BURNT AREAS ARE LIKELY TO BE APPROPRIATE FOR POPULATION-AUGMENTATION PROGRAMMES."
8,"noone","not vetted",NA,"not vetted",8,"ZHANG Z;MAMMOLA S;XIAN W;ZHANG H",2020,"MODELLING THE POTENTIAL IMPACTS OF CLIMATE CHANGE ON THE DISTRIBUTION OF ICHTHYOPLANKTON IN THE YANGTZE ESTUARY CHINA","DIVERSITY AND DISTRIBUTIONS","26","126-137","126-137","10.1111/ddi.13002","AIM SPECIES DISTRIBUTION MODELS (SDMS) ARE AN EFFECTIVE TOOL TO EXPLORE THE POTENTIAL DISTRIBUTION OF TERRESTRIAL, FRESHWATER AND MARINE ORGANISMS; HOWEVER, SDMS HAVE BEEN SELDOM USED TO MODEL ICHTHYOPLANKTON DISTRIBUTIONS, AND THUS, OUR UNDERSTANDING OF HOW LARVAL STAGES OF FISHES WILL RESPOND TO CLIMATE CHANGE IS STILL LIMITED. HERE, WE DEVELOPED SDMS TO EXPLORE POTENTIAL IMPACTS OF CLIMATE CHANGE ON HABITAT SUITABILITY OF ICHTHYOPLANKTON. LOCATION YANGTZE ESTUARY, CHINA. METHODS USING LONG-TERM ICHTHYOPLANKTON SURVEY DATA AND A LARGE SET OF MARINE PREDICTOR VARIABLES, WE DEVELOPED ENSEMBLE SDMS FOR FIVE ABUNDANT ICHTHYOPLANKTON SPECIES IN THE YANGTZE ESTUARY (COILIA MYSTUS, HYPOATHERINA VALENCIENNEI, LARIMICHTHYS POLYACTIS, SALANX ARIAKENSIS AND CHELIDONICHTHYS SPINOSUS). THEN, WE PROJECTED THEIR HABITAT SUITABILITY UNDER PRESENT AND FUTURE CLIMATE CONDITIONS. RESULTS THE ENSEMBLE SDMS HAD GOOD PREDICTIVE PERFORMANCE AND WERE SUCCESSFUL IN ESTIMATING THE KNOWN DISTRIBUTIONS OF THE FIVE SPECIES. MODEL PROJECTIONS HIGHLIGHTED TWO CONTRASTING PATTERNS OF RESPONSE TO FUTURE CLIMATES: WHILE C. MYSTUS WILL LIKELY EXPAND ITS RANGE, THE RANGES OF THE OTHER FOUR SPECIES WILL LIKELY CONTRACT AND SHIFT NORTHWARD. MAIN CONCLUSIONS ACCORDING TO OUR SDM PROJECTIONS, THE FIVE ICHTHYOPLANKTON SPECIES THAT WE TESTED IN THE YANGTZE ESTUARY ARE LIKELY TO RESPOND DIFFERENTLY TO FUTURE CLIMATE CHANGES. THESE PROJECTED DIFFERENT RESPONSES SEEMINGLY REFLECT THE DIFFERENTIAL FUNCTIONAL ATTRIBUTES AND LIFE-HISTORY STRATEGIES OF THESE SPECIES. TO THE EXTENT THAT CLIMATE CHANGE EMERGES AS A CRITICAL DRIVER OF THE FUTURE DISTRIBUTION OF THESE SPECIES, OUR FINDINGS PROVIDE AN IMPORTANT ROADMAP FOR DESIGNING FUTURE CONSERVATION STRATEGIES FOR ICHTHYOPLANKTON IN THIS REGION."
9,"noone","not vetted",NA,"not vetted",9,"JONSSON M;RUETE A;KELLNER O;GUNNARSSON U;SNALL T",2017,"WILL FOREST CONSERVATION AREAS PROTECT FUNCTIONALLY IMPORTANT DIVERSITY OF FUNGI AND LICHENS OVER TIME","BIODIVERSITY AND CONSERVATION","26","2547-2567","2547-2567","10.1007/s10531-015-1035-0","INCORPORATING FUNCTIONAL VALUES IN BIODIVERSITY MONITORING SYSTEMS COULD ADD NOVEL PERSPECTIVES OF THE STATUS OF BIODIVERSITY IN CONSERVATION AREAS. STABLE FREQUENCIES OF LARGE FOLIOSE NITROGEN-FIXING CYANOLICHENS LIKELY HAVE POSITIVE EFFECTS ON THE NITROGEN BUDGET OF FORESTS AND PROVIDE FOOD, MATERIAL AND SHELTER FOR INVERTEBRATES, GASTROPODS AND BIRDS. STABLE VOLUMES OF DEADWOOD AND FREQUENCIES OF ASSOCIATED FUNGI PROVIDE AN IMPORTANT SUPPORTING FUNCTION FOR ECOSYSTEM SERVICES SUCH AS NUTRIENT CYCLING, CARBON STORAGE AND SOIL FORMATION. BASED ON REGIONAL MONITORING DATA FROM BOREAL OLD-GROWTH FOREST NATURE RESERVES AND KEY HABITATS, WE TESTED FOR CHANGES IN THE FREQUENCY OF VARIOUS FUNCTIONALLY IMPORTANT SUBSTRATES AND SPECIES OVER TIME. WE DETECTED SIGNIFICANT REDUCTIONS IN THE FREQUENCY OF INDICATOR CYANOLICHENS OCCURRING ON DECIDUOUS TREES ALREADY AFTER 10 YEARS IN KEY HABITATS, DESPITE NON-SIGNIFICANT CHANGES IN THEIR HOST SUBSTRATES. FREQUENCIES OF INDICATOR PENDULOUS LICHENS ALECTORIA SARMENTOSA AND BRYORIA NADVORNIKIANA HAD ALSO DECREASED IN KEY HABITATS, DESPITE OVERALL STABLE VOLUMES OF LARGE CONIFER HOST TREES. LICHEN REDUCTIONS WERE MORE PRONOUNCED IN THE SMALLER KEY HABITATS COMPARED TO THE LARGER FORMALLY PROTECTED NATURE RESERVES, LIKELY DUE TO DEGRADING FRAGMENTATION AND ISOLATION EFFECTS. IN CONTRAST TO THESE LICHENS, THE AVERAGE FREQUENCIES OF OLD-GROWTH FOREST INDICATOR FUNGI DECAYING CONIFEROUS DEADWOOD AND COMMON FUNGI ON DECIDUOUS TREES (FOMES FOMENTARIUS) AND CONIFEROUS TREES (FOMITOPSIS PINICOLA) REMAINED UNCHANGED. THE STUDIED CYANOLICHENS AND FRUITING FUNGI GENERALLY HAD SIMILAR EXTINCTION RATES OVER 10 YEARS, WHILST ONLY CYANOLICHENS HAD SUBSTANTIALLY LOWER COLONIZATION RATES. AMID A SEVERELY FRAGMENTED LANDSCAPE, CONSERVATION AREAS SEEM TO STRUGGLE IN PRESERVING SOME OF THE BASIC OLD-GROWTH FOREST VALUES."
10,"noone","not vetted",NA,"not vetted",10,"BOULEY P;POULOS M;BRANCO R;CARTER N",2018,"POSTWAR RECOVERY OF THE AFRICAN LION IN RESPONSE TO LARGESCALE ECOSYSTEM RESTORATION","BIOLOGICAL CONSERVATION","227","233-242","233-242","10.1016/j.biocon.2018.08.024","WE PRESENT DATA FROM THE FIRST, LONG-TERM STUDY UNDERWAY OF A RECOVERING POPULATION OF INDIGENOUS, FREE-RANGING PANTHERA LEO IN GORONGOSA NATIONAL PARK (GNP), MOZAMBIQUE. GNP IS UNDERGOING POST-WAR RECOVERY AND LARGE-SCALE ECOLOGICAL RESTORATION UNDER A 25-YEAR PRIVATE-GOVERNMENTAL PARTNERSHIP - THE ``GORONGOSA PROJECT (GP),'' - OFFERING A RARE OPPORTUNITY TO ELUCIDATE THE LONG-TERM RECOVERY DYNAMICS OF A POPULATION OF LION IN RESPONSE TO STRATEGIC CONSERVATION INTERVENTIONS. GNP FORMS A CORE PART OF THE GREATER GORONGOSA-MARROMEU LION CONSERVATION UNIT WHICH IS DESIGNATED AS A ``POTENTIAL LION STRONGHOLD.'' WITHIN THE PARK WE ESTABLISHED AN INTENSIVE STUDY AREA OF 1100 KM(2) ENCOMPASSING PRIME AREAS OF HERBIVORE PRODUCTIVITY. BETWEEN 2012 AND 2016, 104 LIONS WERE DOCUMENTED AND 6 PRIDES AND 7 MALES OR COALITIONS IN OUR STUDY AREA WERE SATELLITE-COLLARED AND INTENSIVELY MONITORED. WE DESCRIBE SEASONAL MALE AND FEMALE HOME-RANGES, PREY UTILIZATION, ESTIMATED VERSUS PREDICTED LION DENSITIES IN RELATION TO RECOVERING HERBIVORE BIOMASS, AND ANTHROPOGENIC FACTORS LIMITING THE POPULATION'S FULL RECOVERY POTENTIAL. THE DOMINANT FACTOR OBSERVED TO BE NEGATIVELY IMPACTING THE POPULATION WAS TOP-DOWN AND ANTHROPOGENIC IN THE FORM OF BY-CATCH BY WIRE SNARES AND STEEL JAW TRAPS SET BY BUSHMEAT HUNTERS. THESE FINDINGS HAVE SINCE RESULTED IN TANGIBLE AND MEASURABLE INTERVENTIONS TO REDUCE THESE IMPACTS AND RESULTANT FUTURE DATASETS WILL ELUCIDATE DETAILED DEMOGRAPHY AND HOW MANAGEMENT INTERVENTIONS IMPACTED THE TRAJECTORY OF LARGE-CARNIVORE RECOVERY."
11,"noone","not vetted",NA,"not vetted",11,"BROCARDO C;RODARTE R;BUENO R;CULOT L;GALETTI M",2012,"NONVOLANT MAMMALS OF CARLOS BOTELHO STATE PARK PARANAPIACABA FOREST CONTINUUM","BIOTA NEOTROPICA","12","198-208","198-208","10.1590/S1676-06032012000400021","THE ATLANTIC FOREST IS ONE OF THE MOST STUDIED BRAZILIAN BIOMES IN RELATION TO ITS MAMMALIAN FAUNA. HOWEVER, THERE IS STILL A SERIES OF GAPS OF KNOWLEDGE ABOUT THE DISTRIBUTION AND PERSISTENCE OF SOME OF THESE SPECIES WHICH PREVENTS TAKING ADEQUATE CONSERVATION MEASURES TO BETTER PROTECT THE MAMMALS. IN ORDER TO MAKE THE INVENTORY OF THE NON-VOLANT MAMMALIAN FAUNA OF THE CARLOS BOTELHO STATE PARK (SP), WE COMPILED DATA OF CAMERA TRAPPING, DIURNAL CENSUS, TRACK RECORDS, PITFALL AND LIVE TRAPPING COLLECTED OVER 8 YEARS (2004-2012). WE REGISTERED A TOTAL OF 53 SPECIES, OF WHICH 12 ARE REGIONALLY THREATENED AND ONE IS AN EXOTIC SPECIES (LEPUS EUROPAEUS), INCLUDING THE PRESENCE OF MOST MAMMAL.SPECIES EXPECTED FOR THE PARANAPIACABA FOREST CONTINUUM. THE HIGH NON-VOLANT MAMMALS SPECIES RICHNESS ALLIED TO THE PRESENCE OF THREATENED SPECIES, STRENGTHEN THE ROLE OF THIS PROTECTED AREA FOR MAMMAL CONSERVATION IN THE ATLANTIC FOREST. ALTHOUGH, THE LOCAL EXTINCTION OF ONE SPECIES, TAYASSU PECAN, ALERT TO THE NEED FOR EFFECTIVE MEASURES OF PROTECTION."
12,"noone","not vetted",NA,"not vetted",12,"MILLER R;MARSH H;BENHAM C;HAMANN M",2020,"STAKEHOLDER ENGAGEMENT IN THE GOVERNANCE OF MARINE MIGRATORY SPECIES BARRIERS AND BUILDING BLOCKS","ENDANGERED SPECIES RESEARCH","43","1-19","1-19","10.3354/esr01049","MEANINGFUL STAKEHOLDER ENGAGEMENT IS IMPORTANT TO COLLABORATIVE DECISION-MAKING AND TO EFFECTIVE POLYCENTRIC GOVERNANCE, PARTICULARLY WHEN MANAGING CROSS-SCALE ENVIRONMENTAL ISSUES LIKE THOSE INVOLVING MARINE MIGRATORY SPECIES. IN THIS PAPER, WE EXPLORE THE BARRIERS TO, AND OPPORTUNITIES FOR, STAKEHOLDER INVOLVEMENT IN THE GOVERNANCE OF THREATS TO MARINE MIGRATORY SPECIES IN EASTERN AUSTRALIA, USING SEMI-STRUCTURED QUALITATIVE INTERVIEWS AND A FOCUS GROUP, AS AN EXAMPLE OF THE GENERIC PROBLEM OF MANAGING MIGRATORY SPECIES WITHIN A LARGE RANGE STATE WITH MULTIPLE JURISDICTIONS. RESPONDENTS IDENTIFIED SEVERAL BARRIERS TO, AND OPPORTUNITIES FOR, IMPROVED STAKEHOLDER INVOLVEMENT IN THE GOVERNANCE OF MARINE MIGRATORY SPECIES, CORRESPONDING TO 4 MAIN THEMES: DECISION-MAKING PROCESSES, INFORMATION SHARING, INSTITUTIONAL STRUCTURES, AND PARTICIPATION PROCESSES. RESPONDENTS INDICATED THAT THE GOVERNANCE SYSTEM PROTECTING MARINE TURTLES, DUGONGS, HUMPBACK WHALES, AND NON-THREATENED MIGRATORY SHOREBIRDS IN EASTERN AUSTRALIA WOULD BENEFIT FROM THE INTRODUCTION OF NEW INFORMATION PATHWAYS, REFORMED INSTITUTIONAL STRUCTURES (INCLUDING ENVIRONMENTAL LEGISLATION), AND IMPROVED PARTICIPATORY PATHWAYS FOR NON-GOVERNMENT STAKEHOLDERS. SUCH CHANGES COULD HELP HARMONISE THE PROCESS OF MANAGING THESE SPECIES, LEADING TO MORE EFFECTIVE CONSERVATION MANAGEMENT THROUGHOUT THEIR RANGE."
14,"noone","not vetted",NA,"not vetted",14,"BINO G;BRANDIS K;KINGSFORD R;PORTER J",2020,"WATERBIRD SYNCHRONY ACROSS AUSTRALIAS HIGHLY VARIABLE DRYLAND RIVERS RISKS AND OPPORTUNITIES FOR CONSERVATION","BIOLOGICAL CONSERVATION","243",NA,NA,"10.1016/j.biocon.2020.108497","UNDERSTANDING THE MECHANISMS WHICH DRIVE LARGE SCALE POPULATION DYNAMICS OF HIGHLY MOBILE ORGANISMS, SUCH AS BIRDS, IS AS CHALLENGING AS IT IS IMPORTANT. FOR WATERBIRDS DEPENDING ON AUSTRALIA'S DRYLAND RIVERS, LITTLE IS KNOWN ABOUT THE SPATIOTEMPORAL DYNAMICS AND DEGREE OF POPULATION SYNCHRONY, DESPITE ITS IMPORTANCE FOR CONSERVATION THEORY AND PRACTICE. WE EXAMINED SPATIAL SYNCHRONY IN 50 WATERBIRD SPECIES USING AERIAL SURVEY DATA OVER THE PAST THREE DECADES (1983-2016), ACROSS TWO OF AUSTRALIA'S LARGEST RIVER BASINS, REPRESENTING ALMOST A THIRD OF THE CONTINENT USING STATE-SPACE MODELS. THERE WAS BROAD SYNCHRONY IN THE RESPONSES OF AUSTRALIAN WATERBIRD NUMBERS IN WETLANDS, VARYING AMONG FUNCTIONAL RESPONSE GROUPS, REFLECTING THE SPATIOTEMPORAL MOSAIC OF FLOODED WETLANDS ACROSS MULTIPLE SCALES. DUCKS, THE MOST ABUNDANT FUNCTIONAL RESPONSE GROUP, AND HERBIVOROUS WATERBIRDS DISPLAYED STRONG SPATIOTEMPORAL SYNCHRONY WITHIN AND BETWEEN THE LAKE EYRE BASIN AND MURRAY-DARLING BASIN, WHILE SYNCHRONY OF PISCIVORES WAS PATCHIER. IN CONTRAST, LARGE WADERS AND PARTICULARLY SHOREBIRDS HAD POOR SYNCHRONICITY. WHILE RAINFALL AMONG CATCHMENTS WITHIN RIVER BASINS WAS HIGHLY CORRELATED, STREAMFLOW WAS CORRESPONDINGLY WEAKLY CORRELATED IN THE MURRAY-DARLING BASIN PRIMARILY BECAUSE RIVER REGULATION HAD SEPARATED RAINFALL FROM FLOW AND INUNDATION, POTENTIALLY COMPROMISING WATERBIRD RESPONSE TRIGGERS. THERE ARE CLEAR CONSERVATION IMPLICATIONS FOR WETLANDS AND THEIR WATERBIRD POPULATIONS, PRINCIPALLY THE PROTECTION OF NATURAL FLOW REGIMES IN THE LAKE EYRE BASIN AND WHERE NEEDED, RESTORATION OF ENVIRONMENTAL FLOWS IN THE MURRAY-DARLING BASIN. ALSO, MANAGEMENT OF WATERBIRDS NEEDS TO OFTEN EXTEND BEYOND THE BOUNDARIES OF BASINS."
15,"noone","not vetted",NA,"not vetted",15,"OLIVER D L E A;ARENAS M A;TZEEK ;TUZ M;PEREZ-COLLAZOS E",2017,"ARE ANTHROPOGENIC FACTORS AFFECTING NESTING HABITAT OF SEA TURTLES THE CASE OF KANZUL BEACH RIVIERA MAYATULUM MEXICO","JOURNAL OF COASTAL CONSERVATION","21","85-93","85-93","10.1007/s11852-016-0473-5","MARINE COAST MODIFICATION AND HUMAN PRESSURE AFFECTS MANY SPECIES, INCLUDING SEA TURTLES. IN ORDER TO STUDY NINE ANTHROPOGENIC IMPACTS THAT MIGHT AFFECT NESTING SELECTION OF FEMALES, INCUBATION AND HATCHING SURVIVAL OF LOGGERHEAD (CARETTA CARETTA) AND GREEN TURTLE (CHELONIA MYDAS), BUILDING STRUCTURES WERE IDENTIFIED ALONG A 5.2 KM BEACH IN KANZUL (MEXICO). A HIGH NUMBER OF HOTELS AND HOUSES (88; 818 ROOMS), WITH AN AVERAGE DENSITY OF 16.6 BUILDINGS PER KILOMETER WERE FOUND. THESE BUILDINGS FORM A BARRIER WHICH PREVENTS REACHING THE BEACH FROM INLAND, RESULTING IN HABITAT FRAGMENTATION. MAIN PRESSURES WERE DETECTED DURING NESTING SELECTION (14.19\% OF TURTLE NESTING ATTEMPTS INTERRUPTED), AND LOW IMPACT WERE FOUND DURING INCUBATION (0.77\%) AND HATCHING (4.7\%). THERE WERE THREE IMPACTS DEFINED AS HIGH: BEACH FURNITURE THAT BLOCKS OUT THE MOVEMENT OF HATCHLINGS OR FEMALES, DIRECT PRESSURE BY TOURISTS, AND ARTIFICIAL BEACHFRONT LIGHTING THAT CAN POTENTIALLY MISLEAD HATCHLINGS OR FEMALES. HIGH IMPACTED AREAS SHOWED LOWEST VALUES IN NESTING SELECTION AND HATCHING SUCCESS. BASED ON OUR RESULTS, WE SUGGEST MANAGEMENT STRATEGIES TO NEED TO BE IMPLEMENTED TO REDUCE HUMAN PRESSURE AND TO AVOID NESTING HABITAT LOSS OF LOGGERHEAD AND GREEN TURTLE IN KANZUL, MEXICO."
16,"noone","not vetted",NA,"not vetted",16,"WILLIAMSON M;CURNICK D;JACOBY S;O'NEILL H",2022,"ETHICAL CONSIDERATIONS IN NATURAL HISTORY FILM PRODUCTION AND THE NEED FOR INDUSTRYWIDE BEST PRACTICE","GLOBAL ECOLOGY AND CONSERVATION","34",NA,NA,"10.1016/j.gecco.2021.e01981","NATURAL HISTORY DOCUMENTARY FILMS CAN BE A POWERFUL TOOL FOR WILDLIFE CONSERVATION, PROVIDING AN ACCESSIBLE MEANS TO INCREASE PUBLIC KNOWLEDGE OF THE NATURAL WORLD. THERE HAS BEEN AN INCREASING FOCUS IN DOCUMENTARY FILMS ON THE THREATS TO BIODIVERSITY IN RECENT YEARS THAT HAS POSITIVELY AIDED CONSERVATION EFFORTS. HOWEVER, POTENTIAL ETHICAL AND WELFARE IMPLICATIONS OF NATURAL HISTORY FILM MAKING ARE OFTEN OVERLOOKED. HERE, WE CONSIDER THE DESIGN AND IMPACT OF THE NARRATIVES USED AND THE FILMING METHODS EMPLOYED IN NATURAL HISTORY FILM MAKING AND THEIR POTENTIAL IMPLICATIONS FOR CONSERVATION. ALTHOUGH THESE PROGRAMMES ARE OFTEN LAUDED FOR THEIR CINEMATOGRAPHY, FILMING TECHNIQUES AND PRACTICES SHOULD SATISFY HIGH ETHICAL STANDARDS AND SHOULD BE EVALUATED TO ASSESS DISTURBANCE CAUSED TO WILDLIFE AND ANY ASSOCIATED NEGATIVE BEHAVIOURAL AND PHYSIOLOGICAL IMPACTS. THIS EVALUATION SHOULD INCLUDE THE DIRECT IMPACT OF THE FILMING, AS WELL AS CONSIDERING THE RISK OF VIEWERS REPLICATING HUMAN-WILDLIFE ENCOUNTERS THEY SEE ON FILM. TRENDS TOWARDS THE USE OF HIGHLY DRAMATIZED STORYTELLING, ANTHROPOMORPHISM AND THE INCLUSION OF INACCURATE INFORMATION SHOULD ALSO BE ADDRESSED. ALTHOUGH SOME PRODUCTION COMPANIES HAVE FILMING GUIDELINES IN PLACE, THIS IS NOT STANDARD INDUSTRY PRACTICE. NATURAL HISTORY FILMS ARE AN IMPORTANT MEANS OF EDUCATING AND ENTHUSING PEOPLE ABOUT NATURE AND ITS CONSERVATION; HOWEVER, IT IS VITAL THAT FILMS ARE MADE RESPONSIBLY. TO FACILITATE THIS DISCUSSION, WE PROPOSE RECOMMENDATIONS, INCLUDING STANDARDISED INDUSTRY-WIDE GUIDELINES, CODES OF CONDUCT AND INDEPENDENT ETHICAL REVIEWS, FOR NATURAL HISTORY FILM MAKERS TO MITIGATE AND AVOID NEGATIVE IMPACTS."
