"STUDY_ID","REVIEWERS","INCLUDE","REVIEWERS","INCLUDE","STUDY_ID","AUTHORS","YEAR","TITLE","JOURNAL","VOLUME","LPAGES","UPAGES","DOI","ABSTRACT"
52,"Darren","not vetted",NA,"not vetted",52,"DOMBROSKI J;PARKS S;NOWACEK D",2021,"DIVE BEHAVIOR OF NORTH ATLANTIC RIGHT WHALES ON THE CALVING GROUND IN THE SOUTHEAST USA IMPLICATIONS FOR CONSERVATION","ENDANGERED SPECIES RESEARCH","46","35-48","35-48","10.3354/esr01141","THE NORTH ATLANTIC RIGHT WHALE EUBALAENA GLACIALIS IS A CRITICALLY ENDANGERED WHALE WHOSE HABITAT OVERLAPS WITH AREAS OF HIGH HUMAN USE. ON FEEDING GROUNDS, ASPECTS OF ITS BEHAVIOR INCREASE THE VULNERABILITY OF THIS SPECIES TO ANTHROPOGENIC THREATS SUCH AS ENTANGLEMENT IN FISHING GEAR AND VESSEL STRIKES. ON THE CALVING GROUND, NATURAL DIVE BEHAVIOR AND THE IMPLICATIONS FOR CONSERVATION EFFORTS IN THIS SPECIES REMAIN TO BE EVALUATED. IN THIS STUDY, WE USED 102.17 H OF TAG DATA COLLECTED OVER 15 DEPLOYMENTS OF ARCHIVAL TAGS ON 14 INDIVIDUALS TO DESCRIBE THE DIVE BEHAVIOR OF RIGHT WHALES IN THE SOUTHEAST USA. LACTATING FEMALES SPENT UP TO 80\% OF THE TIME AT DEPTHS = 3.5 M, LEADING TO INCREASED RISK OF VESSEL STRIKE COMPARED TO OTHER WHALE GROUPS THAT SPENT A MAXIMUM OF 30\% OF THE TIME AT THOSE DEPTHS IN THIS HABITAT. NON-LACTATING WHALES HAD SIGNIFICANTLY DEEPER MAXIMUM DIVE DEPTHS (12.1 M) THAN LACTATING FEMALES (7.3 M) AND SPENT MORE TIME IN THE BOTTOM PHASE OF DIVES, CLOSER TO THE SEA FLOOR (45 VS. 37\% OF THE DIVE DURATION, RESPECTIVELY). TIME SPENT CLOSER TO THE SEA FLOOR INCREASES THE PROBABILITY OF INTERACTION WITH FISHING GEAR. THEREFORE, THESE DIVE DATA ARE USEFUL TO JUSTIFY SEASONAL CLOSURES OF FISHING ACTIVITY ON THE CALVING GROUND TO PROTECT BOTH LACTATING AND NON-LACTATING WHALES. OPPORTUNISTIC COMPARISONS REVEALED THAT DIEL PERIOD, CALF PRESENCE AND CALF AGE AFFECT DIVE BEHAVIOR OF FEMALE RIGHT WHALES. IN THE FACE OF THE IMPACTS OF ANTHROPOGENIC MORTALITY ON RIGHT WHALE POPULATIONS, THESE RESULTS WILL AID VESSEL STRIKE AND ENTANGLEMENT RISK ASSESSMENT ON THE SOUTHEAST USA CALVING GROUND."
54,"Darren","not vetted",NA,"not vetted",54,"VITERBI R;CERRATO C;BIONDA A",2020,"EFFECTS OF TEMPERATURE RISE ON MULTITAXA DISTRIBUTIONS IN MOUNTAIN ECOSYSTEMS","DIVERSITY-BASEL","12",NA,NA,"10.3390/d12060210","MOUNTAIN BIODIVERSITY IS ASSOCIATED WITH RARE AND FRAGILE BIOTA THAT ARE HIGHLY SENSITIVE TO CLIMATE CHANGE. TO ESTIMATE THE VULNERABILITY OF BIODIVERSITY TO TEMPERATURE RISE, LONG-TERM FIELD DATA ARE CRUCIAL. SPECIES DISTRIBUTION MODELS ARE AN ESSENTIAL TOOL, IN PARTICULAR FOR INVERTEBRATES, FOR WHICH DETAILED INFORMATION ON SPATIAL AND TEMPORAL DISTRIBUTIONS IS LARGELY MISSING. WE APPLIED PRESENCE-ONLY DISTRIBUTION MODELS TO FIELD DATA OBTAINED FROM A SYSTEMATIC SURVEY OF 5 TAXA (BIRDS, BUTTERFLIES, CARABIDS, SPIDERS, STAPHYLINIDS), MONITORED IN THE NORTHWESTERN ITALIAN ALPS. WE ESTIMATED THE EFFECTS OF A MODERATE TEMPERATURE INCREASE ON THE MULTI-TAXA DISTRIBUTIONS. ONLY SMALL CHANGES IN THE OVERALL BIODIVERSITY PATTERNS EMERGED, BUT WE OBSERVED SIGNIFICANT DIFFERENCES BETWEEN GROUPS OF SPECIES AND ALONG THE ALTITUDINAL GRADIENT. THE EFFECTS OF TEMPERATURE INCREASE COULD BE MORE PRONOUNCED FOR SPIDERS AND BUTTERFLIES, AND PARTICULARLY DETRIMENTAL FOR HIGH-ALTITUDE SPECIES. WE OBSERVED SIGNIFICANT CHANGES IN COMMUNITY COMPOSITION AND SPECIES RICHNESS, ESPECIALLY IN THE ALPINE BELT, BUT A CLEAR SEPARATION BETWEEN VEGETATION LEVELS WAS RETAINED ALSO IN THE WARMING SCENARIOS. OUR CONSERVATIVE APPROACH SUGGESTS THAT EVEN A MODERATE TEMPERATURE INCREASE (ABOUT 1 DEGREES C) COULD INFLUENCE ANIMAL BIODIVERSITY IN MOUNTAIN ECOSYSTEMS: ONLY LONG-TERM FIELD DATA CAN PROVIDE THE INFORMATION TO IMPROVE QUANTITATIVE PREDICTIONS, ALLOWING US TO READILY IDENTIFY THE MOST INFORMATIVE SIGNALS OF FORTHCOMING CHANGES."
58,"Darren","not vetted",NA,"not vetted",58,"VEGTER A;BARLETTA M;BECK C;BORRERO J;BURTON H;CAMPBELL M;COSTA M;ERIKSEN M;ERIKSSON C;ESTRADES A;GILARDI K;HARDESTY B;IVAR D;SUL J;LAVERS J;LAZAR B;LEBRETON L;NICHOLS W;RIBIC C;RYAN P;SCHUYLER Q;SMITH S;TAKADA H;TOWNSEND K;WABNITZ C;YOUNG L;HAMANN M",2014,"GLOBAL RESEARCH PRIORITIES TO MITIGATE PLASTIC POLLUTION IMPACTS ON MARINE WILDLIFE","ENDANGERED SPECIES RESEARCH","25","225-247","225-247","10.3354/esr00623","MARINE WILDLIFE FACES A GROWING NUMBER OF THREATS ACROSS THE GLOBE, AND THE SURVIVAL OF MANY SPECIES AND POPULATIONS WILL BE DEPENDENT ON CONSERVATION ACTION. ONE THREAT IN PARTICULAR THAT HAS EMERGED OVER THE LAST 4 DECADES IS THE POLLUTION OF OCEANIC AND COASTAL HABITATS WITH PLASTIC DEBRIS. THE INCREASED OCCURRENCE OF PLASTICS IN MARINE ECOSYSTEMS MIRRORS THE INCREASED PREVALENCE OF PLASTICS IN SOCIETY, AND REFLECTS THE HIGH DURABILITY AND PERSISTENCE OF PLASTICS IN THE ENVIRONMENT. IN AN EFFORT TO GUIDE FUTURE RESEARCH AND ASSIST MITIGATION APPROACHES TO MARINE CONSERVATION, WE HAVE GENERATED A LIST OF 16 PRIORITY RESEARCH QUESTIONS BASED ON THE EXPERT OPINIONS OF 26 RESEARCHERS FROM AROUND THE WORLD, WHOSE RESEARCH EXPERTISE SPANS SEVERAL DISCIPLINES, AND COVERS EACH OF THE WORLD'S OCEANS AND THE TAXA MOST AT RISK FROM PLASTIC POLLUTION. THIS PAPER HIGHLIGHTS A GROWING CONCERN RELATED TO THREATS POSED TO MARINE WILDLIFE FROM MICROPLASTICS AND FRAGMENTED DEBRIS, THE NEED FOR DATA AT SCALES RELEVANT TO MANAGEMENT, AND THE URGENT NEED TO DEVELOP INTERDISCIPLINARY RESEARCH AND MANAGEMENT PARTNERSHIPS TO LIMIT THE RELEASE OF PLASTICS INTO THE ENVIRONMENT AND CURB THE FUTURE IMPACTS OF PLASTIC POLLUTION."
59,"Darren","not vetted",NA,"not vetted",59,"CROOKES D;BLIGNAUT J",2019,"AN APPROACH TO DETERMINE THE EXTINCTION RISK OF EXPLOITED POPULATIONS","JOURNAL FOR NATURE CONSERVATION","52",NA,NA,"10.1016/j.jnc.2019.125750","WE PROPOSE A METHOD FOR ASSESSING THE PERSISTENCE OF SPECIES WHERE THE RESOURCE IS HARVESTED. FOUR SUSTAINABILITY MEASURES ARE EMPLOYED, NAMELY A POPULATION MEASURE, A HARVEST MEASURE, A PROFITABILITY MEASURE AND A CATCHABILITY MEASURE. THESE ARE USED TO ASSESS THE SUSTAINABILITY OF TWO NATURAL RESOURCES REPRESENTING TERRESTRIAL AND AQUATIC SPECIES, NAMELY WHITE RHINO (CERATOTHERIUM SIMUM) AND SOUTH AFRICAN ABALONE (HALIOTIS MIDAE) SPECIES, RESPECTIVELY. THE FRAMEWORK IS USED TO EVALUATE THESE TWO RESOURCES AGAINST RELEVANT LOCAL AND INTERNATIONAL PROTECTED SPECIES LISTINGS. THE RESULTS SHOW THAT THE PROPOSED FRAMEWORK PRODUCES A MORE CONSERVATIVE APPROACH TO LISTING THREATENED SPECIES, CONSISTENT WITH THE PRECAUTIONARY PRINCIPLE. THE FRAMEWORK PROVIDES A WAY OF CONDUCTING A PRECAUTIONARY ASSESSMENT OF EXTINCTION RISK UNDER CONDITIONS OF EXPLOITATION, ACROSS A RANGE OF AQUATIC AND TERRESTRIAL SPECIES. ONCE DEVELOPED, WE ALSO APPLY THIS FRAMEWORK TO SEVEN ADDITIONAL SPECIES USING A SCENARIO ANALYSIS. THE RESULTS HIGHLIGHT THE IMPORTANCE OF TAKING INTO CONSIDERATION INSTITUTIONAL FACTORS UNDER CONDITIONS OF OVEREXPLOITATION."
63,"Darren","not vetted",NA,"not vetted",63,"PLICANTI A;IACIOFANO D;BERTOCCI I;LO ;BRUTTO S",2017,"THE AMPHIPOD ASSEMBLAGES OF SABELLARIA ALVEOLATA REEFS FROM THE NW COAST OF PORTUGAL AN ACCOUNT OF THE PRESENT KNOWLEDGE NEW RECORDS AND SOME BIOGEOGRAPHIC CONSIDERATIONS","MARINE BIODIVERSITY","47","521-534","521-534","10.1007/s12526-016-0474-5","AMPHIPOD ASSEMBLAGES ASSOCIATED WITH THE BIOGENIC REEFS BUILT BY THE HONEYCOMB WORM SABELLARIA ALVEOLATA WERE STUDIED AT TWO SITES (PRAIA DA AGUDA AND BELINHO) ALONG THE NORTHWESTERN COAST OF PORTUGAL. A TOTAL OF 3909 SPECIMENS WERE COLLECTED, COMPRISING 14 DIFFERENT AMPHIPOD SPECIES. A FIRST RECORD FROM THE NORTHEASTERN ATLANTIC COAST WAS REGISTERED HERE FOR THE SPECIES CAPRELLA SANTOSROSAI, WHICH WAS, UP TO NOW, RECORDED ONLY ALONG THE MEDITERRANEAN COAST OF THE IBERIAN PENINSULA. A MALE SPECIMEN COLLECTED FROM THE SABELLARIA-REEF LOCATED IN BELINHO ALLOWED AN UPDATE TO THE KNOWN DISTRIBUTION OF C. SANTOSROSAI, THUS ALTERING ITS PREVIOUS STATUS AS AN ENDEMIC MEDITERRANEAN SPECIES. THE MOST COMMON SPECIES COLLECTED DURING THE STUDY WERE MICRODEUTOPUS CHELIFER (N = 1828), JASSA OCIA (N = 1426), AND HYALE STEBBINGI (N = 452). FORTY-THREE PERCENT OF THE TOTAL RECORDED SPECIES WERE ENCOUNTERED IN BOTH STUDY SITES, WHEREAS THE REMAINING 57 \% WERE RESTRICTED TO A SINGLE SITE (BELINHO). THE MAJORITY OF THE COLLECTED SPECIES (93 \%) SHOWED AN ATLANTIC-MEDITERRANEAN DISTRIBUTION, CONFIRMING THE CLOSE AFFINITY BETWEEN EASTERN ATLANTIC AND MEDITERRANEAN AMPHIPOD ASSEMBLAGES AND THE ROLE OF THE PORTUGUESE COAST AS A TRANSITION ZONE THROUGH WHICH NUMEROUS WARM-WATER SPECIES, COMING FROM NORTH AFRICA AND THE MEDITERRANEAN SEA, COULD ENTER INTO THE ATLANTIC AND POSSIBLY GET MIXED WITH SPECIES COMING FROM THE NORTH SEA AND THE ARCTIC, TYPICALLY HAVING AFFINITY FOR COLDER WATERS."
65,"Darren","not vetted",NA,"not vetted",65,"PEREIRA F G;DE F M;VIEIRA W;DE M G;GUEDES T;FRANCA F",2021,"THE SNAKE FAUNA OF THE MOST THREATENED REGION OF THE ATLANTIC FOREST NATURAL HISTORY DISTRIBUTION SPECIES RICHNESS AND A COMPLEMENT TO THE ATLAS OF BRAZILIAN","ETHNOBIOLOGY AND CONSERVATION","10",NA,NA,"10.15451/ec2021-11-10.38-1-48","THE ATLANTIC FOREST IS ONE OF THE RICHEST TROPICAL FORESTS IN THE WORLD, WITH A HIGH ENDEMISM RATE OF VERTEBRATES, INCLUDING SEVERAL SNAKES. THE SNAKE FAUNA OF THE ATLANTIC FOREST IS RICH AND COMPLEX, PRESENTING DIFFERENCES IN FAUNA COMPOSITION ALONG ITS EXTENSION. THE EXISTENCE OF AT LEAST FOUR ENDEMISM CENTERS ALONG THIS FOREST IS WELL DOCUMENTED AND SUPPORTED BY DATA OF VERTEBRATES, INVERTEBRATES AND PLANTS. THE PERNAMBUCO ENDEMISM CENTER (PEC) IS THE MOST SEPTENTRIONAL REGION OF THE ATLANTIC FOREST, AND IT CONTACTS AREAS WITH TRANSITIONAL FORESTS AND ARID LANDSCAPES (CAATINGA) WHICH ALONG WITH ALTITUDINAL VARIATION ENABLE A UNIQUE SNAKE FAUNA FOR THIS REGION. IN THIS STUDY WE PROVIDE: (I) AN UPDATED LIST OF SPECIES, DETAILED INFORMATION ABOUT NATURAL HISTORY, AS WELL AS A DETAILED GEOGRAPHIC DISTRIBUTION FOR ALL SPECIES RECORDED IN THE PEC; (II) A COMPARISON BETWEEN THE SNAKE FAUNA OF THE PEC WITH OTHER REGIONS OF THE ATLANTIC FOREST. THE SNAKE FAUNA OF THE PEC IS COMPOSED BY 86 SPECIES OF 8 FAMILIES. THE RESULTS SHOWED THAT MOST OF THE SPECIES RECORDED IN THE PEC ARE DISTRIBUTED CLOSE TO THE COAST, PROBABLY DUE TO THE PROXIMITY OF THE RESEARCH CENTERS, BUT ALSO DUE TO THE PRESENT DISTRIBUTION OF THE REMNANTS CLOSE TO THE COAST. THE FOREST REMNANTS IN THE HIGHLANDS (BREJOS DE ALTITUDE) HARBORS A HIGH DIVERSITY OF SPECIES WITH HIGH SIMILARITY WITH THE COASTAL FORESTS. WE FOUND A STRONG SEPARATION BETWEEN THE SNAKE FAUNA OF ASSEMBLAGES LOCATED IN SOUTHWESTERN AND NORTHEASTERN BRAZIL, INDICATING CLEAR CHARACTERISTICS OF THE SNAKE FAUNA OF THE PEC."
67,"Darren","not vetted",NA,"not vetted",67,"CARVALHO-ROEL C;MARCAL J O",2021,"ASSESSING THE RELATIVE IMPACTS OF ROADKILL AND NEST POACHING ON THE POPULATION VIABILITY OF THE BLUEANDYELLOW MACAW ARA ARARAUNA AVES PSITTACIFORMES IN A BRAZILIAN NATIONAL PARK","DIVERSITY-BASEL","13",NA,NA,"10.3390/d13120652","THE BLUE-AND-YELLOW MACAW (ARA ARARAUNA) IS SUFFERING FROM HIGHER ROADKILL RATES (RK) AT THE EMAS NATIONAL PARK (ENP), AN IMPORTANT BRAZILIAN NATIONAL PARK IN THE CERRADO BIOME. THIS SPECIES IS ALSO A VICTIM OF NEST POACHING FOR ILLEGAL TRADE. WE MODELED THE BLUE-AND-YELLOW MACAW POPULATION'S VIABILITY IN ENP AND HOW THIS VIABILITY IS AFFECTED BY ROADKILL AND NEST POACHING. WE HEREBY REPORT THAT THE SPECIES IS CRITICALLY AT RISK AND COULD BE EXTINCT IN ABOUT A DECADE WHEN CONSIDERING BOTH THREATS. WITHOUT CONSIDERING ANY THREAT, 150 INDIVIDUALS ARE NECESSARY TO MAINTAIN A VIABLE POPULATION. WHEN INDIVIDUALS ARE HARVESTED AT A ROADKILL RATE OF 0.008 INDIVIDUALS/KM/YEAR AND AT TWICE THIS LEVEL, THE VIABILITY FIGURES INCREASE TO 4500 AND 7500 BIRDS, RESPECTIVELY. FOR NEST POACHING, WE ESTIMATED THAT 2000 INDIVIDUALS ARE REQUIRED TO MAINTAIN A VIABLE POPULATION. WHEN BOTH THREATS ARE PRESENT, 5000 INDIVIDUALS ARE NECESSARY. THE DYNAMICS OF THE POPULATION ARE HIGHLY SENSITIVE TO THE AGE AT WHICH FEMALES REPRODUCE FOR THE FIRST TIME AND THE PROPORTION OF REPRODUCING ADULT FEMALES, FOLLOWED BY THE RATE OF ADULT SURVIVAL. OUR MODEL DEMONSTRATES HOW EVEN A NON-THREATENED HIGHLY MOBILE SPECIES, SUCH AS THE BLUE-AND-YELLOW MACAW, MAY BE AT RISK DUE TO HUMAN ACTIVITIES."
69,"Darren","not vetted",NA,"not vetted",69,"BOHLING J;SMALL M;VON B J;LOUDEN A;DEHAAN P",2019,"COMPARING INFERENCES DERIVED FROM MICROSATELLITE AND RADSEQ DATASETS A CASE STUDY INVOLVING THREATENED BULL TROUT","CONSERVATION GENETICS","20","329-342","329-342","10.1007/s10592-018-1134-z","TECHNOLOGICAL ADVANCEMENTS HAVE ALLOWED GENETICISTS TO EXPLOIT AN INCREASING ARRAY OF MOLECULAR MARKERS, MANY OF WHICH HAVE DIFFERENT PROPERTIES AND MAY PROVIDE CONTRASTING INSIGHTS INTO THE EVOLUTIONARY HISTORY AND STRUCTURE OF POPULATIONS. THIS HAS IMPORTANT CONSEQUENCES FOR CONSERVATION MANAGERS ATTEMPTING TO IDENTIFY UNITS AT WHICH TO CONSERVE INTRASPECIFIC DIVERSITY. IN THIS STUDY WE COMPARED THE INFERENCES DERIVED FROM NUCLEAR MICROSATELLITES AND RESTRICTION-SITE ASSOCIATED DNA (RADSEQ) DATA FOR A THREATENED FRESHWATER FISH, THE BULL TROUT SALVELINUS CONFLUENTUS. FOR BOTH MARKER TYPES WE GENERATED DATA FOR THE SAME SUITE OF INDIVIDUALS COLLECTED FROM 24 POPULATIONS DISTRIBUTED ACROSS THE SPECIES RANGE. THE RADSEQ DATA WERE LOW COVERAGE (MEAN SITE COVERAGE<3X), SO WE IMPLEMENTED A PROBABILISTIC GENOTYPING APPROACH. WE PERFORMED A COMPARABLE SUITE OF ANALYSES FOR BOTH DATASETS. BOTH DATASETS REVEALED SIMILAR BROAD PATTERNS OF SUBDIVISION THAT REFLECTED PRIMARY EVOLUTIONARY LINEAGES (COASTAL AND INTERIOR CLADES). HOWEVER, THE RADSEQ MORE CLEARLY AND CONSISTENTLY IDENTIFIED THE HIERARCHICAL PHYLOGENETIC STRUCTURE. SOME POPULATIONS HAD VARYING ASSIGNMENTS TO THESE LINEAGES DEPENDING ON THE DATASET. RADSEQ DATA ALSO SUGGESTED ADMIXTURE HAS SHAPED THE GENOMIC CHARACTER OF SEVERAL POPULATIONS. SUCH A SIGNAL WAS NOT APPARENT WITH THE MICROSATELLITES, SUGGESTING THAT THE DATASETS ARE REVEALING DIFFERENT ASPECTS OF POPULATION HISTORY. OUR STUDY PROVIDES A VALUABLE CASE STUDY IN HOW ADVANCES IN MOLECULAR TECHNOLOGY CAN ENHANCE OUR UNDERSTANDING OF A RELATIVELY WELL-STUDIED SPECIES. IT ALSO UNDERSCORES THE IMPORTANCE OF FRAMING FINDINGS GENERATED WITH HIGH-THROUGHPUT SEQUENCING TECHNOLOGY WITHIN THE CONTEXT OF PAST RESEARCH TO ENHANCE CONSERVATION DECISION MAKING."
71,"Darren","not vetted",NA,"not vetted",71,"MCGOWAN P;OWENS L;GRAINGER M",2012,"GALLIFORMES SCIENCE AND SPECIES EXTINCTIONS WHAT WE KNOW AND WHAT WE NEED TO KNOW","ANIMAL BIODIVERSITY AND CONSERVATION","35","321-331","321-331",NA,"GALLIFORMES SCIENCE AND SPECIES EXTINCTIONS: WHAT WE KNOW AND WHAT WE NEED TO KNOW.-IN EARLY 2010, THE 193 PARTIES THAT HAD SIGNED UP TO THE CONVENTION ON BIOLOGICAL DIVERSITY ALL ACKNOWLEDGED THAT THEY HAD FAILED TO MEET THE TARGET THAT THEY HAD SET THEMSELVES IN 1992 OF SIGNIFICANTLY REDUCING SPECIES EXTINCTIONS BY 2010. AT THE END OF THE YEAR THEY SET A NEW AND MORE AMBITIOUS TARGET OF PREVENTING SPECIES EXTINCTIONS BY 2020. ACHIEVING THAT TARGET WILL REQUIRE MUCH GREATER EFFICIENCY IN THE USE OF RESOURCES AND RESEARCH HAS A VERY SIGNIFICANT ROLE TO PLAY IN MAKING THIS HAPPEN. THERE ARE 290 SPECIES OF GALLIFORMES OF WHICH 26\% ARE CONSIDERED AT RISK OF EXTINCTION, COMPARED WITH 12\% OF ALL 10,000 BIRD SPECIES. AT THE SAME TIME THERE IS SIGNIFICANT RESEARCH LITERATURE ON THE GROUP THAT STRETCHES BACK DECADES FOR SOME SPECIES. IT IS TIMELY, THEREFORE, TO CONSIDER WHETHER IT IS POSSIBLE TO INCREASE THE EFFICIENCY AND GLOBAL IMPACT OF GAMEBIRD RESEARCH SO THAT, WITH CAREFUL PLANNING THAT INVOLVES MORE STRATEGIC DIRECTION AND SHARING OF LESSONS LEARNT, GAME BIOLOGISTS CAN PLAY A SIGNIFICANT ROLE IN ACHIEVING THE 2020 TARGET FOR SPECIES ADOPTED BY THE CONVENTION ON BIOLOGICAL DIVERSITY. SPECIFIC AREAS IN NEED OF THIS LESSON SHARING APPROACH ARE POPULATION ESTIMATION AND THREAT ASSESSMENT, ANALYSIS OF EXPLOITATION AND DETERMINING THE ECOLOGICAL BASIS OF SUCCESSFUL INTERVENTIONS."
72,"Darren","not vetted",NA,"not vetted",72,"SIRAMI C;MONADJEM A",2012,"CHANGES IN BIRD COMMUNITIES IN SWAZILAND SAVANNAS BETWEEN 1998 AND 2008 OWING TO SHRUB ENCROACHMENT","DIVERSITY AND DISTRIBUTIONS","18","390-400","390-400","10.1111/j.1472-4642.2011.00810.x","AIM THIS STUDY INVESTIGATES CHANGES IN BIRD COMMUNITIES BETWEEN 1998 AND 2008 IN FOUR SAVANNA SITES IN SWAZILAND AND THE EXTENT TO WHICH SHRUB ENCROACHMENT IS RESPONSIBLE FOR THESE CHANGES. LOCATION SWAZILAND, SOUTHERN AFRICA. METHODS GENERALIZED ESTIMATED EQUATIONS WERE USED TO ESTIMATE CHANGES IN BIRD SPECIES OCCURRENCE BETWEEN 1998 AND 2008. REMOTE SENSING OF AERIAL PHOTOGRAPHS/SATELLITE IMAGES WAS USED TO ASSESS VEGETATION CHANGES DURING THE SAME PERIOD. WE ASSESSED THE ROLE OF SHRUB ENCROACHMENT FOR BIRD COMMUNITIES BY TESTING THE RELATIONSHIP BETWEEN CHANGE IN SPECIES OCCURRENCE AND SPECIES HABITAT USING A GENERAL LINEAR MODEL. WE ALSO ESTIMATED SPECIES RICHNESS, COLONIZATION AND EXTINCTION AND USED GENERAL LINEAR MODELS TO TEST THE EFFECTS OF VEGETATION CHANGES ON THESE PARAMETERS. RESULTS MORE THAN HALF OF THE BIRD SPECIES SHOWED A SIGNIFICANT CHANGE IN OCCURRENCE BETWEEN 1998 AND 2008: 32 SPECIES INCREASED AND 29 DECREASED. CHANGE IN SPECIES OCCURRENCE WAS SIGNIFICANTLY EXPLAINED BY SPECIES HABITAT. SPECIES SIGNIFICANTLY INCREASING WERE MAINLY ASSOCIATED WITH WOODED SAVANNA, WHEREAS SPECIES SIGNIFICANTLY DECREASING WERE MAINLY ASSOCIATED WITH OPEN SAVANNA. SPECIES RICHNESS DECREASED SIGNIFICANTLY, AND THIS DECREASE WAS SIGNIFICANTLY EXPLAINED BY SHRUB COVER INCREASE AT THE PLOT SCALE (FROM 24\% TO 44\% ON AVERAGE). EXTINCTION AT THE PLOT SCALE WAS SIGNIFICANTLY INFLUENCED BY THE LOSS OF GRASS COVER, WHILE COLONIZATION AT THE PLOT SCALE WAS INFLUENCED BY TREE COVER INCREASE. MAIN CONCLUSIONS THIS STUDY REPRESENTS THE FIRST EVIDENCE OF TEMPORAL CHANGES IN BIRD COMMUNITIES OWING TO SHRUB ENCROACHMENT IN SOUTHERN AFRICA. DESPITE ITS SHORT TIME FRAME (10 YEARS), THIS STUDY SHOWS DRAMATIC CHANGES IN BOTH VEGETATION STRUCTURE AND BIRD COMMUNITY COMPOSITION. THIS CONFIRMS THE GENERAL CONCERN FOR SOUTHERN AFRICAN BIRD SPECIES ASSOCIATED WITH OPEN SAVANNA IF CURRENT TRENDS CONTINUE."
73,"Darren","not vetted",NA,"not vetted",73,"PHADPHON P;AMONTAILAK T;KOTCHANTUEK N;SRITHAWONG S;KUTANAN W;SUWANNAPOOM C",2019,"GENETIC DIVERSITY OF THE ENDANGERED MEKONG GIANT CATFISH STRIPED CATFISH AND THEIR HYBRIDS FROM THAILAND","TROPICAL CONSERVATION SCIENCE","12",NA,NA,"10.1177/1940082919869487","PREVIOUS GENETIC INVESTIGATIONS OF THE MEKONG GIANT CATFISH (PANGASIANODON GIGAS CHEVEY, 1913) AND STRIPED CATFISH (PANGASIANODON HYPOPHTHALMUS SAUVAGE, 1878) PROVIDED DISCORDANT RESULTS. HERE, WE SEQUENCED MITOCHONDRIAL (MT) DNA OF THE CYTOCHROME B REGION, AND A CONTROL REGION, TO CHARACTERIZE THE GENETIC VARIATION OF P. GIGAS, P. HYPOPHTHALMUS, AND HYBRIDS OF THESE TWO SPECIES. AMONG THE THREE GROUPS, P. HYPOPHTHALMUS HAD THE GREATEST DIVERSITY IN BOTH REGIONS, YET ALL THREE STUDIED GROUPS SHOWED LOWER GENETIC DIVERSITY COMPARED TO THE RESULTS OF PREVIOUS STUDIES. THE BAYESIAN SKYLINE PLOTS SHOWED A REDUCTION IN EFFECTIVE POPULATION SIZES OF THE PARENTAL SPECIES. THE HYBRIDS WERE FOUND TO HAVE A CONSTANT POPULATION SIZE WITH A RECENT DIVERGENCE TIME. AS EXPECTED, THE NETWORK AND NEIGHBOR JOINING TREE SHOWED A CLOSE MATERNAL GENETIC RELATIONSHIP BETWEEN THE HYBRID AND P. HYPOPHTHALMUS, A REFLECTION OF THE BREEDING BETWEEN MALE P. GIGAS AND FEMALE P. HYPOPHTHALMUS. OUR RESULTS PROVIDE GENETIC INFORMATION ON THESE ENDANGERED FISH THAT WILL BE USEFUL FOR BOTH CONSERVATION AND COMMERCIAL BREEDING PROGRAMS."
78,"Darren","not vetted",NA,"not vetted",78,"MARQUES H;PINHEIRO D J;PERBICHE-NEVES G;LUIZ K E;RAMOS I",2018,"IMPORTANCE OF DAMFREE TRIBUTARIES FOR CONSERVING FISH BIODIVERSITY IN NEOTROPICAL RESERVOIRS","BIOLOGICAL CONSERVATION","224","347-354","347-354","10.1016/j.biocon.2018.05.027","DAMS CHANGE THE HYDROLOGICAL DYNAMICS, PATTERNS OF BIOLOGICAL PRODUCTION AND DISTRIBUTION OF ORGANISMS IN SPACE AND TIME. IN CONTRAST, TRIBUTARY RIVERS CAN FUNCTION AS SOURCE AREAS IN RESERVOIRS, SINCE THEY HARBOR SPAWNING AND EARLY DEVELOPMENT GROUNDS FOR NATIVE FISH SPECIES. HERE, WE ANALYZE A TIME SERIES OF THE FIRST 14 YEARS AFTER THE IMPOUNDMENT OF THE PORTO PRIMAVERA RESERVOIR, A LARGE RESERVOIR WITH FREE TRIBUTARIES IN SOUTHEASTERN BRAZIL. TO EVALUATE THE IMPACT OF DAMMING ON THE FISH ASSEMBLAGE, WE EVALUATED THE ABUNDANCE (CATCH PER UNIT EFFORT, CPUE) AND ALPHA (SPECIES RICHNESS AND SHANNON-WIENER INDEX) AND BETA (SORENSEN DISSIMILARITY AND TURNOVER) DIVERSITY OF FOUR SITES DISTRIBUTED ALONG THE RESERVOIR. OVERALL, THERE WAS NO DECREASING TREND IN THE ALPHA DIVERSITY AND NO INCREASING TREND IN THE BETA DIVERSITY RELATIVE TO THE INITIAL YEAR OR AMONG THE SITES OVER TIME. DESPITE THE EXPECTED DISTURBANCE IN THE FISH ASSEMBLAGE AT THE LACUSTRINE SITE, THE SITES LOCATED NEAR THE TRIBUTARY MOUTHS PRESENTED RESISTANT FISH ASSEMBLAGES, COMPENSATING THE RESULTS OF THE OVERALL ASSESSMENT. WE ATTRIBUTE THIS UNUSUAL VARIATION IN THE ECOLOGICAL ATTRIBUTES TO SOURCE-SINK DEMOGRAPHIC DYNAMICS, WITH THE UNDAMMED TRIBUTARIES AS THE SOURCE AND THE RESERVOIR AS THE SINK FOR NATIVE SPECIES. WE HIGHLIGHT THAT THE PRESENCE OF THESE RIVERS MINIMIZED THE EXPECTED TREND TOWARDS BIOTIC HOMOGENIZATION, AND THE PRESERVATION OF THE TRIBUTARIES IS IMPERATIVE SINCE THEY CONTRIBUTE TO DIVERSITY MAINTENANCE IN AREAS THAT ARE ALREADY IMPACTED BY DAMMING. THE INCLUSION OF THIS AGENDA IN ENVIRONMENTAL MANAGEMENT PROGRAMS AND NEW IMPOUNDMENT PLANS WILL ALLOW A BALANCE BETWEEN THE DEMAND FOR ELECTRICITY PRODUCTION AND THE CONSERVATION OF FISH DIVERSITY."
79,"Darren","not vetted",NA,"not vetted",79,"HANSON J;VERISSIMO A;VELO-ANTON A;CAMACHO-SANCHEZ M;MARTINEZ-SOLANO H;SEQUEIRA F;POSSINGHAM S",2021,"EVALUATING SURROGATES OF GENETIC DIVERSITY FOR CONSERVATION PLANNING","CONSERVATION BIOLOGY","35","634-642","634-642","10.1111/cobi.13602","PROTECTED-AREA SYSTEMS SHOULD CONSERVE INTRASPECIFIC GENETIC DIVERSITY. BECAUSE GENETIC DATA REQUIRE RESOURCES TO OBTAIN, SEVERAL APPROACHES HAVE BEEN PROPOSED FOR GENERATING PLANS FOR PROTECTED-AREA SYSTEMS (PRIORITIZATIONS) WHEN GENETIC DATA ARE NOT AVAILABLE. YET SUCH SURROGATE-BASED APPROACHES REMAIN POORLY TESTED. WE EVALUATED THE EFFECTIVENESS OF POTENTIAL SURROGATE-BASED APPROACHES BASED ON MICROSATELLITE GENETIC DATA COLLECTED ACROSS THE IBERIAN PENINSULA FOR 7 AMPHIBIAN AND 3 REPTILIAN SPECIES. LONG-TERM ENVIRONMENTAL SUITABILITY DID NOT EFFECTIVELY REPRESENT SITES CONTAINING HIGH GENETIC DIVERSITY (ALLELIC RICHNESS). PRIORITIZATIONS BASED ON LONG-TERM ENVIRONMENTAL SUITABILITY HAD SIMILAR PERFORMANCE TO RANDOM PRIORITIZATIONS. GEOGRAPHIC DISTANCES AND RESISTANCE DISTANCES BASED ON CONTEMPORARY ENVIRONMENTAL SUITABILITY WERE NOT ALWAYS EFFECTIVE SURROGATES FOR IDENTIFICATION OF COMBINATIONS OF SITES THAT CONTAIN INDIVIDUALS WITH DIFFERENT GENETIC COMPOSITIONS. OUR RESULTS DEMONSTRATE THAT POPULATION GENETIC DATA BASED ON COMMONLY USED NEUTRAL MARKERS CAN INFORM PRIORITIZATIONS, AND WE COULD NOT FIND AN ADEQUATE SUBSTITUTE. CONSERVATION PLANNERS NEED TO WEIGH THE POTENTIAL BENEFITS OF GENETIC DATA AGAINST THEIR ACQUISITION COSTS."
83,"Darren","not vetted",NA,"not vetted",83,"AUTIO O;SALMELA J;SUHONEN J",2013,"SPECIES RICHNESS AND RARITY OF CRANE FLIES DIPTERA TIPULOIDEA IN A BOREAL MIRE","JOURNAL OF INSECT CONSERVATION","17","1125-1136","1125-1136","10.1007/s10841-013-9593-5","SPECIES RICHNESS AND ABUNDANCE ARE CENTRAL IN BIODIVERSITY INVENTORIES AND IN MEASURING THE STRUCTURE OF COMMUNITIES. NEGLECTING THE ASSESSMENT OF SAMPLING EFFICIENCY MAY LEAD TO SPURIOUS ESTIMATES OF SPECIES RICHNESS AND CONSERVATION VALUE. OUR AIM WAS TO EXAMINE SPECIES RICHNESS, SAMPLING EFFECTIVENESS, SPECIES-ABUNDANCE DISTRIBUTION (SAD) AND RARITY OF A BOREAL, MIRE-DWELLING CRANE FLY (DIPTERA, TIPULOIDEA) ASSEMBLAGE IN WESTERN FINLAND. 12 MALAISE TRAPS DISPERSED IN 4 SUBPLOTS AND STANDARDIZED SWEEP NET SAMPLES WERE USED TO COLLECT ADULT FLIES FROM THE MIRE. A TOTAL OF 23 SPECIES AND 1,569 SPECIMENS WERE IDENTIFIED. IN GENERAL ALL SPECIES RICHNESS ESTIMATORS WERE HIGHLY CORRELATED AND INDICATED RATHER GOOD SAMPLING EFFORT. SAMPLE COMPLETENESS, EXPRESSED AS PERCENTAGE OF OBSERVED RICHNESS DIVIDED BY ESTIMATED RICHNESS, WAS HIGHER FOR MIRE-DWELLERS (MEAN 75 \%) THAN FOR ALL SPECIES (MEAN 63 \%). CRANE FLY ASSEMBLAGES OF SUBPLOTS AND COMBINED DATA FITTED BEST WITH LOG-SERIES SAD. SPECIES SPATIAL DISTRIBUTION WAS POSITIVELY CORRELATED WITH AVERAGE ABUNDANCE. IN OTHER WORDS, THE MOST ABUNDANT SPECIES OCCURRED IN THE MOST OF MALAISE TRAPS. SEVEN MIRE-DWELLING SPECIES GREATLY OUTNUMBERED (94 \% OF THE COLLECTED SPECIMENS) ALL OTHER MEMBERS IN THE ASSEMBLAGE, AND ONLY ONE OBSERVED SPECIES WAS RARE BY SEVERAL DEFINITIONS (LOCAL ABUNDANCE, EXTENT OF OCCURRENCE IN FINLAND AND AREA OF OCCUPANCY). ALTHOUGH THE STUDIED ASSEMBLAGE WAS CHARACTERIZED BY COMMONNESS, FIVE OF THE SPECIES HAVE THREATENED STATUS IN EUROPE SOUTH OF FINLAND. SEPARATE SPECIES RICHNESS ESTIMATION OF ALL SPECIES (VAGRANTS AND OCCASIONAL SPECIES INCLUDED) AND FOCAL SPECIES (HERE MIRE-DWELLERS) IS SUPPORTED IF ECOLOGICAL INFORMATION IS AVAILABLE ON THE TAXONOMIC GROUP BEING STUDIED."
