"STUDY_ID","REVIEWERS","INCLUDE","REVIEWERS","INCLUDE","STUDY_ID","AUTHORS","YEAR","TITLE","JOURNAL","VOLUME","LPAGES","UPAGES","DOI","ABSTRACT"
137,"noone","not vetted",NA,"not vetted",137,"TARIFA R;MARTINEZ-NUNEZ C;VALERA J;SALIDO T;REY P",2021,"AGRICULTURAL INTENSIFICATION ERODES TAXONOMIC AND FUNCTIONAL DIVERSITY IN MEDITERRANEAN OLIVE GROVES BY FILTERING OUT RARE SPECIES","JOURNAL OF APPLIED ECOLOGY","58","2266-2276","2266-2276","10.1111/1365-2664.13970","AGRI-ENVIRONMENTAL SCHEMES (AES) HAVE BEEN PROPOSED TO MITIGATE THE IMPACT OF AGRICULTURE ON BOTH TAXONOMIC AND FUNCTIONAL BIODIVERSITY. HOWEVER, A BETTER KNOWLEDGE OF THE MECHANISMS INVOLVED IN THE LOSS OF AGROBIODIVERSITY IS NEEDED TO IMPLEMENT EFFICIENT AES. AN UNBALANCED EFFORT ON RESEARCH TOWARDS ARABLE LANDS COMPARED TO PERMANENT CROPS, AND ON FAUNA RELATIVE TO PLANTS, IS PATENT, WHICH LIMITS THE GENERALIZATION OF AES EFFECTIVENESS. WE EVALUATED THE EFFECTS OF AGRICULTURAL MANAGEMENT AND LANDSCAPE SIMPLIFICATION ON TAXONOMIC AND FUNCTIONAL DIVERSITY OF THE GROUND HERB COVER OF 40 OLIVE GROVES. WE USE A RECENTLY DEVELOPED APPROACH BASED ON HILL NUMBERS (RARE, COMMON AND DOMINANT SPECIES BASED) TO ANALYSE TAXONOMIC AND FUNCTIONAL DISSIMILARITY BETWEEN FARMS WITH CONTRASTING AGRICULTURAL PRACTICES, AND ITS POTENTIAL ATTENUATION BY LANDSCAPE COMPLEXITY. WE FURTHER EXPLORE THE FILTERING EFFECT OF AGRICULTURAL INTENSIFICATION ON FUNCTIONAL TRAITS, AND THE RELATIONSHIP BETWEEN FUNCTIONAL AND SPECIES RICHNESS ACROSS LANDSCAPES. WE FOUND THAT TAXONOMIC AND FUNCTIONAL DISSIMILARITY OF HERB ASSEMBLAGES BETWEEN INTENSIVELY AND LOW-INTENSIVELY MANAGED FIELDS WAS MAINLY DUE TO RARE SPECIES. DISSIMILARITY DECREASED AS LANDSCAPE COMPLEXITY INCREASED, EVIDENCING THAT COMPLEX LANDSCAPES ATTENUATE THE IMPACT OF AGRICULTURE INTENSIFICATION ON HERB ASSEMBLAGE COMPOSITION. AGRICULTURAL INTENSIFICATION FAVOURED MORE FUNCTIONALLY HOMOGENEOUS ASSEMBLAGES AND DISFAVOURED THE HERBS POLLINATED BY INSECTS, WHILE IT DID NOT SEEM TO AFFECT WIND-POLLINATED SPECIES. OVERALL, FUNCTIONAL RICHNESS INCREASED EXPONENTIALLY WITH SPECIES RICHNESS ACROSS LANDSCAPES, BUT THE LATTER WAS INSUFFICIENT TO DRIVE ANY CLEAR ENHANCEMENT IN FUNCTIONAL RICHNESS IN SIMPLE LANDSCAPES. IN CONTRAST, HIGH SPECIES RICHNESS ACCELERATED THE ENHANCEMENT IN FUNCTIONAL RICHNESS IN INTERMEDIATE AND COMPLEX LANDSCAPES. THESE RESULTS HIGHLIGHT THE FUNCTIONAL FILTERING THAT INTENSIVE AGRICULTURE HAS GENERATED FOR DECADES IN HOMOGENEOUS OLIVE-DOMINATED LANDSCAPES. SYNTHESIS AND APPLICATIONS. HERB COVER IS ESSENTIAL TO SUPPORT THE FAUNA OF PERMANENT CROPLANDS AND THEIR SUSTAINABLE PRODUCTION. HENCE, AGRI-ENVIRONMENTAL SCHEMES (AES) IN THESE CROPLANDS SHOULD PROMOTE MANAGEMENT PRACTICES FAVOURING THE DIVERSITY AND FUNCTIONALITY OF HERB ASSEMBLAGES. SUCH AES SHOULD BE PARTICULARLY PRIORITIZED IN HOMOGENEOUS LANDSCAPES, WHERE GROUND HERB COVER COMPOSITION AND FUNCTION HAS LONG BEEN HOMOGENIZED TO A GREAT EXTENT."
138,"noone","not vetted",NA,"not vetted",138,"BOUYER Y;MARTIN G;PONCIN R;ODDEN J;LINNELL J",2015,"EURASIAN LYNX HABITAT SELECTION IN HUMANMODIFIED LANDSCAPE IN NORWAY EFFECTS OF DIFFERENT HUMAN HABITAT MODIFICATIONS AND BEHAVIORAL STATES","BIOLOGICAL CONSERVATION","191","291-299","291-299","10.1016/j.biocon.2015.07.007","EURASIAN LYNX ARE OFTEN REGARDED AS BEING PARTICULARLY SENSITIVE TO HUMAN LAND-USE. HOWEVER, IN THE EUROPEAN CONTEXT WHERE HUMAN INFLUENCE IS PERVASIVE, THE CONSERVATION OF LYNX REQUIRES THAT THEY BE INTEGRATED INTO THE HUMAN-DOMINATED LANDSCAPE. ALTHOUGH PREVIOUS STUDIES HAVE LOOKED AT HOW LYNX RESPOND TO HUMAN LAND-USE IN A BROAD SENSE, THEY HAVE FAILED TO EXAMINE THE DETAILS OF HOW DIFFERENT TYPES OF HUMAN INDUCED IMPACTS (FOREST FRAGMENTATION, HUMAN DENSITY, DIFFERENT TYPES OF TRANSPORT INFRASTRUCTURE) INFLUENCE DISTINCT LYNX BEHAVIORS. FURTHERMORE, THEY HAVE NOT EXAMINED THE EXTENT TO WHICH LYNX MODIFY THEIR FINE SCALED AVOIDANCE BEHAVIOR OF ANTHROPOGENIC LANDSCAPE FEATURES ACCORDING TO THE SPECIFIC BEHAVIORS (RESTING SITES, KILL SITES, MOVEMENT) IN WHICH THEY ARE ENGAGED AND HOW THESE RELATIONSHIPS ARE MODIFIED BY PREY DENSITY OR THE SEX OF THE LYNX. WE USED RESOURCE SELECTION FUNCTIONS TO EXAMINE HOW 19 GPS-MARKED LYNX IN SOUTHEASTERN NORWAY RESPONDED TO AN INDEX OF CUMULATIVE HUMAN HABITAT MODIFICATION WHILE ENGAGED IN DIFFERENT ACTIVITIES. WE FOUND THAT LYNX SELECT FOR AREAS WITH MEDIUM LEVELS OF HUMAN MODIFICATION, AVOIDING BOTH THE VERY HIGHLY MODIFIED AND THE AREAS WITH LOW DEGREES OF MODIFICATION. FEMALES IN GENERAL APPEAR TO BE LESS TOLERANT OF HUMAN MODIFICATION THAN MALES, ESPECIALLY WHEN IT COMES TO RESTING SITES. TERRAIN (RUGGEDNESS AND ELEVATION) APPEARS TO BE IMPORTANT IN PERMITTING LYNX TO EXPLOIT HEAVILY MODIFIED AREAS. OUR STUDY DEMONSTRATES THAT LYNX SHOW A NUANCED RESPONSE TO HUMAN HABITAT MODIFICATION, WHICH OFFERS HOPE FOR THEIR CONSERVATION IN EUROPE. (C) 2015 ELSEVIER LTD. ALL RIGHTS RESERVED."
139,"noone","not vetted",NA,"not vetted",139,"BALL R;SERRA-PEREIRA B;ELLIS J;GENNER M;IGLESIAS S;JOHNSON A;JONES C;LESLIE R;LEWIS J;MARIANI S;MENEZES G;NEAT F;NOBLE L;SIMS D;GRIFFITHS A",2016,"RESOLVING TAXONOMIC UNCERTAINTY IN VULNERABLE ELASMOBRANCHS ARE THE MADEIRA SKATE RAJA MADERENSIS AND THE THORNBACK RAY RAJA CLAVATA DISTINCT SPECIES","CONSERVATION GENETICS","17","565-576","565-576","10.1007/s10592-015-0806-1","SKATES AND RAYS CONSTITUTE THE MOST SPECIOSE GROUP OF CHONDRICHTHYAN FISHES, YET ARE CHARACTERISED BY REMARKABLE LEVELS OF MORPHOLOGICAL AND ECOLOGICAL CONSERVATISM. THEY CAN BE CHALLENGING TO IDENTIFY, WHICH MAKES MONITORING SPECIES COMPOSITIONS FOR FISHERIES MANAGEMENT PURPOSES PROBLEMATIC. OWING TO THEIR SLOW GROWTH AND LOW FECUNDITY, SKATES ARE VULNERABLE TO EXPLOITATION AND SPECIES EXHIBITING ENDEMISM OR LIMITED RANGES ARE CONSIDERED TO BE THE MOST AT RISK. THE MADEIRA SKATE RAJA MADERENSIS IS ENDEMIC AND CLASSIFIED AS `DATA DEFICIENT' BY THE IUCN, YET ITS TAXONOMIC DISTINCTIVENESS FROM THE MORPHOLOGICALLY SIMILAR AND MORE WIDE-RANGING THORNBACK RAY RAJA CLAVATA IS UNRESOLVED. THIS STUDY EVALUATED THE SEQUENCE DIVERGENCE OF BOTH THE VARIABLE CONTROL REGION AND CYTOCHROME OXIDASE I `DNA BARCODE' GENE OF THE MITOCHONDRIAL GENOME TO ELUCIDATE THE GENETIC DIFFERENTIATION OF SPECIMENS IDENTIFIED AS R. MADERENSIS AND R. CLAVATA COLLECTED ACROSS MUCH OF THEIR GEOGRAPHIC RANGES. GENETIC EVIDENCE WAS INSUFFICIENT TO SUPPORT THE DIFFERENT SPECIES DESIGNATIONS. HOWEVER REGARDLESS OF PUTATIVE SPECIES IDENTIFICATION, INDIVIDUALS OCCUPYING WATERS AROUND THE AZORES AND NORTH AFRICAN SEAMOUNTS REPRESENT AN EVOLUTIONARILY SIGNIFICANT UNIT WORTHY OF SPECIAL CONSIDERATION FOR CONSERVATION MANAGEMENT."
141,"noone","not vetted",NA,"not vetted",141,"COLMAN J;BERGMO T;TSEGAYE D;FLYDAL K;EFTESTOL S;LILLEENG M;MOE S",2017,"WILDLIFE RESPONSE TO INFRASTRUCTURE THE PROBLEM WITH CONFOUNDING FACTORS","POLAR BIOLOGY","40","477-482","477-482","10.1007/s00300-016-1960-8","UNDERSTANDING THE EFFECTS OF HUMAN INFRASTRUCTURE ON WILDLIFE IS IMPORTANT FOR CONSERVATION AND MANAGEMENT AND THEREFORE WIDELY STUDIED. CHALLENGES OF MANY SUCH STUDIES ARE THAT THEY ARE OFTEN CONDUCTED AFTER INFRASTRUCTURE ESTABLISHMENT, WHEN THE EXACT CONSEQUENCE OF THE STRUCTURE MAY BE DIFFICULT TO DISENTANGLE FROM OTHER DETERMINANTS OF ANIMAL SPATIAL USE. TO HIGHLIGHT THESE CHALLENGES, WE USE A CASE STUDY OF SEMI-DOMESTIC REINDEER (RANGIFER TARANDUS TARANDUS) SPATIAL USE WITHIN 5-6 KM FROM AN EXISTING AND A PLANNED POWER LINE, USING FAECAL PELLET GROUP COUNTS IN TWO AREAS IN NORTHERN NORWAY. WE FOUND NO RELATIONSHIP BETWEEN PELLET GROUP DENSITY AND DISTANCE TO THE EXISTING POWER LINE, WHILE THE DENSITY OF PELLET GROUPS DECREASED WITH INCREASING DISTANCE FROM THE PLANNED POWER LINE. VEGETATION TYPE WAS THE MAIN PREDICTOR OF REINDEER SPATIAL USE IN THE POWER LINE AREA, WHILE ELEVATION AND VEGETATION COVER ACCOUNTED FOR THE OCCURRENCE OF REINDEER IN THE AREA WITHOUT POWER LINES. OUR RESULTS SHOW THAT REINDEER SPATIAL USE IS A FUNCTION OF MANY ASPECTS OF THE LANDSCAPE, BUT NOT ALL OF THESE ARE POSSIBLE TO CONTROL FOR. WHEN THIS POWER LINE IS BUILT, WHAT WILL AN AFTER-STUDY OF REINDEER SPACE USE REVEAL? WE UNDERSCORE THE IMPORTANCE OF RECORDING WILDLIFE SPATIAL USE PRIOR TO, AND AFTER, INFRASTRUCTURE ESTABLISHMENT FOR SOUND CONCLUSIONS ABOUT ANIMAL RESPONSE OR LACK THEREOF."
142,"noone","not vetted",NA,"not vetted",142,"BATISTA S C;NOBREA A R",2016,"ETHNOICHTHYOLOGY OF THE INDIGENOUS TRUKA PEOPLE NORTHEAST BRAZIL","JOURNAL OF ETHNOBIOLOGY AND ETHNOMEDICINE","12",NA,NA,"10.1186/s13002-015-0076-5","BACKGROUND: HISTORICALLY, FISHING IS AN IMPORTANT ACTIVITY FOR RIVERINE COMMUNITIES ESTABLISHED ALONG THE SAO FRANCISCO RIVER, INCLUDING INDIGENOUS COMMUNITIES. IN THE PRESENT STUDY, WE RESEARCHED FISHING ACTIVITIES IN TWO VILLAGES OF THE TRUKA ETHNIC GROUP, BOTH LOCATED IN THE STATE OF PERNAMBUCO ALONG THE SUB-MIDDLE SECTION OF THE SAO FRANCISCO RIVER, NORTHEAST BRAZIL. WE RECORDED THE RICHNESS AND USES OF THE FISHED SPECIES AND THE ECOLOGICAL KNOWLEDGE ON THESE SPECIES, THE FISHING TECHNIQUES EMPLOYED AND THE PERCEPTION OF THE INDIGENOUS PEOPLE REGARDING CURRENT ENVIRONMENTAL IMPACTS ON THE SAO FRANCISCO RIVER THAT INFLUENCE LOCAL FISHING. METHOD: THE INFORMATION WAS OBTAINED THROUGH INTERVIEWS WITH 33 TRUKA FISHERS (27 MEN AND SIX WOMEN), INCLUDING 17 INTERVIEWEES FROM CENTRAL VILLAGE (CABROBO) AND 16 FROM TAPERA VILLAGE (OROCO). RESULTS: USING FIVE FISHING TECHNIQUES, THE INTERVIEWEES CAUGHT 25 FISH SPECIES, INCLUDING 21 NATIVE AND FOUR EXOTIC SPECIES. ALL SPECIES ARE USED AS FOOD, AND TWO SPECIES ARE USED IN TRADITIONAL TRUKA MEDICINE. THE INTERVIEWEES REVEALED THAT FISHING CURRENTLY HAS LESS IMPORTANCE IN THEIR SUBSISTENCE. THEY INDICATED THAT THIS SITUATION IS OCCURRING BECAUSE OF SEVERAL FACTORS, SUCH AS THE INTRODUCTION OF EXOTIC SPECIES, POLLUTION AND URBANIZATION, THAT HAVE IMPACTED THE SAO FRANCISCO RIVER, RESULTING IN A DECLINE OF FISHING RESOURCES. NEVERTHELESS, WE FOUND THAT THE INDIGENOUS PEOPLE WHO ARE STILL FISHING HAVE A BROAD KNOWLEDGE OF THE HABITAT AND ECOLOGY OF THE TARGET FISHING. CONCLUSION: ALTHOUGH FISHING IS DECLINING IN IMPORTANCE AMONG THE TRUKA, WE FOUND THAT THE INDIVIDUALS WHO ARE STILL PRACTICING THIS ACTIVITY HAVE A BROAD KNOWLEDGE ABOUT THE HABITAT AND ECOLOGY OF THE TARGET SPECIES AND APPLY THAT KNOWLEDGE TO FISHING METHODS. KNOWLEDGE ABOUT THE ECOLOGY OF THE SPECIES AND THE ENVIRONMENTAL IMPACTS THAT HAVE AFFECTED THEM CAN SUPPORT BASIC RESEARCH ON LOCAL FISH POPULATIONS AND RESEARCH INVESTIGATING THE ENVIRONMENTAL IMPACTS, RESOURCE MANAGEMENT AND SUSTAINABLE EXPLOITATION OF FISHERIES RESOURCES."
143,"noone","not vetted",NA,"not vetted",143,"WANG Y;OENAL H",2016,"OPTIMAL DESIGN OF COMPACT AND CONNECTED NATURE RESERVES FOR MULTIPLE SPECIES","CONSERVATION BIOLOGY","30","413-424","413-424","10.1111/cobi.12629","WHEN DESIGNING A CONSERVATION RESERVE SYSTEM FOR MULTIPLE SPECIES, SPATIAL ATTRIBUTES OF THE RESERVES MUST BE TAKEN INTO ACCOUNT AT SPECIES LEVEL. THE EXISTING OPTIMAL RESERVE DESIGN LITERATURE CONSIDERS EITHER ONE SPATIAL ATTRIBUTE OR WHEN MULTIPLE ATTRIBUTES ARE CONSIDERED THE ANALYSIS IS RESTRICTED ONLY TO ONE SPECIES. WE BUILT A LINEAR INTEGER PROGRAMING MODEL THAT INCORPORATES COMPACTNESS AND CONNECTIVITY OF THE LANDSCAPE RESERVED FOR MULTIPLE SPECIES. THE MODEL IDENTIFIES MULTIPLE RESERVES THAT EACH SERVE A SUBSET OF TARGET SPECIES WITH A SPECIFIED COVERAGE PROBABILITY THRESHOLD TO ENSURE THE SPECIES' LONG-TERM SURVIVAL IN THE RESERVE, AND EACH TARGET SPECIES IS COVERED (PROTECTED) WITH ANOTHER PROBABILITY THRESHOLD AT THE RESERVE SYSTEM LEVEL. WE MODELED COMPACTNESS BY MINIMIZING THE TOTAL DISTANCE BETWEEN SELECTED SITES AND CENTRAL SITES, AND WE MODELED CONNECTIVITY OF A SELECTED SITE TO ITS DESIGNATED CENTRAL SITE BY SELECTING AT LEAST ONE OF ITS ADJACENT SITES THAT HAS A NEARER DISTANCE TO THE CENTRAL SITE. WE CONSIDERED STRUCTURAL DISTANCE AND FUNCTIONAL DISTANCES THAT INCORPORATED SITE QUALITY BETWEEN SITES. WE TESTED THE MODEL USING RANDOMLY GENERATED DATA ON 2 SPECIES, ONE GROUND SPECIES THAT REQUIRED STRUCTURAL CONNECTIVITY AND THE OTHER AN AVIAN SPECIES THAT REQUIRED FUNCTIONAL CONNECTIVITY. WE APPLIED THE MODEL TO 10 BIRD SPECIES LISTED AS ENDANGERED BY THE STATE OF ILLINOIS (U.S.A.). SPATIAL COHERENCE AND SELECTION COST OF THE RESERVES DIFFERED SUBSTANTIALLY DEPENDING ON THE WEIGHTS ASSIGNED TO THESE 2 CRITERIA. THE MODEL CAN BE USED TO DESIGN A RESERVE SYSTEM FOR MULTIPLE SPECIES, ESPECIALLY SPECIES WHOSE HABITATS ARE FAR APART IN WHICH CASE MULTIPLE DISJUNCT BUT COMPACT AND CONNECTED RESERVES ARE ADVANTAGEOUS. THE MODEL CAN BE MODIFIED TO INCREASE OR DECREASE THE DISTANCE BETWEEN RESERVES TO REDUCE OR PROMOTE POPULATION CONNECTIVITY. EL DISENO PTIMO DE RESERVAS NATURALES COMPACTAS Y CONECTADAS PARA MULTIPLES ESPECIES CUANDO SE DISENA UN SISTEMA DE RESERVAS DE CONSERVACION PARA MULTIPLES ESPECIES, LOS ATRIBUTOS ESPACIALES DE LAS RESERVAS DEBEN CONSIDERARSE AL NIVEL DE ESPECIE. LA BIBLIOGRAFIA EXISTENTE SOBRE EL DISENO OPTIMO DE RESERVAS CONSIDERA A UN ATRIBUTO ESPACIAL O, CUANDO SE CONSIDERAN MULTIPLES ATRIBUTOS, EL ANALISIS ESTA LIMITADO A UNA ESPECIE. CONSTRUIMOS UN MODELO DE PROGRAMACION ENTERA LINEAL QUE INCORPORA LA COMPACTIBILIDAD Y LA CONECTIVIDAD DEL PAISAJE RESERVADO PARA MULTIPLES ESPECIES. EL MODELO IDENTIFICA A VARIAS RESERVAS, DE LAS CUALES CADA UNA SIRVE A UN SUBCONJUNTO DE ESPECIES OBJETIVO CON UN UMBRAL DE PROBABILIDAD DE COBERTURA ESPECIFICA PARA ASEGURAR LA SUPERVIVENCIA DE LA ESPECIE A LARGO PLAZO DENTRO DE LA RESERVA, Y CADA ESPECIE OBJETIVO ESTA PROTEGIDA POR OTRO UMBRAL DE PROBABILIDAD A NIVEL DE SISTEMA DE RESERVAS. MODELAMOS LA COMPACTIBILIDAD AL MINIMIZAR LA DISTANCIA TOTAL ENTRE LOS SITIOS SELECCIONADOS Y LOS SITIOS CENTRALES, Y LA CONECTIVIDAD DE UN SITIO SELECCIONADO CON SU SITIO CENTRAL DESIGNADO FUE MODELADA AL ELEGIR POR LO MENOS UNO DE SUS SITIOS ADYACENTES QUE TUVIERA UNA DISTANCIA MAS CERCANA AL SITIO CENTRAL. CONSIDERAMOS LA DISTANCIA ESTRUCTURAL Y LAS DISTANCIAS FUNCIONALES QUE INCORPORARAN LA CALIDAD DE SITIO ENTRE LOS SITIOS. EVALUAMOS EL MODELO USANDO DATOS DE DOS ESPECIES GENERADOS AL AZAR, UNA ESPECIE TERRESTRE QUE REQUERIA CONECTIVIDAD ESTRUCTURAL Y UNA ESPECIE DE AVE QUE REQUERIA DE CONECTIVIDAD FUNCIONAL. APLICAMOS EL MODELO A 10 ESPECIES DE AVES CATEGORIZADAS COMO EN PELIGRO POR EL ESTADO DE ILLINOIS (EUA). LA COHERENCIA ESPACIAL Y EL COSTO DE SELECCION DE LAS RESERVAS DIFIRIERON SUSTANCIALMENTE DEPENDIENDO DEL PESO ASIGNADO A ESTOS DOS CRITERIOS. EL MODELO PUEDE USARSE PARA DISENAR UN SISTEMA DE RESERVAS PARA MULTIPLES ESPECIES, ESPECIALMENTE AQUELLAS CUYOS HABITATS ESTAN DISTANCIADOS Y EN CUYO CASO ES VENTAJOSO TENER MULTIPLES RESERVAS DISYUNTAS PERO COMPACTAS Y CONECTADAS. EL MODELO PUEDE MODIFICARSE PARA INCREMENTAR O DISMINUIR LA DISTANCIA ENTRE LAS RESERVAS PARA REDUCIR O PROMOVER LA CONECTIVIDAD DEL HABITAT. RESUMEN"
144,"noone","not vetted",NA,"not vetted",144,"PORFIRIO G;SARMENTO P;LEAL S;FONSECA C",2016,"HOW IS THE JAGUAR PANTHERA ONCA PERCEIVED BY LOCAL COMMUNITIES ALONG THE PARAGUAI RIVER IN THE BRAZILIAN PANTANAL","ORYX","50","163-168","163-168","10.1017/S0030605314000349","RAPID HABITAT CONVERSION, HUNTING AS A RETALIATORY RESPONSE TO LIVESTOCK DEPREDATION AND, POTENTIALLY, LACK OF KNOWLEDGE REGARDING THE SPECIES' ECOLOGICAL ROLE ARE THE MAIN FACTORS INFLUENCING CONSERVATION OF THE NEAR THREATENED JAGUAR PANTHERA ONCA IN THE PANTANAL WETLAND OF BRAZIL. INVESTIGATION OF PEOPLE'S PERCEPTIONS AND ATTITUDES TOWARDS A SPECIES IS AN IMPORTANT ELEMENT OF CONSERVATION INITIATIVES BUT MOST INFORMATION CONCERNING HUMAN PERCEPTIONS OF JAGUARS IN THE PANTANAL COMES FROM CONFLICT WITH RANCHERS, WHO TYPICALLY PERCEIVE THIS SPECIES NEGATIVELY AS A RESULT OF ECONOMIC LOSSES. NO INFORMATION IS AVAILABLE CONCERNING PERCEPTIONS OF THE JAGUAR BY OTHER INHABITANTS, PARTICULARLY ALONG RIVERSIDES WHERE THE MAIN ACTIVITY IS PROFESSIONAL AND RECREATIONAL FISHING. WE USED SEMI-STRUCTURED QUESTIONNAIRES TO INTERVIEW 50 RIVERSIDE INHABITANTS ON HOW THEY PERCEIVE THE JAGUAR AND TO INVESTIGATE THE INFLUENCE OF EDUCATION AND AGE ON SUCH PERCEPTIONS COMPARED TO LOCAL PEOPLE FROM RURAL PROPERTIES IN THE PANTANAL AND OTHER BRAZILIAN BIOMES. `DANGEROUS' WAS THE PREDOMINANT PERCEPTION. WE FOUND THAT THE NEGATIVE PERCEPTIONS OF JAGUARS RELATED TO PEOPLE'S SAFETY AND NOT TO ECONOMIC LOSSES FROM LIVESTOCK DEPREDATION. WE HIGHLIGHT ENVIRONMENTAL EDUCATION PROGRAMMES, ECOTOURISM AND BETTER STRATEGIES TO REDUCE LIVESTOCK LOSSES AS USEFUL TOOLS FOR MINIMIZING THE PERCEPTION THAT JAGUARS ARE DANGEROUS IN ALL SITUATIONS."
145,"noone","not vetted",NA,"not vetted",145,"WILKINSON C;YEO D;HUI T;FIKRI A;EWERS R",2018,"LANDUSE CHANGE IS ASSOCIATED WITH A SIGNIFICANT LOSS OF FRESHWATER FISH SPECIES AND FUNCTIONAL RICHNESS IN SABAH MALAYSIA","BIOLOGICAL CONSERVATION","222","164-171","164-171","10.1016/j.biocon.2018.04.004","GLOBAL BIODIVERSITY IS BEING LOST DUE TO EXTENSIVE ANTHROPOGENIC LAND COVER CHANGE. IN SOUTHEAST ASIA, BIODIVERSITY-RICH FORESTS ARE BEING EXTENSIVELY LOGGED AND CONVERTED TO OIL-PALM MONOCULTURES. THE IMPACTS OF THIS LAND-USE CHANGE ON FRESHWATER ECOSYSTEMS, AND PARTICULARLY ON FRESHWATER BIODIVERSITY, REMAIN LARGELY UNDERSTUDIED AND POORLY UNDERSTOOD. WE ASSESSED THE DIFFERENCES BETWEEN FISH COMMUNITIES IN HEADWATER STREAM CATCHMENTS ACROSS AN ESTABLISHED LAND-USE GRADIENT IN SABAH, MALAYSIA (PROTECTED FOREST AREAS, TWICE-LOGGED FOREST, SALVAGE-LOGGED FOREST, OIL-PALM PLANTATIONS WITH RIPARIAN RESERVES, AND OIL-PALM PLANTATIONS WITHOUT RIPARIAN RESERVES). STREAM FISHES WERE SAMPLED USING AN ELECTROFISHER, A CAST NET AND A TRAY NET IN 100 M LONG TRANSECTS IN 23 STREAMS IN 2017. LOCAL SPECIES RICHNESS AND FUNCTIONAL RICHNESS WERE BOTH SIGNIFICANTLY REDUCED WITH ANY LAND-USE CHANGE FROM PROTECTED FOREST AREAS, BUT FURTHER INCREASES IN LAND-USE INTENSITY HAD NO SUBSEQUENT IMPACTS ON FISH BIOMASS, FUNCTIONAL EVENNESS, AND FUNCTIONAL DIVERGENCE. ANY FORM OF LOGGING OR LAND USE CHANGE HAD A CLEAR AND NEGATIVE IMPACT ON FISH COMMUNITIES, BUT THE MAGNITUDE OF THAT EFFECT WAS NOT INFLUENCED BY LOGGING SEVERITY OR TIME SINCE LOGGING ON ANY FISH COMMUNITY METRIC, SUGGESTING THAT JUST TWO ROUNDS OF SELECTIVE IMPACT (I.E., LOGGING) APPEARED SUFFICIENT TO CAUSE NEGATIVE EFFECTS ON FRESHWATER ECOSYSTEMS. IT IS THEREFORE ESSENTIAL TO CONTINUE PROTECTING PRIMARY FORESTED AREAS TO MAINTAIN FRESHWATER DIVERSITY, AS WELL AS TO EXPLORE STRATEGIES TO PROTECT FRESHWATER ECOSYSTEMS DURING LOGGING, DEFORESTATION, AND CONVERSION TO PLANTATION MONOCULTURES THAT ARE EXPECTED TO CONTINUE ACROSS SOUTHEAST ASIA."
146,"noone","not vetted",NA,"not vetted",146,"MARTIN A;GRAHAM S;HENRY M;PERVIN E;FAHRIG L",2018,"FLYING INSECT ABUNDANCE DECLINES WITH INCREASING ROAD TRAFFIC","INSECT CONSERVATION AND DIVERSITY","11","608-613","608-613","10.1111/icad.12300","ONE POTENTIALLY IMPORTANT BUT UNDERAPPRECIATED THREAT TO INSECTS IS ROAD MORTALITY. ROAD KILL STUDIES CLEARLY SHOW THAT INSECTS ARE KILLED ON ROADS, LEADING TO THE HYPOTHESIS THAT ROAD MORTALITY CAUSES DECLINES IN LOCAL INSECT POPULATION SIZES. IN THIS STUDY WE USED CUSTOM-MADE STICKY TRAPS ATTACHED TO A VEHICLE TO TARGET DIURNAL FLYING INSECTS THAT INTERACT WITH ROADS, SAMPLING ALONG 10 HIGH-TRAFFIC AND 10 LOW-TRAFFIC RURAL ROADS IN SOUTHEASTERN ONTARIO, CANADA. WE USED A PAIRED SAMPLING DESIGN TO CONTROL FOR POTENTIALLY CONFOUNDING DIFFERENCES IN THE ROAD CHARACTERISTICS (E.G. ROAD WIDTH) AND SURROUNDING LAND COVERS (E.G. HOUSING DENSITY) BETWEEN HIGH-TRAFFIC AND LOW-TRAFFIC ROADS. WE THEN USED THESE DATA TO TEST THE PREDICTION THAT FEWER FLYING INSECTS COLLIDE WITH VEHICLES, PER VEHICLE (I.E. INSECT ABUNDANCE IS LOWER), ON HIGH-TRAFFIC THAN LOW-TRAFFIC ROADS. WE FOUND SIGNIFICANTLY FEWER INSECTS AT THE HIGH-TRAFFIC ROADS THAN AT THE LOW-TRAFFIC ROADS AS PREDICTED. THERE WAS A 23.5\% DECLINE IN THE NUMBER OF INSECTS/KM/VEHICLE ON HIGH-TRAFFIC RELATIVE TO LOW-TRAFFIC ROADS. GIVEN THE HIGH RATES OF INSECT MORTALITY OBSERVED IN PREVIOUS STUDIES, IT IS LIKELY THAT ROAD MORTALITY CONTRIBUTES TO THESE OBSERVED NEGATIVE EFFECTS OF TRAFFIC INTENSITY. THUS THE GROWING GLOBAL ROAD NETWORK IS A CONCERN FOR CONSERVATIONISTS AND LAND MANAGERS, NOT ONLY BECAUSE INSECT POPULATION DECLINES CONTRIBUTE TO THE ONGOING GLOBAL LOSSES OF BIODIVERSITY BUT ALSO BECAUSE INSECTS PLAY A VITAL ROLE IN FOOD WEBS AND PROVIDE IMPORTANT ECOSYSTEM SERVICES."
150,"noone","not vetted",NA,"not vetted",150,"CATRY I;AMANO T;FRANCO A;SUTHERLAND W",2012,"INFLUENCE OF SPATIAL AND TEMPORAL DYNAMICS OF AGRICULTURAL PRACTICES ON THE LESSER KESTREL","JOURNAL OF APPLIED ECOLOGY","49","99-108","99-108","10.1111/j.1365-2664.2011.02071.x","1. EUROPEAN AGRICULTURE IS FACING DRAMATIC CHANGES THAT ARE LIKELY TO HAVE MARKED IMPACTS ON FARMLAND BIODIVERSITY. THERE IS AN URGENT NEED TO DEVELOP LAND MANAGEMENT STRATEGIES COMPATIBLE WITH THE CONSERVATION OF BIODIVERSITY. 2. WE APPLIED A SPATIALLY EXPLICIT BEHAVIOUR-BASED MODEL TO ASSESS HOW FARMLAND MANAGEMENT AND THE PATTERN OF EVENTS ACROSS THE ANNUAL FARMING CALENDAR INFLUENCES THE FORAGING DECISIONS OF LESSER KESTRELS FALCO NAUMANNI IN A CEREAL STEPPE LANDSCAPE. MOREOVER, WE SIMULATED THE MOST LIKELY SCENARIOS OF FUTURE AGRICULTURAL CHANGES TO PREDICT ITS IMPACTS ON LESSER KESTREL BREEDING SUCCESS. LESSER KESTRELS HAVE BEEN THE SUBJECT OF SERIOUS CONSERVATION CONCERN AND CONSTITUTE A GOOD MODEL SPECIES TO JUDGE IMPACTS ON FARMLAND SPECIES MORE WIDELY. 3. OUR RESULTS SHOW THAT THE LOCATION OF CEREAL AND FALLOW PATCHES WITHIN A 2-KM RADIUS OF A KESTREL COLONY INFLUENCES THE TOTAL FOOD SUPPLY DELIVERED TO THE NESTLINGS, EXPLAINING THE DIFFERENCES IN BREEDING SUCCESS BETWEEN YEARS AND COLONIES. FURTHERMORE, THE PARTICULAR SEQUENCE IN WHICH PATCHES ARE HARVESTED BY FARMERS IS ALSO PREDICTED TO INFLUENCE OFFSPRING SURVIVAL. 4. AGRICULTURAL INTENSIFICATION, SIMULATED BY INCREASING THE PROPORTION OF CEREAL FIELDS, IS PREDICTED TO NEGATIVELY INFLUENCE BREEDING SUCCESS. HOWEVER, THE FIELD HARVESTING SEQUENCE CAN PLAY AN IMPORTANT ROLE IN ALLEVIATING THE EFFECTS OF THE INCREASED PERCENTAGE OF CEREAL, AS DEMONSTRATED BY THE HIGHER BREEDING SUCCESS OBTAINED WHEN HARVESTING STARTS FROM PATCHES FARTHEST FROM THE COLONIES. THE REPLACEMENT OF CEREAL CULTIVATION BY LOW-INTENSITY GRAZED FALLOWS WOULD NOT BE DETRIMENTAL FOR KESTRELS. 5. SYNTHESIS AND APPLICATIONS. OUR RESULTS HIGHLIGHT THE EFFECTIVENESS OF BEHAVIOUR-BASED MODELS TO EVALUATE THE INTERACTING EFFECT OF SPATIAL AND TEMPORAL DYNAMICS OF AGRICULTURAL LANDSCAPES AND PREDICT THE RESPONSE OF POPULATIONS TO ENVIRONMENTAL CHANGE. TO OPTIMIZE FOOD AVAILABILITY FOR LESSER KESTRELS, LAND MANAGERS SHOULD IMPLEMENT LONG ROTATIONAL SCHEMES WITH < 60\% OF THE AREA UNDER EXTENSIVE CEREAL CULTIVATION IN A 2-KM RADIUS AROUND COLONIES. HARVESTING SHOULD START IN THE CEREAL PATCHES FARTHEST FROM COLONIES. IDEALLY, THE PREDOMINANT LAND USE AROUND COLONIES SHOULD BE FALLOWS. THESE OUTCOMES ILLUSTRATE HOW BEHAVIOUR-BASED MODELS CAN BE APPLIED TO IDENTIFY SPECIFIC MANAGEMENT RECOMMENDATIONS THAT WOULD IMPROVE THE EFFECTIVENESS OF AGRI-ENVIRONMENTAL SCHEMES, THE MOST ACCEPTED TOOL FOR MAINTAINING FARMLAND LANDSCAPES."
151,"noone","not vetted",NA,"not vetted",151,"WILKINS K;PEJCHAR L;GARVOILLE R",2019,"ECOLOGICAL AND SOCIAL CONSEQUENCES OF BISON REINTRODUCTION IN COLORADO","CONSERVATION SCIENCE AND PRACTICE","1",NA,NA,"10.1002/csp2.9","BISON WERE INSTRUMENTAL IN SHAPING NORTH AMERICA'S GREAT PLAINS. INTEREST IN RESTORING THIS ICONIC SPECIES AND THEIR ECOLOGICAL ROLE IN GRASSLAND ECOSYSTEMS IS RAPIDLY GAINING MOMENTUM. TO EVALUATE THE POTENTIAL FOR BISON TO ENHANCE HABITAT QUALITY FOR WILDLIFE AND CATALYZE PUBLIC ENGAGEMENT IN GRASSLAND CONSERVATION, WE ASSESSED BOTH THE ECOLOGICAL AND SOCIAL EFFECTS OF A RECENT BISON REINTRODUCTION (2015) TO NORTHERN COLORADO. SPECIFICALLY, WE EXPLORED THE EFFECT OF BISON REINTRODUCTION ON: (A) BIRD DENSITY AND HABITAT USE, (B) MAMMAL HABITAT USE, (C) VEGETATION COMPOSITION AND STRUCTURE, AND (D) VISITOR CONNECTEDNESS, KNOWN AS PLACE ATTACHMENT, TO A SHORTGRASS PRAIRIE. WE PREDICTED THAT BISON REINTRODUCTION WOULD REDUCE COVER AND HEIGHT OF SOME GRASSES AND SHRUBS, WHICH WOULD INCREASE DENSITY AND HABITAT USE FOR OBLIGATE SHORTGRASS PRAIRIE BIRDS, AND INCREASE HABITAT USE FOR COYOTE AND LAGOMORPHS. IN ADDITION, WE PREDICTED THAT VISITORS WOULD EXPRESS STRONGER PLACE ATTACHMENT TO THIS GRASSLAND ONCE BISON WERE REINTRODUCED. TO MEASURE ECOLOGICAL AND SOCIAL RESPONSES, WE SURVEYED BIRDS, MAMMALS, AND PLANTS; AND CONDUCTED STRUCTURED VISITOR SURVEYS BEFORE AND AFTER BISON REINTRODUCTION. WE FOUND FEW SHORT-TERM EFFECTS OF BISON ON GRASSLAND BIRD DENSITY AND HABITAT USE, MAMMAL HABITAT USE, AND VEGETATION COMPOSITION AND STRUCTURE. HOWEVER, WE MEASURED A SIGNIFICANT INCREASE IN VISITOR PLACE ATTACHMENT TO THE GRASSLAND SITE 1 YEAR AFTER BISON REINTRODUCTION. OUR RESULTS SUGGEST THAT A NEW BISON REINTRODUCTION MAY HAVE IMMEDIATE POSITIVE BENEFITS FOR CONNECTING PEOPLE TO CONSERVATION, AND THAT THE ECOLOGICAL AND SOCIAL EFFECTS MAY UNFOLD OVER DIFFERENT TIME SCALES. WE RECOMMEND THAT FUTURE BISON REINTRODUCTION EFFORTS MONITOR ECOLOGICAL AND SOCIAL OUTCOMES TO ADVANCE REINTRODUCTION BIOLOGY."
