"STUDY_ID","REVIEWERS","INCLUDE","REVIEWERS","INCLUDE","STUDY_ID","AUTHORS","YEAR","TITLE","JOURNAL","VOLUME","LPAGES","UPAGES","DOI","ABSTRACT"
51,"noone","not vetted",NA,"not vetted",51,"FARIA N;RABACA J;MORALES M",2012,"THE IMPORTANCE OF GRAZING REGIME IN THE PROVISION OF BREEDING HABITAT FOR GRASSLAND BIRDS THE CASE OF THE ENDANGERED LITTLE BUSTARD TETRAX TETRAX","JOURNAL FOR NATURE CONSERVATION","20","211-218","211-218","10.1016/j.jnc.2012.03.003","IN MEDITERRANEAN DRY GRASSLANDS, GRAZING BY DOMESTIC ANIMALS IS AN IMPORTANT AGRICULTURAL ACTIVITY ON DRY GRASSLANDS. SEVERAL BIRD SPECIES OCCUR IN THESE GRAZED HABITATS AND ARE NOW EXPERIENCING A NEAR CONTINUOUS DECLINE. WE INVESTIGATED THE IMPACT OF LIVESTOCK GRAZING ON THE THREATENED LITTLE BUSTARD (TETRAX TETRAX L.). THE STUDY WAS CONDUCTED AT THE NATURA 2000 SITE/IMPORTANT BIRD AREA OF CABRELA, PORTUGAL. OUR MAIN GOALS WERE TO INVESTIGATE RESPONSES OF LITTLE BUSTARD TERRITORIAL MALES AND BREEDING FEMALES TO DIFFERENT LIVESTOCK MANAGEMENT PRACTICES, NAMELY PASTURE TYPES, STOCKING RATES AND SWARD STRUCTURE. BIRD DISTRIBUTION WAS SURVEYED USING CAR AND FOOT SURVEYS. DATA ON GRAZING WAS SUPPLIED BY LAND MANAGERS EVERY 10 DAYS FROM FEBRUARY TO JUNE THROUGH FIELD INTERVIEWS. GENERALISED ADDITIVE MODELS AND MODEL AVERAGING WERE USED TO COMPUTE PREDICTIVE MODELS. RESULTS INDICATE THAT HIGHER PROBABILITIES OF OCCURRENCE WERE FOUND IN LONG-TERM PASTURES AND UNDER LIGHT-MODERATE GRAZING CONDITIONS (STOCKING RATES AROUND 0.4 LU/HA). CONVERSELY, LOWER PROBABILITIES OF OCCURRENCE WERE FOUND IN UNGRAZED OR HEAVY GRAZED FIELDS. MALES OCCURRED MOSTLY IN LARGE FIELDS, BUT THIS VARIABLE SEEMED TO BE LESS IMPORTANT FOR FEMALES. ON THE OTHER HAND, GREEN PLANT COVER AND THE VEGETATION HEIGHT WERE GOOD PREDICTORS FOR THE OCCURRENCE OF FEMALES BUT NOT FOR MALES. FEMALES USED MOSTLY PASTURES WITH VEGETATION HEIGHT AROUND 20-25 CM. OUR RESULTS SUGGEST THAT GRAZING MANAGEMENT PLANS THAT AIM TO CONSERVE LITTLE BUSTARD POPULATIONS SHOULD CONSIDER (1) THE MAINTENANCE OF THE LARGER LONG-TERM PASTURES AND (2) THE USE OF LIGHT-MODERATE STOCKING RATES (0.2-0.6 LU/HA). (C) 2012 ELSEVIER GMBH. ALL RIGHTS RESERVED."
53,"noone","not vetted",NA,"not vetted",53,"MATOS M;ALVES M;RAMOS P M;TORRES S;FONSECA C",2015,"CLEAR AS DAYLIGHT ANALYSIS OF DIURNAL RAPTOR PELLETS FOR SMALL MAMMAL STUDIES","ANIMAL BIODIVERSITY AND CONSERVATION","38","37-48","37-48",NA,"NON-INVASIVE APPROACHES ARE INCREASINGLY INVESTIGATED AND APPLIED IN STUDIES OF SMALL MAMMAL ASSEMBLAGES BECAUSE THEY ARE MORE COST EFFECTIVE AND BYPASS CONSERVATION AND ANIMAL WELFARE ISSUES. HOWEVER, PELLETS OF DIURNAL RAPTORS HAVE RARELY BEEN USED FOR THESE PURPOSES. WE EVALUATED THE POTENTIAL OF MARSH HARRIER PELLETS (CIRCUS AERUGINOSUS) AS A NON INVASIVE METHOD TO SAMPLE SMALL MAMMAL ASSEMBLAGES, BY COMPARING THE RESULTS WITH THOSE OF SAMPLING USING SHERMAN LIVE TRAPS AND PITFALLS. THE THREE METHODS WERE APPLIED SIMULTANEOUSLY IN AN AGRICULTURAL WETLAND COMPLEX IN NW PORTUGAL. ESTIMATES OF SPECIES RICHNESS, DIVERSITY, EVENNESS, ABUNDANCE, AND PROPORTION OF EACH SPECIES WITHIN THE ASSEMBLAGE SHOWED SIGNIFICANT DIFFERENCES BETWEEN THE THREE METHODS. OUR RESULTS SUGGEST THAT THE USE OF MARSH HARRIER PELLETS IS MORE EFFECTIVE IN INVENTORYING SMALL MAMMAL SPECIES THAN EITHER OF THE TWO KINDS OF TRAPS, WHILE ALSO AVOIDING ANY INVOLUNTARY FATALITIES ASSOCIATED WITH THE SAMPLING OF SMALL NON-VOLANT MAMMALS. MOREOVER, THE ANALYSIS OF PELLETS WAS THE MOST COST EFFECTIVE METHOD. COMPARISON OF THE TWO TRAPPING METHODOLOGIES SHOWED INVOLUNTARY FATALITIES WERE HIGHER IN PITFALLS THAN IN SHERMAN TRAPS. WE DISCUSS THE ADVANTAGES AND FLAWS OF THE THREE METHODS, BOTH FROM TECHNICAL AND CONSERVATIONAL PERSPECTIVES."
55,"noone","not vetted",NA,"not vetted",55,"VEREECKEN N",2017,"A PHYLOGENETIC APPROACH TO CONSERVATION PRIORITIZATION FOR EUROPES BUMBLEBEES HYMENOPTERA APIDAE BOMBUS","BIOLOGICAL CONSERVATION","206","21-30","21-30","10.1016/j.biocon.2016.12.009","BUMBLEBEES ARE AN ESSENTIAL COMPONENT OF OUR AGROECOSYSTEMS, AND THEIR DECLINE REPRESENTS A MAJOR THREAT FOR THE SEXUAL REPRODUCTION AND HENCE SURVIVAL OF WILD FLOWERS AND SEVERAL IMPORTANT POLLINATOR-DEPENDENT CROPS ALIKE. THE EU BUMBLEBEE FAUNA ENCOMPASSES MANY HIGHLY IMPERILED SPECIES CHARACTERIZED BY A RELATIVELY NARROW RANGE SIZE AND OFTEN RESTRICTED TO HIGH ELEVATION MOUNTAIN HABITATS WHERE THE THREATS OF BOTH CURRENT AND FUTURE GLOBAL WARMING ARE EXPECTED TO BE PARTICULARLY SEVERE. IN THIS CONTEXT, IDENTIFYING HOW AND WHERE LIMITED CONSERVATION RESOURCES SHOULD BE TARGETED IS A PRESSING PRIORITY TO MEET OUR FUNDAMENTAL BIODIVERSITY CONSERVATION TARGETS IN AN ECONOMICALLY-EFFICIENT WAY. BECAUSE CLASSICAL TAXONOMIC APPROACHES TO CONSERVATION CAN POTENTIALLY OVERLOOK IMPORTANT ALTERNATIVE ASPECTS OF BIODIVERSITY SUCH AS THE PHYLOGENETIC DIVERSITY, A KEY COMPONENT FOR THE MAINTENANCE OF ECOSYSTEM PROCESSES AND SERVICES, I USED A MULTI-GENE MOLECULAR PHYLOGENY ENCOMPASSING MORE THAN 85\% OF THE EU SPECIES TO COMBINE CATEGORIES OF THE IUCN RED LIST WITH THE EVOLUTIONARY LEGACY AND RANGE SIZE OF EU BUMBLEBEES. MY RESULTS FROM PHYLOGENETIC GENERALIZED LEAST SQUARES (PGLS) AND PHYLOGENETIC INDEPENDENT CONTRASTS (PIC) ANALYSES FIRST INDICATE THAT, CONTRARY TO THEORETICAL PREDICTION, EVOLUTIONARY RELATEDNESS EXPLAINS NONE OF THE RANGE SIZE SIMILARITY OR THE PROBABILITY OF EXTINCTION RISK IN EU BUNIBLEBEES. FURTHERMORE, ALTHOUGH THE EXTINCTION OF EXTANT THREATENED EU BUMBLEBEE SPECIES IS UNLIKELY TO HAVE A SIGNIFICANT EFFECT ON THE EXPECTED PHYLOGENETIC DISPERSION OF THE RENIAINING BOMBUS SPECIES AT THE EU SCALE, MY RESULTS CLEARLY ILLUSTRATE THAT A SIGNIFICANTLY DISPROPORTIONATE AMOUNT OF PHYLOGENETIC DIVERSITY/EVOLUTIONARY HISTORY MIGHT BE LOST IF THE EXTANT THREATENED EU BUMBLEBEE SPECIES WOULD BECOME EXTINCT. COLLECTIVELY, THIS STUDY EXEMPLIFIES THE FACT THAT THE INCORPORATION OF A PHYLOGENETIC APPROACH CAN INCREASE THE EFFICACY OF THE EXISTING PRIORITIZATION FOR THE CONSERVATION OF EU BUMBLEBEES (I) BY CAPTURING THE PHYLOGENETIC DIVERSITY AND ITS ASSOCIATED FUNCTIONS, AS WELL AS (II) BY BETTER TARGETING SPECIES THAT ARE BOTH EVOLUTIONARILY UNIQUE (OR NON-REDUNDANT), THREATENED AND RESTRICTED IN THEIR RANGE SIZE. (C) 2016 ELSEVIER LTD. ALL RIGHTS RESERVED."
56,"noone","not vetted",NA,"not vetted",56,"CRUZ-CORDOVEZ C;HERRERA I;ESPINOZA K;SARMIENTO M;RODAS M;BRAVO W;LAMPO M",2020,"NEW RECORD OF A FERAL POPULATION OF LITHOBATES CATESBEIANUS SHAW 1802 IN A PROTECTED AREA SANTAY ISLAND IN THE ECUADORIAN COAST","BIOINVASIONS RECORDS","9","421-433","421-433","10.3391/bir.2020.9.2.28","THE AMERICAN BULLFROG (LITHOBATES CATESBELANUS SHAW, 1802), AN AMPHIBIAN SPECIES NATIVE TO EASTERN NORTH AMERICA, IS CONSIDERED ONE OF THE 100 MOST HARMFUL INVASIVE SPECIES IN THE WORLD. PREVIOUS STUDIES DOCUMENT SEVERAL FERAL POPULATIONS IN THE AMAZON AND ANDEAN REGIONS OF ECUADOR. HOWEVER, ONLY FEW ADULTS HAVE BEEN REPORTED IN THE COAST REGION, DESPITE SOME EVIDENCE SUGGESTING ITS INTRODUCTION 31 YEARS AGO. USING VISUAL AND AUDITORY CUES, WE EXPLORED A 490-HECTARE WETLAND AREA AT SANTAY ISLAND, A PROTECTED SANCTUARY AND A RAMSAR SITE ON THE ECUADORIAN COAST. BULLFROGS WERE DETECTED IN SEVEN OUT OF 15 SAMPLED PONDS IN ALL TYPES OF HABITATS EXCEPT FOR MANGROVES. THE LOW ABUNDANCE OF ADULTS AND JUVENILES SUGGESTS A RECENTLY ESTABLISHED POPULATION. THIS IS THE FIRST RECORD OF A FERAL POPULATION INSIDE A PROTECTED AREA OR RAMSAR SITE IN ECUADOR. IN ACCORDANCE WITH THE RAMSAR CONVENTION MISSION OF PRESERVING WETLANDS, WE PROPOSE TWO STRATEGIES TO MANAGE BULLFROGS AT SANTAY ISLAND."
57,"noone","not vetted",NA,"not vetted",57,"MONZON J;FRIEDENBERG N",2018,"METRICS OF POPULATION STATUS FOR LONGLIVED TERRITORIAL BIRDS A CASE STUDY OF GOLDEN EAGLE DEMOGRAPHY","BIOLOGICAL CONSERVATION","220","280-289","280-289","10.1016/j.biocon.2018.02.023","THE DEVELOPMENT OF ``SNAPSHOT'' METRICS THAT CAN SERVE AS RELIABLE DIAGNOSTIC TOOLS FOR RAPIDLY ASSESSING POPULATION STATUS HAS GREAT APPEAL. WE USED STOCHASTIC SIMULATION MODELING AND RECURSIVE PARTITIONING TO EVALUATE THE RELIABILITY OF TWO PROPOSED SNAPSHOT METRICS IN TERRITORIAL RAPTORS: THE FLOATER/BREEDER RATIO AND THE RATE OF NEST OCCUPANCY BY IMMATURE SUBADULTS. A DEMOGRAPHIC MODEL, PARAMETERIZED WITH FIELD DATA FROM AN INTENSIVELY STUDIED POPULATION OF GOLDEN EAGLE (AQUILA CLURAETOS), SHOWED THAT NEITHER METRIC, ALONE OR TOGETHER, IS A GOOD INDICATOR OF POPULATION STATUS. HOWEVER, ONE SNAPSHOT METRIC, THE FLOATER/BREEDER RATIO, CAN HELP PREDICT THE RISK OF POPULATION DECLINE WHEN CONSIDERED IN COMBINATION WITH OTHER INFORMATION ABOUT THE POPULATION OR ENVIRONMENT THAT MAY BE QUICKLY APPRAISED IN THE FIELD OR LITERATURE. SPECIFICALLY, QUALITATIVE KNOWLEDGE OF ADULT SURVIVAL AND WHETHER THE POPULATION IS LIMITED BY PREY OR HABITAT AVAILABILITY CAN HELP WITH RAPID RISK ASSESSMENT OF RAPTOR POPULATIONS."
60,"noone","not vetted",NA,"not vetted",60,"MOOS T;BLACKWELL B",2018,"COMPARISON OF TWO ESCAPEMENT DESIGNS FOR WESTERN PAINTED TURTLES CAPTURED IN MODIFIED FYKE NETS","JOURNAL OF FISH AND WILDLIFE MANAGEMENT","9","228-237","228-237","10.3996/112016-JFWM-082","ALTERING SAMPLING METHODS TO REDUCE BYCATCH DURING FISH POPULATION SAMPLING CAN INTRODUCE BIASES THAT AFFECT THE CAPTURE OF TARGET SPECIES. THEREFORE, UNDERSTANDING BYCATCH REDUCTION DEVICES AND HOW THEY AFFECT FISH SAMPLING IS IMPORTANT. OUR GOAL WAS TO TEST TWO POTENTIAL ESCAPEMENT DESIGNS INTENDED TO REDUCE BYCATCH OF WESTERN PAINTED TURTLES CHRYSEMYS PICTA BELLII DURING FRESHWATER-FISH POPULATION ASSESSMENTS WITH MODIFIED FYKE NETS. DESIGN A TESTED AN ESCAPEMENT FLAP ON THE INTERIOR OF THE MODIFIED FYKE NET AND DESIGN B TESTED AN ESCAPEMENT THROAT ON THE EXTERIOR OF THE MODIFIED FYKE NET. WE COMPLETED 4-H AND 24-H TRIALS FOR TURTLE ESCAPEMENT TO DETERMINE THE EFFECTIVENESS OF EACH DESIGN FOR REDUCING TURTLE BYCATCH. WE ALSO SIMULATED FISH POPULATION ASSESSMENTS TO DETERMINE THE ESCAPEMENT OFFISH AND TURTLES FROM EACH DESIGN. TURTLES ESCAPED FROM EACH DESIGN WITH MEAN ESCAPEMENT RATES DURING THE 4-H AND 24-H TRIALS OF 71.1\% AND 63.8\% FROM DESIGN A AND 55.6\% AND 50.0\% FROM DESIGN B, RESPECTIVELY. IN THE FISH POPULATION ASSESSMENT SIMULATION WE OBSERVED A MEAN ESCAPEMENT RATE OF 49\% FOR TURTLES FROM DESIGN A, BUT A MEAN ESCAPEMENT RATE OF ONLY 11\% FROM DESIGN B. SPECIES-SPECIFIC ESCAPEMENT RATES WERE OBSERVED FOR FISH IN BOTH DESIGNS. SIGNIFICANT DIFFERENCES IN THE SIZE STRUCTURE OF SOME SPECIES WERE OBSERVED. ESCAPEMENT RATES FROM DESIGN A WERE LIKELY UNDERESTIMATED FOR MOST SPECIES CAPTURED DUE TO MOVEMENT OF FISH AND TURTLES FROM THE HOLDING PEN BACK INTO THE FYKE NET. BASED ON OUR RESULTS, WE DO NOT RECOMMEND EITHER DESIGN TO REDUCE BYCATCH OF TURTLES DURING FISH COMMUNITY SAMPLING WITHOUT SUBSTANTIAL REFINEMENT OF THE DESIGNS. FURTHER RESEARCH IS NEEDED TO IDENTIFY ALTERNATIVE METHODS FOR REDUCING TURTLE BYCATCH MORTALITY."
61,"noone","not vetted",NA,"not vetted",61,"MACHADO-SCHIAFFINO G;JUANES F;GARCIA-VAZQUEZ E",2011,"IDENTIFYING UNIQUE POPULATIONS IN LONGDISPERSAL MARINE SPECIES GULFS AS PRIORITY CONSERVATION AREAS","BIOLOGICAL CONSERVATION","144","330-338","330-338","10.1016/j.biocon.2010.09.010","IDENTIFICATION OF AREAS WHICH SHOULD BE A SUBJECT OF PROTECTION IS CRUCIAL FOR SAFEGUARDING THE MARINE ECOSYSTEMS. AMONGST THE REASONS FOR PROTECTING A REGION OR LOCATION, THE EXISTENCE OF UNIQUE POPULATIONS OR EVOLUTIONARY SIGNIFICANT UNITS FOR ONE OR MORE KEY SPECIES IS A PRIORITY. THE NORTH AMERICAN SILVER HAKE, MERLUCCIUS BILINEARIS, IS CURRENTLY MANAGED AS TWO STOCKS (NORTHERN AND SOUTHERN) WITHOUT CONSIDERING GULF AREAS SEPARATELY. EMPLOYING MICROSATELLITE AND MITOCHONDRIAL MARKERS WE HAVE DETECTED SIGNIFICANT F-ST VALUES BETWEEN HAKE INDIVIDUALS INHABITING GULFS AND THOSE DISTRIBUTED IN THE OPEN SEA, AND ASYMMETRIC GENE FLOW, HIGHER FROM THE GULF TO THE OPEN SEA THAN IN THE OPPOSITE DIRECTION. THESE DIFFERENCES CAN BE INTERPRETED AS SIGNALS OF SEPARATE POPULATIONS IN GULFS WHICH MAY ACT AS SOURCES OF VARIABILITY FOR HAKE SPECIES. OCCURRENCE OF SIMILAR PHENOMENA IN ATLANTIC WATERS IN BOTH THE NORTHERN AND THE SOUTHERN HEMISPHERE, FOR THESE TWO PELAGIC-DEMERSAL HAKE SPECIES, SUGGESTS THAT GULFS MAY CONSTITUTE A TARGET FOR DESIGNING MARINE PROTECTED AREAS AND CONFIRMS THE ADEQUACY OF GULF-SPECIFIC MANAGEMENT ALREADY EMPLOYED IN ARGENTINA. (C) 2010 ELSEVIER LTD. ALL RIGHTS RESERVED."
62,"noone","not vetted",NA,"not vetted",62,"HILJE B;AIDE T",2012,"RECOVERY OF AMPHIBIAN SPECIES RICHNESS AND COMPOSITION IN A CHRONOSEQUENCE OF SECONDARY FORESTS NORTHEASTERN COSTA RICA","BIOLOGICAL CONSERVATION","146","170-176","170-176","10.1016/j.biocon.2011.12.007","IN SOME TROPICAL REGIONS, FOLLOWING THE ABANDONMENT OF AGRICULTURE AND PASTURES, SECONDARY FORESTS CAN RECOVER PLANT SPECIES RICHNESS AND FOREST STRUCTURE (E.G. CANOPY COVER, BIOMASS); HOWEVER, THE IMPORTANCE OF THESE SECONDARY FORESTS FOR FAUNA IS NOT CLEAR. SECONDARY FORESTS CAN BENEFIT FAUNA BY PROVIDING SUITABLE HABITATS, CONNECTING FORESTS FRAGMENTS, AND INCREASING GENE FLOW. PREVIOUS STUDIES OF FOREST REGENERATION HAVE SHOWED DIFFERENT LEVELS OF AMPHIBIAN RECOVERY. IN PUERTO RICO, 1-5 YEARS OLD SECONDARY FORESTS ACHIEVED SIMILAR AMPHIBIAN SPECIES RICHNESS AND COMPOSITION IN COMPARISON WITH OLD-GROWTH FORESTS, WHILE IN BRAZIL SECONDARY FORESTS FROM 14 TO 19 YEARS OF RECOVERY ONLY RECOVERED 60\% OF THE SPECIES OF OLD-GROWTH FORESTS. WE EVALUATED AMPHIBIAN RECOVERY IN SECONDARY FORESTS IN NORTHEASTERN COSTA RICA, BY ASSESSING AMPHIBIAN RECOVERY IN 12 SECONDARY FORESTS THAT VARY IN AGE OF RECOVERY AND IN THREE OLD-GROWTH FORESTS USING VISUAL AND ACOUSTIC SURVEYS. OUR SITES VARIED IN TERMS OF THEIR LANDSCAPE (E.G. AMOUNT OF SURROUNDING FOREST) AND FOREST CHARACTERISTICS (E.G. FOREST AGE, ABOVEGROUND BIOMASS, BASAL AREA, NUMBER OF TREE SPECIES, NUMBER OF STEMS, LEAF-LITTER DEPTH), BUT THERE WAS NO RELATIONSHIP BETWEEN THESE CHARACTERISTICS AND AMPHIBIAN SPECIES RICHNESS OR SPECIES COMPOSITION. WE FOUND THAT AMPHIBIANS ARE RECOVERING RAPIDLY IN SECONDARY FORESTS IN COSTA RICA, AND EVEN YOUNG FORESTS (10-16 YEARS) HAD SIMILAR SPECIES RICHNESS AND COMPOSITION IN COMPARISON WITH OLD-GROWTH FORESTS. THESE FORESTS ARE PROVIDING SUITABLE MICROHABITATS CONDITIONS FOR AMPHIBIANS. IN ADDITION, THIS STUDY HIGHLIGHTS THE IMPORTANCE OF LANDSCAPE CHARACTERISTICS. THE ABUNDANCE OF AMPHIBIAN SPECIES SOURCES (E.G. FOREST PATCHES) AND CONNECTIONS BETWEEN FORESTS APPEAR TO BE HELPING THE SPECIES COLONIZE THESE SITES. WORLDWIDE, THE AREA OF SECONDARY FORESTS IS INCREASING, AND OUR RESULTS SHOW THAT THESE HABITATS ARE SUITABLE FOR A DIVERSITY OF AMPHIBIAN SPECIES, SUGGESTING THAT THESE FORESTS CAN HELP REDUCE AMPHIBIAN POPULATION AND SPECIES DECLINE. (C) 2011 ELSEVIER LTD. ALL RIGHTS RESERVED."
64,"noone","not vetted",NA,"not vetted",64,"NOGALES M;CASTANEDA I;LOPEZ-DARIAS M;MEDINA E",2015,"THE UNNOTICED EFFECT OF A TOP PREDATOR ON COMPLEX MUTUALISTIC ECOLOGICAL INTERACTIONS","BIOLOGICAL INVASIONS","17","1655-1665","1655-1665","10.1007/s10530-014-0823-x","VERTEBRATES OFTEN MEDIATE SEED DISPERSAL SYSTEMS, ESSENTIAL FOR THE MAINTENANCE OF BIODIVERSITY. SOME OF THESE ACQUIRE A COMPLEX MULTISTEP PROCESS IN ISLAND ENVIRONMENTS, WHERE FOR EXAMPLE A NATIVE PREDATORY BIRD CAN PREDATE UPON A FRUGIVOROUS VERTEBRATE, DISPERSING SEEDS SECONDARILY. THESE COMPLEX MUTUALISTIC PROCESSES ARE REALLY THREATENED BY BIOLOGICAL INVASIONS ESPECIALLY ON ISLANDS, DUE TO THE PARTICULAR AND INTRINSIC TRAITS OF THEIR BIOTAS. ONE OF THE MOST PERNICIOUS INVASIVE MAMMALS IS THE FERAL CAT, WIDELY INTRODUCED ON AT LEAST 179,000 ISLANDS WORLDWIDE. DESPITE THE POTENTIAL IMPACT OF DISRUPTION OF THESE COMPLEX SEED DISPERSAL PROCESSES, THEIR ECOLOGICAL EFFECTS REMAIN LARGELY UNKNOWN. THEREFORE, THE MAIN AIM OF THIS CONTRIBUTION IS TO ASSESS THE IMPACT OF AN INVASIVE VERTEBRATE ON SEED DISPERSAL EFFECTIVENESS AT THE CRUCIAL PHASES OF PLANT RECRUITMENT: SEED DAMAGE, VIABILITY, AND GERMINATION. WE DESIGNED A LABORIOUS CAPTIVITY EXPERIMENT WITH LIZARDS AND CATS TO SIMULATE THE FOUR POTENTIAL WAYS SEEDS COULD BE DISPERSED IN THE WILD: (1) CONTROL PLANTS, (2) LIZARD DROPPINGS, (3) CAT DROPPINGS AND (4) CAT DROPPINGS AFTER CONSUMING FRUGIVOROUS LIZARDS. WE CONSIDERED THOSE FOUR PLANT SPECIES WHOSE SEEDS WERE THE MOST ABUNDANT IN FERAL CAT DROPPINGS IN ALL THE MAIN HABITATS OF THE CANARY ISLANDS. THE MAIN RESULTS INDICATED THAT (1) SPECIES WITH THICKER SEED COAT BETTER RESISTED ABRASION CAUSED BY THE DIGESTIVE EFFECT OF THE INVASIVE CATS AND, (2) NATIVE AND ENDEMIC SPECIES WITH THINNER SEED COATS, THAT HAVE NOT EVOLVED WITH INVASIVE MAMMALS, SUFFERED FROM A NEGATIVE EFFECT ON SEED EFFECTIVENESS. TO OUR KNOWLEDGE, THIS IS THE FIRST STUDY REPORTING THE POTENTIAL DISRUPTIVE IMPACT OF SECONDARY SEED DISPERSAL SYSTEMS CAUSED BY AN INVASIVE PREDATOR AND ONE OF THE SCANT CONTRIBUTIONS EVALUATING SEED DISPERSAL EFFECTIVENESS."
66,"noone","not vetted",NA,"not vetted",66,"CARRASCAL L;ARAGON P;PALOMINO D;LOBO J",2015,"PREDICTING REGIONAL DENSITIES FROM BIRD OCCURRENCE DATA VALIDATION AND EFFECTS OF SPECIES TRAITS IN A MACARONESIAN ISLAND","DIVERSITY AND DISTRIBUTIONS","21","1284-1294","1284-1294","10.1111/ddi.12368","AIM QUANTIFYING SPECIES ABUNDANCES IS COSTLY, ESPECIALLY WHEN MANY SPECIES ARE INVOLVED. TO OVERCOME THIS PROBLEM, SEVERAL STUDIES HAVE PREDICTED LOCAL ABUNDANCES (AT THE SAMPLE UNIT LEVEL) FROM SPECIES OCCURRENCE DISTRIBUTION MODELS (SODMS), WITH DIFFERENCES IN PREDICTIVE PERFORMANCE AMONG STUDIES. SURPRISINGLY, THE ABILITY OF SODM TO PREDICT REGIONAL ABUNDANCES OF AN ENTIRE AREA OF INTEREST HAS NEVER BEEN TESTED, DESPITE THE FACT THAT IT IS AN ESSENTIAL PARAMETER FOR SPECIES CONSERVATION AND MANAGEMENT. WE TESTED WHETHER LOCAL AND REGIONAL ABUNDANCES OF 21 TERRESTRIAL BIRD SPECIES COULD BE PREDICTED FROM SODMS IN AN EXHAUSTIVELY SURVEYED ISLAND, AND EXAMINED THE VARIATION EXPLAINED BY SPECIES-SPECIFIC TRAITS. LOCATION LA PALMA ISLAND, CANARY ISLANDS. METHODS WE FIRSTLY ASSESSED TWO TYPES OF ALGORITHMS REPRESENTING THE TWO MAIN FAMILIES OF SODMS. WE BUILT MODELS USING PRESENCE/ABSENCE (BOOSTED CLASSIFICATION TREES) AND PRESENCE/BACKGROUND (MAXENT) DATA AS A FUNCTION OF RELEVANT ENVIRONMENTAL PREDICTORS AND TESTED THEIR ABILITY TO PREDICT THE OBSERVED LOCAL ABUNDANCES. THE PREDICTED PROBABILITIES OF OCCURRENCE (P-I) WERE TRANSLATED INTO ANIMAL NUMBERS (N) USING THE REVISITED EQUATION N(I)=-LN(1-P-I), AND WE OBTAINED REGIONAL ABUNDANCES (FOR THE WHOLE ISLAND). RESULTS PREDICTIVE ABILITY OF PRESENCE/ABSENCE MODELS WAS SUPERIOR THAN THAT OF MAXENT. AT THE REGIONAL LEVEL, THE OBSERVED AVERAGE DENSITIES OF ALL SPECIES WERE HIGHLY PREDICTABLE FROM OCCURRENCE PROBABILITIES (R-2=93.5\%), WITHOUT OVERALL OVERESTIMATION OR UNDERESTIMATION. INTERSPECIFIC VARIATION IN THE ACCURACY OF PREDICTED REGIONAL DENSITY WAS LARGELY EXPLAINED (R-2=73\%), WITH HABITAT BREATH AND VARIATION IN LOCAL ABUNDANCE BEING THE TRAITS OF GREATEST IMPORTANCE. MAIN CONCLUSIONS DESPITE UNCERTAINTIES ASSOCIATED WITH LOCAL PREDICTIONS AND THE IDIOSYNCRASIES OF EACH SPECIES, OUR PROCEDURES ENABLED US TO PREDICT REGIONAL ABUNDANCES IN AN UNBIASED WAY. OUR APPROACH PROVIDES A COST-EFFECTIVE TOOL WHEN A LARGE NUMBER OF SPECIES ARE INVOLVED. FURTHERMORE, THE INFLUENCE OF SPECIES-SPECIFIC TRAITS ON THE PREDICTION ACCURACY PROVIDES INSIGHTS INTO SAMPLING DESIGNS FOR FOCAL SPECIES."
68,"noone","not vetted",NA,"not vetted",68,"SOHRABI S;VILA M;ZAND E;GHEREKHLOO J;HASSANPOUR-BOURKHEILI S",NA,"ALIEN PLANTS OF IRAN IMPACTS DISTRIBUTION AND MANAGEMENTS","BIOLOGICAL INVASIONS",NA,NA,NA,"10.1007/s10530-022-02884-6","LIKE OTHER DEVELOPING COUNTRIES, IRAN IS THREATENED BY ALIEN PLANTS BECAUSE OF ITS RICH NATIVE BIODIVERSITY, A WIDE RANGE OF CLIMATIC CONDITIONS AND LACK OF REGULATION FOR IMPORTING NEW PLANTS. IN THIS STUDY, WE DESCRIBE THE CHARACTERISTICS, DISTRIBUTION, POTENTIAL IMPACTS OF 52 ALIEN PLANTS BASED ON GENERIC IMPACT SCORING SYSTEM (GISS) ASSESSMENT AND THEIR MANAGEMENT. SPECIES WERE SELECTED FROM THOSE IDENTIFIED TO BE INVASIVE OR WITH THE RISK TO BE INVASIVE OF THOSE INTRODUCED TO IRAN OVER THE PAST 30 YEARS. FROM THE 52 SELECTED ALIEN PLANTS, THE MOST COMMON WERE HERBACEOUS AND ANNUAL PLANTS FROM THE FABACEAE AND ASTERACEAE FAMILIES. SOUTH AMERICA AND EASTERN ASIA ARE THE MAIN AREAS OF ORIGIN TO IRAN. THE HIGHEST PORTION OF NATURALIZED PLANTS ARE DETECTED IN CROPLANDS AS WEED. EICHHORNIA CRASSIPES AND AILANTHUS ALTISSIMA HAD THE HIGHEST GISS ENVIRONMENTAL AND SOCIO-ECONOMIC IMPACT SCORE OF THE 13 INVASIVE ALIEN PLANTS WE IDENTIFIED, AND PUERARIA MONTANA VAR. LOBATA AND HYDRILLA VERTICILLATE HAD THE HIGHEST SCORES OF THE CASUAL AND NATURALIZED SPECIES. THE HIRCANIAN ZONE WAS THE MOST INVADED AREA AND IT COULD BE CONSIDERED AS A POTENTIAL BIOLOGICAL INVASION HOTSPOT IN IRAN. NON-SELECTIVE ALIEN PLANT MANAGEMENT AND A HIGH RELIANCE ON HERBICIDE APPLICATION, ESPECIALLY THOSE WITH HIGH POTENTIAL OF HERBICIDE RESISTANCE, COULD BE MAIN OBSTACLES OF SUCCESSFUL ALIEN SPECIES REMOVAL OR CONTROL. IRAN REQUIRES SPECIFIC MANAGEMENT PROGRAMS TO TACKLE THE INTRODUCTION AND SPREAD OF ALIEN PLANTS AND TO REDUCE THEIR IMPACTS ON BIODIVERSITY, ECOSYSTEM SERVICES AND HUMAN LIVELIHOODS. CONSIDERING THE HIGH DIVERSITY OF CLIMATIC CONDITIONS IN IRAN, FROM ARID TO SUBTROPICAL, STUDIES ON THE EFFECT OF CLIMATE CHANGE ON NEW INVASIONS OR RANGE EXPANSION OF CURRENT INVADERS AND THEIR IMPACTS SHOULD ALSO BE A PRIORITY."
70,"noone","not vetted",NA,"not vetted",70,"LEWIS C;GRANEK E;NIELSEN-PINCUS M",2019,"ASSESSING LOCAL ATTITUDES AND PERCEPTIONS OF NONNATIVE SPECIES TO INFORM MANAGEMENT OF NOVEL ECOSYSTEMS","BIOLOGICAL INVASIONS","21","961-982","961-982","10.1007/s10530-018-1875-0","THE FORMATION OF NOVEL ECOSYSTEMS BY NON-NATIVE SPECIES POSES MANAGEMENT CHALLENGES THAT ARE BOTH SOCIALLY AND ECOLOGICALLY COMPLEX. NEGATIVE ATTITUDES TOWARDS NON-NATIVE SPECIES CAN COMPLICATE MANAGEMENT IN CASES WHERE NON-NATIVE SPECIES PROVIDE ECOSYSTEM SERVICE BENEFITS. DUE TO THEIR INTENTIONAL INTRODUCTION OVER A CENTURY AGO, NON-NATIVE MANGROVES IN HAWAI'I PRESENT A UNIQUE CASE STUDY. ALTHOUGH SOME HAVE CALLED FOR ERADICATION OF MANGROVES FROM HAWAI'I, AN ACTIVE MANAGEMENT APPROACH MAY ULTIMATELY OFFER THE GREATEST BENEFITS TO BOTH THE ECOSYSTEM AND SOCIETY BY ALLOWING MANGROVES TO PERSIST IN LOCATIONS WHERE THEY PROVIDE HABITAT AND CRABBING ACCESS, WHILE LIMITING THEIR EXTENT IN OTHER LOCATIONS TO PROTECT NATIVE BIRD HABITAT AND ALLOW FOR BEACH AND OCEAN ACCESS. WE EVALUATED (1) ATTITUDES AND PERCEPTIONS ABOUT NON-NATIVE MANGROVES, (2) FACTORS INFLUENCING THESE ATTITUDES, AND (3) SUPPORT FOR DIFFERENT MANAGEMENT APPROACHES BY SURVEYING RESIDENTS OF MOLOKA'I, HAWAI'I (N=204). NEGATIVE ATTITUDES TOWARDS MANGROVES WERE INFLUENCED BY A LACK OF RELIANCE ON MANGROVES FOR BENEFIT AND A CONCERN ABOUT THREATS TO MOLOKA'I'S COAST. ACTIVE MANAGEMENT WAS SUPPORTED BY 88\% OF RESIDENTS, WHILE 41\% SUPPORTED ERADICATION. AMONG THE 88\% IN FAVOR OF ACTIVE MANAGEMENT, 24\% OF WRITTEN IN RESPONSES EXPRESSED A NEED FOR MAINTAINING THE BENEFITS OF MANGROVES AND 67\% DESCRIBED REDUCING THE NEGATIVE IMPACTS, WHILE 4\% ACKNOWLEDGED BOTH THE BENEFIT AND HARM THE SPECIES HAS ON THE ENVIRONMENT. AS SUCCESSFUL NON-NATIVE SPECIES MANAGEMENT MAY BE DEPENDENT ON LOCAL SUPPORT, WE EMPHASIZE THAT UNDERSTANDING HUMAN ATTITUDES AND PERCEPTIONS IS BENEFICIAL FOR NON-NATIVE SPECIES MANAGERS IN ANY LOCATION. RESULTS FROM OUR STUDY HIGHLIGHT THE IMPORTANCE OF UNDERSTANDING SOCIAL ATTITUDES TOWARDS NON-NATIVE SPECIES MANAGEMENT STRATEGIES FROM PROPAGATION TO ERADICATION. WE CONCLUDE WITH A FRAMEWORK FOR INTEGRATING STAKEHOLDER ATTITUDES AND BELIEFS INTO NOVEL ECOSYSTEM MANAGEMENT."
